goods_no,review_title,rating_score,origin_url,review_text
17254345,역사의 의미를 진지하게 탐구하다!,8,https://sarak.yes24.com/review/17522576,"이제는 고전의 반열에 오른 E.H. 카의 < 역사란 무엇인가 > 를 다시 읽으면서 , ‘ 역사는 결국 승자의 기록일 뿐 ’ 이라는 사실을 새삼 되새겨볼 수 있었다 . 이 책의 초판은 1961 년 케임브리지 대학에서 펼친 6 번의 강연 내용을 정리한 원고를 엮었으며 , 저자의 사후인 1987 년에 개정판이 출간되었다고 한다 . 저자는 이 책에서 역사의 의미를 진지하게 제기하면서 , 역사가의 관점이 무엇보다 중요하다는 관점을 견지하고 있다 . 결국 역사기록이란 역사가에 의해 선택된 사실로 구성되기에 , 그 과정에서 승리한 이들의 입장이 반영될 수밖에 없음을 강조하고 있다고 하겠다 . 그렇기에 역사가의 역할이 그만큼 막중하다는 것을 역설한 주장으로 이해된다 .

저자는 먼저 ‘ 역사가와 사실 ’ 이라는 제목의 1 장에서 , ‘ 완전한 역사의 서술 ’ 이 가능하다고 보는 입장에 회의적인 입장을 표하고 있다 . ‘ 역사란 확인된 사실의 집성으로 이루어진다 ’ 는 표현에서 알 수 있듯 , ‘ 역사가는 사실을 얻어 집에 가지고 가서 조리하여 자기가 좋아하는 방식으로 식탁에 내는 것 ’ 과 다르지 않다고 강조한다 . 수많은 사건들 가운데 ‘ 역사가는 필연적으로 선택 ’ 을 하게 되며 , ‘ 역사적 사실의 지위는 해석의 문제에 의존 ’ 할 수밖에 없다는 것이다 . 결국 ‘ 역사가의 주임무는 기록이 아니라 평가하는 일 ’ 이기에 , 동일한 사건일지라도 어떻게 평가하느냐에 따라서 그 의미가 전혀 다르게 이해될 수 있다고 하겠다 . 그리하여 이 항목의 말미에 ‘ 역사란 역사가와 사실 사이의 부단한 상호작용의 과정이며 , 현재와 과거 사이의 끊임없는대화 ’ 라는 최초의 답변을 제시하고 있다 .

2 장의 제목은 ‘ 사회와 개인 ’ 이라는 주제를 다루고 있으며 , 그 내용은 ‘ 역사가와 사실 사이의 상호작용이라는 과정은 추상적이고 고립된 개인과 개인의 대화가 아니라 , 오늘의 사회와 어제의 사회 사이의 대화 ’ 라는 관점으로 요약된다 . 따라서 대부분의 역사 기술이 위인 중심으로 기록되는 것은 불가피할지라도 , ‘ 위인이란 역사적 과정의 산물이면서 대행자이고 , 동시에 세계의 양상과 인간의 사상을 바꾸는 사회의 여러 힘의 대표자이며 창조자인 뛰어난 개인임을 인정 ’ 할 필요가 있음을 역설한다 . 이러한 견해는 특정 인물 중심으로 역사를 이해하는 방식의 문제점을 지적하는 것이라고 하겠는데 , 이른바 ‘ 위인 ’ 이리고 칭해지는 인물들도 결국 그 사회의 전개 과정에서 자연스럽게 돌출되었다는 사실을 상기시켜주고 있다 . 물론 그러한 인물들이 당대의 사회를 주도적으로 이끌어가면서 역사에 명암 ( 明暗 ) 을 드리울 수도 있음을 주지할 필요가 있다고 하겠다 .

‘ 역사와 과학과 도덕 ’ 이라는 제목의 3 장에서는 다른 학문 분야인 과학과 도덕이 역사와 어떻게 연관되는지를 설파하고 있으며 , 이어지는 4 장에서는 ‘ 역사에서의 인과관계 ’ 의 문제를 심도있게 다루고 있다 . 아울러 ‘ 진보로서의 역사 ’ 라는 제목의 5 장에서 , 저자는 ‘ 진정한 의미의 역사는 역사 그 자체에서 방향감각을 발견하고 그것을 수용하는 사람만이 쓸 수 있 ’ 음을 강조하고 있다 . 역사를 기술함에 있어 사회관을 반영하는 것이 중요하다고 강조하면서 , 이러한 관점은 자연스럽게 마지막 6 장의 ‘ 넓어지는 지평선 ’ 이라는 주제로 자신의 낙관주의적 관점을 제시하는 것으로 결론을 맺고 있다 .

저자가 자신의 논거를 펼치기 위해 인용한 내용들이 기존의 서구 역사를 다루는 문헌들에 전적으로 의존하고 있어 , 세세한 내용을 이해하는 것이 결코 쉽지 않았다 . 그러나 독자들에게 역사의 본질을 제대로 파악할 수 있도록 조언을 던지고 , 또한 ‘ 역사를 어떻게 바라볼 것인가 ’ 하는 문제에 대한 나름의 방향을 제시하고 있다고 할 수 있다 . 그리하여 역사란 단순한 사건의 연대기의 종합이 아니라 , 역사가의 임무가 특정 사건의 의미를 인지하고 그에 대한 해석과 평가를 내리는 것이 중요하다는 것을 일깨워주고 있다 . 따라서 절대적이고 완전한 역사라는 것에 의문을 던지면서 , 어떤 관점으로 바라보느냐에 따라 역사는 새롭게 해석되고 평가될 수 있다는 상대주의적 관점을 읽어낼 수 있다고 하겠다 .( 차니 )"
17254345,151. 90. 역사란 무엇인가,6,https://sarak.yes24.com/review/10212260,"학창 시절 역사책의 서문에 꼭 나왔던 E.H. 카의 ‘ 역사란 무엇인가 ’ 라는 책 . 그리고 고전으로서 많은 이들이 추천하는 책이기도 했다 . 그래서 덜컥 샀던 것 같다 . 책을 받고서는 쉽사리 펴 볼 엄두가 나지 않아 , 한동안 고이 모셔두다가 요 근래 용기가 나서 꺼내봤다 . 하지만 결국 실패하고 잘 덮어서 다시 고이 모셔놓기로 했다 .

어느 책 설명에는 난이도가 보통이라고 되어 있었다 . 그런데 난 왜 이렇게 읽히지 않는걸까 ? 내 머리가 얼마나 굳었으면 , 안 읽히는 걸까 싶었다 . 한동안 너무 수월한 책들만 읽은 걸까 ? 이 책을 읽으며 좀 더 지적인 양식을 쌓을 수 있을까 기대했는데 , 5 일을 질질 끌며 읽다가 결국은 포기했다 . 아직 이 책을 읽을 만큼의 준비가 되지 않았던 것 같기도 하다 .

저자는 많은 이들이 기본적으로 어느 정도의 역사에 대한 소양을 지니고 있을거라 여기고 서술한다 . 그렇다 보니 , 너무 많은 영국의 역사가들부터 어려운 저서들도 많이 나온다 . 이는 나의 배경적 지식이 부족한 탓이리라 . 문장도 너무 긴 것들도 많고 , 뭔가 중첩되고 중첩되어 길어진 듯한 문장들에 정신이 혼미해지곤 했다 . 문장은 간결하고 명료한 게 좋다고 이야기하는 책들에 너무 익숙해져 있었던 것 같다 .

게다가 번역체가 너무 어렵다 . 정말 영어 초벌 번역을 해 놓은 건 아닌가 싶을 정도의 느낌도 들었다 . 혹시 원서로 읽으면 이 정도로 어렵지는 않을까 ? 원서로 구매해야 하나 싶은 생각이 들 정도였다 . 유시민 작가가 이 책에 그렇게 호평을 하고 강의도 하셨다던데 , 그걸 구해서 봐야 하나 싶은 생각이 든다 .

역사가 어려운 것이라는 건 확실히 알았다 . 역사라는 것을 단순히 사실들의 모음이라고 여기던 내가 얼마나 큰 착각을 하고 있었던 건지 . 역사서를 잘 읽으려면 그 책을 쓴 역사가에 대해서 고민해봐야 하고 , 역사가에 잘 알려면 그 시대적 상황을 잘 파악해야 한다는 이야기는 확실히 이해했다 . 역사가라는 개인도 결국에는 사회의 물살에 한 모퉁이에서 그것을 관찰하고 , 투영해내기 때문이라고 저자는 전했다 .

더 이해해보고 싶고 , 공부해보고 싶은데 . 다시 한 번 만날 기회가 있기를 바란다 ."
17254345,역사란 무엇인가 - E.H. Carr,9,https://sarak.yes24.com/review/9366611,"역사란 무엇인가 E.H. 카(Edward Hallett Carr) 지음 김택현 옮김 까치 출판 에드워드 핼릿 카는 '역사란 무엇인가'나 '소련사'를 비롯한 많은 역사서를 집필한 위대한 역사가이며 케임브리지 대학교 트리니티 칼리지를 졸업하고 교육자와 역사가로서 왕성한 활동을 했다. 역사란 무엇인가는 누구나 제목을 들어봤을만큼 널리 알려진 권장도서이다. 역사는 무엇이고 어떻게 후대에 전달되어야 하는가에 대한 의견은 분분할 수 있다. 사실 그대로를 전달하는 것이 목적인지, 시대적 배경에 맞춰 역사가의 사관이 개입되어야하는지는 확신하기 쉽지 않다. 그러나 역사적 사실이라고 일컬어지는 많은 자료나 근거가 선택되고 쓰여진 시점부터 역사가의 개입이 들어갈 수 밖에 없음은 부정할 수 없다. 카이사르 말고도 '루비콘 강'을 건넌 수 많은 사람들이 있지만 사실 자체보다 역사적 의미가 깃든 사실이 의미가 있기에 역사가는 사실 가운데 역사적 중요성을 띠는 사실을 쫓는 것이다. 역사의 사실들은 순수한 형태로 존재하지 않으며 또한 존재할 수도 없기 때문에 결코 '순수한' 것으로 다가서지 않는다. 그것들은 기록자의 마음을 통과하면서 항상 굴절된다. 역사가는 자신이 다루고 있는 사람들의 마음과 그들의 행위의 배후에 있는 생각을 상상적으로 이해해야 할 필요가 있다. 우리는 오로지 현재의 눈을 통해서만 과거를 조망할 수 있고 과거에 대한 이해에 도달할 수 있다. 역사가는 그가 살고 있는 시대에 속하는 사람이며, 인간의 실존조건 때문에 자신의 시대에 얽매일 수 밖에 없는 존재이다. 역사가의 기능은 과거를 사랑하거나 과거로부터 자신을 해방시키는 데에 있는 것이 아니라, 현재를 이해하기 위한 열쇠로서 과거를 지배하고 이해하는 데에 있다. 역사란, 역사가와 역사적 사실들의 끊임없는 상호작용 과정, 현재와 과거 사이이 끊임없는 대화다. 역사가가 역사적 사실을 말하고자 할 때, 해당 사실의 배경을 숙지하고 역사가 자신이 살고 있는 시대의 환경에 대한 이해도 필요하다. 인간은 사회적 동물로 사회와 개인은 서로에게 필요한 요소이며 종속적이라기 보다는 상호보완적이라고 칭할 수 있다. 역사가 자신이 살고 있는 시대와 환경에 의해 스스로 영향을 받는 개인이며 철저히 객관적 사실로만 역사를 적어나갈 순 없다. 역사적으로 의미있는 사실이라고 넣은 것들조차 역사가의 입장과 가치관이 기여하고 역사적 사건이 발생한 시대의 배경과 인물에 대한 이해가 필요하다. 독단적인 역사가가 되기 보다는 포용적 시각으로 자신이 살고 있는 현실과 자신이 적고자 하는 역사적 사건의 배경(인물의 심리를 포함한)을 포괄적으로 이해할 수 있어야 한다. 부르크하르트의 말을 빌리면, 역사란 '한 시대가 다른 시대 속에서 찾아내는 주목할 만한 것에 관한 기록'이다. 과거는 현재에 비추어질 때에만 이해될 수 있다. 또한 현재도 과거에 비추어질 때에만 완전히 이해될 수 있다. 인간이 과거의 사회를 이해할 수 있도록 해주는 것, 그리고 현재의 사회에 대한 인간의 지배력을 증대시키는 것, 이것이 역사의 이중적인 기능이다. 역사를 기술하는데 있어 인과론을 무시할 수는 없다. 어떤 역사적 사건이 발생할 때 원인에 따른 결과로서 사건이 발생하는 것이며 그 원인은 하나이기 보다는 다수의 원인이 복합적으로 작용하게 된다. 역사를 현명하게 바라보는 사람은 다양한 원인을 알고 분석할 뿐 아니라 해당 원인들간의 서열관계를 정리할 수도 있어야 한다. 역사를 바라보는 시각은 다양성에 기초를 두고 있지만 다양한 원인을 단순화하고 통일된 견해를 도출해내는 것도 필요하다. 역사적 사건이 발생한 배경(구조적 측면, 생물학적 측면, 경제적 측면, 형이상학적 측면, 심리적 측면 등)을 포괄적으로 담고자하는 노력과 동시에 어떤 원인이 기폭제가 되었는지, 어떤 원인이 가장 큰 영향을 미쳤는지를 파악하고 각각의 원인들의 상관 관계와 상하 관계를 정리할 수 있어야 한다. 역사는 정적이라기 보다 역동성을 지니고 움직인다. 역사가로 인해 탄생하고 기록되어지는 과거와 현재의 대화와 같다. 현재는 과거의 미래이며 미래의 과거이다. 역사가는 역사가 움직여가는 어떤 방향을 가정하고 있고 역사가 자신은 의식하지 못한다 할지라도 그 방향은 전체적으로 올바른 방향이고 인류를 보다 좋은 상태로 이끈다고 믿어왔다. 역사의 진보는 직선적이라기 보다 파동을 그리기도 하고 간혹 후퇴를 겪기도 하지만 점진적으로 정진하는 모습을 띤다. 역사적 사건이 특정 집단이나 국가에게는 쇠퇴하는 것처럼 보일지라도 보다 넓은 범위를 전체적으로 살폈을 때 진보하고 있다. 최근의 역사가일수록 더 많은 과거를 객관적 시선으로 볼 수 있기에 역사적 사건에 대한 객관적 판단을 내리기가 수월하다. 즉, 더 많은 시간을 축적한 과거와의 대화를 통해 보다 더 넓고 깊게 이해할 수 있는 것이다. 역사에서의 객관성이란 현재에 존재하는 고정불변의 판단기준에 의존하거나 의존할 수 있는 것이 아니라 오직 미래에 남겨진 그리고 역사 과정이 전진함에 따라서 발전하게 되는 그런 기준에 의존하거나 의존할 수 있다. 역사는 이성의 발휘를 통해서 환경을 이해하고 그것에 작용을 가해온 인간의 오랜 투쟁이다. 사람들이 시간의 경과를 자연적 과정(계절의 순환이나 사람의 일생과 같은)으로 생각하는 것이 아니라 인간이 의식적으로 연루되고 의식적으로 영향을 줄 수 있는 특정한 사건들의 연속이라고 생각하기 시작할 때, 역사는 시작된다. 16세기 이후로 지중해 패권이 대서양으로 옮겨가고 20세기에 들어서며 영어권 국가, 특히 미국으로 세계적 패권이 이동하였다. 역사가 자신이 어떤 사회의 구성원이며 어떤 국가의 국민이기에 사적인 감정과 가치관을 완전히 배제할 수 없고 그에 따라 역사적 관점이 서구 중심적(현대에 들어서는 영어권 국가 위주)으로 진행되고 있으나 중국을 비롯한 그 외의 나라들에 대한 시각을 견지하고 객관적인 시각을 갖고자 하는 노력이 필요하다. 역사가가 속한 사회 뿐이 아닌 다양한 사회의 다각적인 부분을 최대한 객관적으로 볼 수 있어야 한다. 우리는 ""사실은 스스로 이야기한다""고 생각하지만 이것은 진실이 아니다 ""사실은 역사가가 허락할 때에만 이야기한다."" 다른 책과 달리 분량이 적은데도 읽는데 많은 시간을 소모했지만 역사서나 철학서를 읽을 때 E.H. Carr의 '역사란 무엇인가'가 길잡이가 되어줄 수 있으리라 생각한다."
17254345,역사를 해석하는 바른 시각을 가지게 하는 책,10,https://sarak.yes24.com/review/9820954,"내가 역사에 관심을 가지게 된 것은 어렸을 때 읽은 '삼국지'의 영향이 컸다. 어릴 적 책을 좋아하시던 외 할아버지가 읽다가 놓고 가신 삼국지 전집 10권을 줄거리와 인물들을 다 외울 만큼 반복해서 읽었던 기억이 난다. 어린 마음에 영웅들의 허망한 죽음과 각 나라의 흥망성쇠를 보면서 나름 역사 사적 의문을 던지곤 했다. '왜 유비는 저렇게 허망하게 죽었을까?' '그때 제갈공명의 조언을 들었으면 어땠을까?' '그때 바람이 불지 않았으면 전쟁의 결과가 바뀌었을까?'와 같은 생각이었다. 청소년이 되면서 역사소설에 관심을 가지며 월탄 박종화나 이병주 작가의 역사소설 등을 읽기 시작했다. 성인이 된 후로는 철학과 역사에 관심을 가지며 역사 속에 흐르는 거대한 법칙에 대해 알려고 했다. 헤겔이 말하는 '세계 이성'이나 칸트가 말하는 '이성의 간계' 등이 실제로 존재하며 이것들이 역사를 어떠한 목적을 향해 흘러가고 있다는 생각을 하게 되었다. 그리고 이것을 깨달으면 세상과 개인의 삶을 좀 더 지혜롭게 살 수 있지 않을까 라는 조금은 이상적인 생각을 하기도 했다.

몇 년 전 고 노무현 대통령과 부림사건을 다룬 [변호사]라는 영화를 재미있게 보았다. 그 영화 속에서 이적단체를 구성한 것으로 누명을 쓴 피고인의 죄명 중 하나가 E.H. 카의 [역사란 무엇인가]를 읽은 것이었다. 그때 내가 찾는 법칙들이 어쩌면 이 책에 들어 있을지도 모르고, 군사독재 정권이나 권력자들은 그 법칙을 대중들이 아는 것을 싫어해서 이 책을 금서로 정하지 않았을까 하는 생각도 하게 되었다. [역사란 무엇인가]를 읽고 나서 결론부터 이야기하자면, 이 책에는 그런 역사의 법칙이나 역사를 움직이는 보이지 않는 손, 역사가 흘러가는 목적 등에 대한 이야기가 없다. 오히려 이 책은 그런 것들을 추구하는 것을 역사와는 다른 것으로 본다. 이 책은 너무나 냉철하게 역사가와 역사가 직면하고 있는 현실을 대면하게 해 준다. 그럼에도 그 역사를 통해 우리가 교훈을 찾고, 세상과 삶이 변화될 수 있다는 희망을 잃지 않게 해 준다. 이 책은 먼저 근대까지 가지고 있었던 아래와 같은 역사에 대한 환상을 제거하는 것으로부터 시작한다. 첫 번째는 '역사는 과거의 사건들을 사실 그대로 재현할 수 있다'는 환상이다. 우리는 흔히 과거의 사실들을 그대로 글로 옮기는 것을 역사라고 생각하고, 다른 방식으로 역사를 기록하는 것을 '역사왜곡'이라고 생각한다. 그런데 카는 마치 시장 자판대의 놓여 있는 생선을 고르는 사람처럼, 역사가는 수많은 사실들 중에서 자신의 필요에 따라서 역사적 사실을 선택하는 사람이라고 말한다. 과거에는 수많은 사건들이 있었고, 앞으로도 수많은 사건들이 있을 것이다. 그 사건들이 모두 역사일 수는 없다. 역사가가 그 사건을 선택해서 그것에 의미를 부여할 때 그것이 비로소 역사가 되는 것이라고 카는 말한다. 두 번째는 '역사가는 자신이 속한 시대와 사회와 동떨어져서 역사를 바라볼 수 있다'는 환상이다. 우리는 역사가란 자신의 속한 시대와 사회에 관계없이 객관적으로 역사를 바라보아야 한다고 생각한다. 그러나 카는 개인은 사회 속에 속해 있기에 그 사회의 생각에서 완전히 자유로울 수 없다고 말한다. 결국 역사가는 자신이 속한 시대와 사회의 관점으로 과거의 역사를 조망하는 것이다. 세 번째 '역사에는 일정한 법칙이 있다'는 환상이다. 구약성경의 히브리 역사관과 중세의 기독교 역사관, 그리고 근대의 헤겔과 칸트에 이르기까지 역사에는 신적인 섭리가 있고, 그 섭리가 역사를 일정한 목적으로 이끌고 간다고 믿었다. 헤겔은 그것을 '세계 이성'이라고 말했고, 칸트는 '이성의 간계'라고 말했다. 아담 스미스 역시 '보이지 않는 손'을 이야기하고, 마르크스 역시 '역사의 발전 단계'를 이야기한다. 그러나 카는 이런 신적인 법칙에 기대어 역사를 조망하는 것은 역사가로서 자격이 없다고 말한다. 카는 역사를 탐구하는 것을 조커가 없이 포커게임을 하는 것으로 비유한다. 신적인 섭리에 기대한 역사를 바라보는 것이 아닌, 이성의 사고로 역사를 바라봐야 한다고 말한다. 이 책에서 카의 관점을 따라가다 보면 결국 역사는 보는 사람의 관점에 따라 이리저리 바뀔 수 있는 것이 아니냐는 생각이 들게 된다. 결국 중국의 동북공정이나 아베의 역사왜곡, 박근혜 정부의 국정교과서도 모두 자신의 관점으로 역사를 바라보는 것이 아니냐는 생각이 들면서, 역사의 진리성에 대한 회의를 품게 된다. 그런데 여기서 입시교육 때나 평상시 몇 번이나 반복해서 들었던 카의 유명한 역사에 대한 명제가 나온다.

카는 역사가란 과거와 대화하면서 과거의 사실들을 현시대를 위하여 선택하여 역사적인 해석을 하는 사람이라고 말한다. 이 해석의 과정이란 끊임없이 '왜?'라는 질문을 던지는 것이다. 왜 그 사건이 일어났을까? 왜 그 시대는 그렇게 허망하게 종말을 맞이했을까? 왜 그 시대의 사람들은 그렇게 고통을 당했을까? 카는 이 '왜?'라는 질문의 대답을 앞에서 이야기 한 신적인 법칙이나 우연에서 찾아서는 안 된다고 말한다. 역사가가 '왜?'라는 질문의 대답을 찾는 것은 그 대답을 통해 현 사회의 발전을 주기 위해서이다. 예를 들어 스미스라는 사람이 교통사고로 사망했다. 스미스의 사고의 원인은 다양한다. 우연히 그 시간 그 장소에 간 것, 또는 교통 체계의 문제, 운전자의 미숙, 차량의 결합, 어쩌면 우연이나 신적인 계획 등이 사고의 원인일 수 있다. 그러나 사고조사자들은 그 많은 요소 중에서 교통사고와 사망자를 줄일 수 있는 원인을 이성적으로 찾아서 그것을 제시하는 것이다. 카는 역사가도 마찬가지라고 말한다. 역사의 수많은 '왜?'라는 질문에 대한 대답 중에서 이 시대의 발전을 위해서 필요한 대답을 찾는 것이다. 이것이 카가 말하는 역사가 현재와 과거의 끊임없는 대화라고 말하는 이유이다. 결국 우리는 과거의 사건들을 선택해서 현시대와 사회의 관점으로 역사를 해석하지만, 그 해석은 시대와 사회의 발전을 위한 유용한 해석이어야 한다는 것이다. 카는 당시 역사의 발전에 대한 부정적인 시각이 팽만한 시기에도 역사의 발전에 대한 희망을 잃지 않았다. 그는 역사가가 이성을 통해 역사의 교훈들을 발견해 나간다면, 결국 점진적으로나 사회가 발전할 것임을 믿었고, 그것을 역사가가 사명으로 보았다. 그러기에 그는 당시 시대의 보수적인 역사관을 비판한다.

그리고 '그래도 역사는 움직인다'는 말로서 그의 글을 마무리한다.

E.H 카가 [역사란 무엇인가]라는 책에서 던지는 질문들과 고민들은 아직도 이 시대에도 우리에게 유효하며, 이 책은 우리가 어떤 방향으로 역사를 탐구하고 정립해야 할지를 안내해 주는 역사의 교과서 같은 책이다."
