goods_no,review_title,rating_score,origin_url,review_text
17254345,역사란 무엇인가 10,7,https://sarak.yes24.com/review/9786105,"125쪽

알이 푸엥카레는, 내가 앞의 강연에서 인용한 저작에서, 과학이 다양성과 복잡성을 향해 그리고

동시에 통일성과 단순성을 향해 전진하고 있으며, 이 이중적이면서 명백히 모순적인 과정은 인식의

필요조건이라고 지적했다. 이것은 역사에 대해서도 마찬가지로 진리이다. 역사가는 자신의 연구를

확장하고 심화시킴으로써 왜?라는 질문에 대한 답변을 점점 더 많이 끊임없이 축적한다. 우리의 답

변의 수와 범위가 엄청나게 증가된 것은 최근에 이루어진 경제사, 사회사, 문화사, 법제사 등으로의

분화 덕분이기도 하다.

버트런드 러셀이 학문에서의 모든 발전은 최초에 관찰된 조야한 통일성으로부터 훨씬 벗어나 원

인과 결과의 더욱 큰 분화로 그리고 관련이 있다고 인정되는 원인들의 범위의 끊임없는 확장으로

우리를 이끈다고 말했을 때, 그것은 역사학의 상황을 정확히 표현하는 말이었다. 그러나 역사가는

과거를 이해하려는 충동을 가진 까닭에 과학자와 마찬가지로 수많은 답변들을 단수화하는 일, 답변

들의 상하관계를 정하는 일, 무질서한 사건들과 무질서한 특수 원인들에 일정한 질서와 통일을 부여

하는 일 등을 동시에 하지 않으면 안 된다, -중략-

그러나 역사가가 원인을 다양화해야할 뿐만 아니라 단순화하는 작업도 해야만 한다는 사실에는 변

함이 없다. 역사도 과학과 마찬가지로 이렇듯 이중적이면서 명백히 모순적인 과정을 통해서 전진하 는 것이다.

이 다음에는 역사에서의 결정론과 역사에서의 우연 혹은 클레오파트라의 코라는 것에 대해 이야

기가 나오네요. 다음에 다시 적겠습니다.

이래저래 역사는 참 알기 힘든 요물입니다. 너무 재미나기도 하고요. ^^"
17254345,역사란 무엇인가?,10,https://sarak.yes24.com/review/16897260,"역사란 무엇인가? 학교 다니면서 배웠던 정의를 여기서 알게 되었다. 역사의 고전이라고 하는 책인데 이제서야 읽었네. 책 내용이 그리 편하게 읽히지는 않아서 오랜 시간 동안 잡고 있었다. 작가가 말하는 역사의 정의에 대해서 공감하고, 몇몇 생각들을 하게 되었다. 내 인식의 범위를 넓혔다고 할까? 그렇지만, 깊이 읽지 못해서 다음에 다시 읽어야 겠다는 생각을 또 하게 된다.^^"
17254345,역사란 무엇인가,10,https://sarak.yes24.com/review/13587137,"지은이 E.H카는 유명하다. 이는 들어본 적이 있는 이름으로도 유명하다. 진짜, 역사란 무엇인가 라는 책을 읽어본 적이 없더라도 책 제목만은 대충 들어서 잘아는 이들이 많다는 말이다.

그가 말한 역사란 ‘과거와 현재의 대화’ 또는 ‘과거의 사실과 현재의 역사가의 대화’는 인구에 회자된 유명한 문구다. 그런데 이 말이 지은이가 한 말인지는 잘 모른다. 으레 역사란 과거와 현재 그리고 미래를 일관하는 것이라는 보편성때문에 그렇게들 수긍하는 것이리라. 이는 우리 역사문헌에도 등장한다. 자신의 과거의 행적이 오늘을 있게 했고, 오늘의 행적이 내일의 나를 결정하게 될 것이라는 말이다.

아무튼 지은이가 강조하는 것은 과거 자체 혹은 과거의 사실이 아니라 그것을 가지고 역사담론과 역사지식을 생산하는 ‘현재의 역사가’이다. 이미 지나가버린, 그런 의미에서 스스로 말할 수 없는 과거의 사실들을 대화의 장에 불러들이는 것은 현재의 역사가이기 때문이다. 그러므로 카는, 과거는 현재의 역사가들이 가지고 있는 현실 사회에 대한 문제의식에 따라 구성되며, 과거의 사실들이 어떠했는가보다는 역사지식을 생산하는 역사가가 현재의 사회와 현실에 대해서 어떤 문제의식과 가치관을 가지고 있는지가 더 중요하다고 말한다. 그런데 지은이는 역사가의 현재에 대한 문제의식과 그의 가치관은 결국 미래에 대한 전망과 연관된다고 주장한다. 과거를 돌이켜볼 때 인간은, 비록 우여곡절은 있었더라도, 더 나은 사회를 향해 발전해왔고, 그러한 진보의 과정 자체가 인간이 합리적 이성을 지닌 존재임을 역사적으로 증명한다. 따라서 미래에도 인간의 역사는 더욱 합리적인 방향으로 변화하고 진보할 것인데, 장차 과거가 되어 있을 현재의 사회가 더 민주적이고 더 평등한 사회로 진보해갈 것이라는 이 변화에 대한 신념이 현재의 역사가와 과거의 사실 사이에 이루어지는 대화의 성격을 결정하고, 과거에 대한 역사가의 인식 내용을 결정한다고 말한다. 이 대목은 지금도 여전히 그 의미가 살아있다."
17254345,인류의 기억으로서의 역사,10,https://sarak.yes24.com/review/11341338,"우리는 자연 및 인문 환경에 대한 인간의 기록이 시작된 시점을 기준으로 그 이전을 선사사대 , 이후를 역사시대라 부른다 . 과거 사람들이 기록을 시작하게 되었을 시점 이후로 이 지구상에는 셀 수 없이 무수한 사건들이 있었을텐데 , 그렇다면 그때부터 지금까지 존재했던 모든 사건들을 통틀어 역사라고 할 수 있을까 . 아마도 그 모든 일들을 역사라고 하기는 어려울 것이다 . 그런 일들 중 절대 다수는 ( 이번 달 옆집 아저씨 월급이 얼마인지와 같이 ) 몹시 지엽적인 일들이고 , 또는 ( 해가 뜨고 지는 것처럼 ) 패턴을 갖고 반복되는 일들이기 때문에 특별히 유용한 정보를 주지 않기 때문이다 . 따라서 그런 것들은 당대 역사가에게 있어서의 역사로서의 가치 , 즉 굳이 기록되어 후대에 전승될 특별한 이유가 없을 것이다 . 그렇다면 어떻게 수많은 과거지사 중 일부는 역사적 사건이 되는 걸까 .

E. H. 카는 "" 역사적 사건 "" 과 단순한 "" 과거지사 "" 를 구분하여 역사적 사건을 정의하는 것이 바로 역사가의 역할이라고 주장한다 . 역사가는 단순히 과거에 있었던 사건 그 자체를 다룰 수 없다 . 역사가는 어쩔 수 없이 현재라는 시대정신 속에서 그 의식을 형성한 , 현재에 뿌리 내린 의식이기 때문이다 . 따라서 역사가는 좋든 싫은 어느 정도 현재라는 가치관 속에서 과거지사를 바라볼 수 밖에 없는 것이다 . 그 가치관에 따라 과거지사들 사이에는 우선순위가 매겨지게 되고 , 그 중 특히 역사가들이 관심을 갖고 있는 현재의 사안을 잘 이해하게 해 주는 핵심 사건들은 연구를 통해 과거지사에서 역사적 사건으로 승급하게 되는 것이다 . 즉 과거지사일 뿐이었던 옆집 아저씨의 월급 명세서는 훗날 노동자들에 대한 과거 사람들의 처우와 인식을 추론하게 해주는 하나의 역사적 기록으로 변모할 수 있는 것이다 .

그렇다고 역사적 사건이 순전히 역사가의 주관에 따라 생겨나고 지워지는 것도 아니다 . 역사적 사건의 씨앗이 되는 과거지사들은 , 설령 객관적인 언어로 기술될 수 없더라도 어떤 방식으로든 분명 존재했던 일들이기 때문이다 . 즉 그것은 해석을 기다리는 실체이지 , 상상에 기반하는 심상이 아니다 . 그러한 사실적 사건을 엄밀하게 조사하고 규명하는 것은 의무이지 미덕이 아니다 [11 쪽 ]. 과거지사는 마음대로 해석해 낼 성질의 것이 아니라 , 마치 부스러지기 쉬운 유물을 출토하듯 최대한의 정확성을 기하면서 대해야 하는 대상인 것이다 . 이러한 정확성을 기하는 노력에는 과거 사람들을 지배했던 당대의 시대정신을 고려하는 것과 , 현재 내가 속한 시대정신을 감안하는 것 등이 포함될 것이다 . 만약 이러한 기준이 없다면 역사 연구는 그저 상상력의 놀이에 불과한 것이 되고 말 거나 , 현재 일본이 하고 있는 것처럼 현대의 자신을 정당화하기 위해 조작될 수 있는 재료로 전락하고 말 것이다 .

과거지사는 현재에 속한 역사가의 해석을 통해 역사적 사건으로 거듭난다 . 시대가 변하고 역사가가 변하면서 역사적 사건도 변하게 된다 . 이런 점에서 역사는 역사가의 정신과 과거지사 사이의 끊임없는 상호작용이며 , 사실과 해석 사이의 중단 없는 이중 나선이다 . 이는 역사를 기억에 비유할 때 더욱 선명해진다 . 우리의 기억은 과거에 겪었던 일들에 바탕을 두고 있지만 , 우리는 과거의 모든 일들을 기억하지는 않는다 . 우리는 우리에게 중요한 의미를 지녔던 일들을 기억하고 , 또 그것을 되새기고 적용하며 현재를 살아간다 . 이 기억에 대한 스스로의 평가와 해석은 더 많은 시간을 살아가면서 무수한 변화를 겪는다 . 가치관이 변하면서 좋았던 기억은 유치한 것이 되고 , 아팠던 기억은 뜻깊은 것이 된다 . 우리는 기억을 바탕으로 현재를 살아가며 , 현재를 살아가면서 또 새로운 기억을 형성한다 . 단순히 과거에 불과했던 일들은 의미를 지닌 기억이 된다 . 역사도 이와 크게 다르지 않은 것이다 . 이 점에서 역사를 인류의 기억이라 불러도 괜찮을 것이다 ."
17254345,역사란 무엇인가,10,https://sarak.yes24.com/review/9041411,"역사란 무엇인가? 난해한 책이기는 하나 반복해서 읽을만한 가치가 있는 명저이다

사실 한두번 읽어서는 뭐가 뭔지 모를 정도로 어렵다 하지만 반복해서 읽다 보면 전율을 느낄만큼 훌륭한 명저이다 수십전년전에 이렇게 훌륭한 저술 이렇게 훌륭한 역사의식을 제기한 카가 다시금 존경스러워진다

예전 토인비의 역사의 연구를 읽기 시작했다 너무 어려워 포기한 적이 있다.

부디 카의 역사란 무엇인가 이 책을 모든 분들이 열심히 읽어 카나 토인비같은 훌륭한 학자가 한국에서도 나오기를 기대해본다"
17254345,역사라는 소설을 받아들이기 위한 입문서?,9,https://sarak.yes24.com/review/10530297,객관과 주관의 경계에는 역사가 있다고 생각해요. 그 안을 들여다 보는 것이 중요하다고 생각합니다. 이 책은 쉽게 읽혀지지는 않지만 그 경계를 적어도 조금이나마 옳은 시선과 옳지 않은 시선을 구분할 수 있게 도와 줄 것입니다. 말해 뭐할 정도로 유명한 역사는 과거와 현재의 대화라는 말의 틀에서 읽어도 좋을 듯 싶습니다. 그리고 다 읽고 난 후 역사를 이렇게도 정의할 수 있겠구나 그리고 다른 역사가의 사상을 들여다 볼 수 있을 것입니다.
17254345,역사란 무엇인가 : 명전을 읽는 기쁨.,8,https://sarak.yes24.com/review/10189365,"아주 오랫동안 이 책을 꼭 읽어보고 싶었다.

이 책을 문장 몇 개로 만난 지 거의 20년이 다 되어 갔다.

그 문장들과, 그에 대한 명성을 들을 때마다 꼭 읽어봐야지, 읽어봐야지 했는데

고전, 명전이라는 것이 그렇듯 언제든 읽고 싶다고 읽어지는 책은 아니었다.

그래서 몇 번 도전하다 읽지 못 했다.

여유가 생겨 읽게 된 이 책은 참 기뻤다.

워낙 오래되고 유명한 책이기에 새로운 내용을 발견하는 기쁨은 없었다.

하지만 아주 유명한 구절인 '과거와 현재의 끊임없는 대화' 와 같은 구절을 읽자

정말 설레고 약간의 짜릿함도 느껴졌다."
17254345,역사를 역사학자가 어떻게 보는가,8,https://sarak.yes24.com/review/9596553,"저자가 오래전에 강의하며 했던걸 정리한 글입니다.

이책을 알게된 건 오래전부터 알고 있었으나 유시민작가가 추천하는걸 보고

읽게 되었습니다.

역사의 여러가지 모습과 사람들이 생각하는 역사에관한 선입견등에 관한

얘기를 하고 있습니다. 저자가 영국사람에 빅토리아 후반기 부터 살았던

사람이고 그때 유명한 역사학자등과 관한 얘기등도 같이 나옵니다.

역사관련 서적을 좀 읽고 19세기 말과 20세기에 관해서 어느정도

시대에 관한 걸 알고 봐야 이해하기 쉽습니다."
17254345,지금 봐도 놀라운 책,8,https://sarak.yes24.com/review/9477717,"역사란 무엇인가/ E.H.카/김택현/까치/2015

이 책은 우리나라에서 처음 출판되었을 때 부터 꾸준히 인쇄되고 읽혀진 양서의 한권으로 널리 알려져 있습니다. 그러다 21세기에 와서 이 책이 새삼 주목받게 된 이유 중의 하나가 영화 '변호인' 이라고 한다면 과장일까요. 저 역시 그 영화를 보면서 떠올렸습니다. 아, 맞다. 그런 책이 있었지. 그러나 언제나 처럼 읽을 책들과 생활고 사이에서 부심하는 저로서는 개봉된지도 한참 지난 영화를 인터넷으로 다운 받아 보고 나서도 한참이 지나서야 겨우 이책을 샀습니다. 그래도 샀고, 결국 읽었습니다.

사실 생각했던 것 만큼 우와! 하는 느낌이 있었던 책은 사실 아닙니다. 이유는 이 책이 잘못되어서거나 진부해서가 아니고, 이 책이 너무나 영향력이 있었기 때문에 최근에 이르기 까지 이 책이 다른 책에 엄청나게 많이 인용되었던 겁니다. 요즘 어느 정도의 지식이나 교양이 있는 사람들이라면 누구도 역사를 단순히 과거에 있었던 사건들이라고 인식하지 않습니다. 역사가 현재를 바라보는 창이며 미래를 보는 청사진 이라는 말이나, 역사가 과거와 현재의 대화라든가 하는 식으로 말하죠. 그런데 그런 인식이 이 책에 다 담겨 있습니다. 또한 ""신은 역사를 바꿀 수 없었다. 그래서 역사가를 창조했다."" 라는 유명한 경구의 말처럼 역사란 단순한 사실이 아니라 역사적 사실을 기초로 하고 있으며 이 역사적 사실을 뽑아내는 것이 바로 역사가이며 이를 해석해 내어 현재에 비추어 보는 것이 역사라는 언급을 한 것도 아마 이 사람이 처음이 아닌가 합니다. 따라서 역사를 공부하는 이라면 역사책을 볼 때 어떤 역사학자가 썼는지 그리고 그가 어떤 사람인지 확인하는 것도 필수적이라는 거죠.

역사가 다른 학문, 특히 많이 다를 것 같은 과학과도 특별히 다를 것이 없는 학문이라는 것에 대한 언급 역시 발군인데 이 부분은 21세기에 출판된 에드워드 윌슨의 통섭과도 일맥상통하는 부분이 많습니다. 그러니까 윌슨이 말하기 이전에 카는 이러한 학문의 거대한 흐름을 이미 읽어냈던 것이지요. 역사학이라는 학문에도 애덤 스미스, 해겔, 마르크스, 프로이트 등 여러분야의 학자들이 끼친 영향력을 상세히 설명하면서 역사가들이 역사라고 하는 하나의 학문에만 매달리지 말고 지리학이나 경제학이나 회계학이나 과학 등 다른 공부도 하고 전문가들의 도움을 받아야만 한다고 주장하고 있습니다.

카는 아시아의 부흥을 흥미롭게 보고 있고 세계사를 다룬다는 역사가가 중국의 역사를 폄훼하고, 대수롭지 않게 다루는 것에 대해 지나친 유럽중심의 사관이라고 비판을 아끼지 않고 있는데 최근에 읽은 리오리엔트를 떠올리지 않을 수 없었습니다. 역시 고수들 끼리는 통하나 봅니다.

저자는 한 지역(유럽)의 쇠퇴를 인류 역사 전체의 쇠퇴인 것처럼 과장되게 말하는 것을 지나친 비관론으로 보고 인류 역사의 진보에 대한 믿음을 견지하고 있습니다. 사실 역사가 정말 진보하는 것인가에 대해서도 아주 꼼꼼히 따져서 풀어내고 있는데, 인간사에 대한 이성의 작용이 확대되는 것 그리고 그 이성의 작용이 한사람의 통치자에서 소수의 엘리트로 그리고 수많은 군중으로 확대된 것으로 본다면 이것이야 말로 진정한 진보라고 언급하고 있습니다.

현재의 시각으로 본다면 아주 특별하다고 할 것은 없으나 그 이유는 앞에서 언급했듯이 이 길지도 않은 책이 너무나 숱하게 인용된 탓으로 역사학 뿐 아니라 다른 많은 학문들이 이 책에서 계속해서 빚을 지고 있기 때문이 아닌가 생각합니다. 1960년 매카시 광풍이 겨우 꺼질까 말까한 시점에 이런 글을 쓰고 강의를 했다는 걸 생각해 보면 그저 놀라울 따름이며 이런 책이 우리 나라에서 금서였다는 것이 서글프기도 하네요. 역사를 공부하는 사람이라면 반드시 읽어봐야 할 훙륭한 교본임에는 틀림없고 일반 교양서적으로도 매우 훌륭합니다. 아쉽게도 2판을 준비하던 중 저자가 작고하게 되어 후학(물론 이분 역시 역사학자지요)이 그 원고를 발췌하여 싣고 있습니다. 이 역시 읽어볼 만 합니다.

오래 전에 번역했던 책이고 재판이 나오면서 다시 교정을 한 탓인지 아주 힘들지는 않게 읽을 수 있었습니다. 역자에게 감사를 표합니다. 이 책에 대해서 한마디로 표현한다면 이게 좋겠군요. 짧지만, 힘있는 책."
17254345,역사란 무엇인가,8,https://sarak.yes24.com/review/9264569,"아주 오래전에 읽어봤는데 내용이 가물가물해 진 면도 있고, 지금 시점에서 역사에 대한 의미와 우리가 역사를 공부해야 하는 이유를 다시 생각해보자는 생각에 구입해봤다. 다른 얘기지만 예전엔 저렴한 가격의 문고본이 많이 있었는데 요즘은 전체적으로 책값이 많이 오른 거 같다. 이 책도 양장판인지 아니면 뭔진 몰라도 생각보다 가격이 너무 비싸서 일반도서는 구입을 포기하고 이북으로 구입했는데 나온지 얼마나 오래된 고전책인데 문고판 하나 없는 것도 이해가 안되고 전체적으로 가격이 너무 비싼 감이 있다. 책 내용으로 다시 돌아가자면 두번째 읽음에도 여전히 어렵다. 그럼에도 제목처럼 역사란 무엇인지, 역사와 사실의 관계.. 등 역사에 대한 생각을 조금은 정리할수 있는 시간이었다. 쓰고보니 책가격에 대한 불평뿐이군."
17254345,과거에서 미래로,7,https://sarak.yes24.com/review/9942405,"최근의 시국 상황을 보았을 때 우리에게 역사란 무엇이고 후세에 어떻게 보일 것인가라는 생각을 하게 되었습니다 . 그러다가 우연히 발견한 책이 역사란 무엇인가라는 책이었고 한번 읽어보자는 생각으로 손에 들게 되었습니다 .

이 책을 읽으면서 가장 먼저 든 생각은 우리가 생각하는 역사라는 것은 상당한 오해를 가지고 있다는 것이었습니다 . 그리고 이런 역사에 대한 오해가 지금의 문제를 일으키고 사회적 갈등이 되는 요인이 아닌가 하는 생각을 했습니다 .

바르게 안다는 것이 얼마나 중요한 일인가를 생각하게 만든 책이었고 무엇보다 인식의 전환을 할 수 있는 개기를 만들어준 책이라 무척 만족스러운 독서였습니다 .

가장 충격적이었던 것이 역사라는 것이 도덕적이면서도 과학적이라는 면을 강조한 것이었는데 그 기준을 우리는 너무나 자위적으로 지정한다는 부분이었습니다 . 좀 더 객관적이고 합리적으로 시대를 판단하고 거기에 도덕적인 관념까지 덧씌워 과거를 바라보는 것 , 그리고 그런 과거에서 현재의 상황을 분석하고 미래로 나아가는 것에 대한 중요성을 배울 수 있었습니다 .

어렵게만 느껴지던 부분이 있었지만 여러 번의 정독을 통해 이해 할 수 있었고 생각과 탐구를 통해 미래를 준비해야 한다는 것에 인식을 같이하며 오랜만에 좋은 독서를 한 기분이었습니다 ."
