goods_no,review_title,rating_score,origin_url,review_text
65067259,이기적 유전자,9,https://sarak.yes24.com/review/13141992,"나에게 쉽지 않는 도서 [이기적 유전자] 그러면서도 호기심을 가질 수 밖에 없는 도서다. 첫 출간 후 40년이 지났으나 여전히 많은 사람들이 찾는 도서이며 다윈의 [종의 기원]은 개정판을 내놓을 때마다 수정이 들어갔으나 이 책을 그렇지 않다고 한다. 또한 개정판을 계속 출간하면서 저자는 처음 제목을 두고 고민을 했었다. 왜 하필 이기적 유전자 인가? 오히려 부정적으로 보여지는 것인데. 그런데 어찌 보면 유전자는 결국 살기 위해 존재하며 생명을 유지하기 위해 주변과 다른 생명을 이용할 수 밖에 없다.

책은 총 13장으로 이뤄져 있으며 사람은 왜 존재하는가에서 부터 책은 시작이 된다. 이기주의와 이타주의 차이점 사실 이 두가지 중 어느 쪽이 옳은 것인지 알 수 없다. 자연은 번식을 하기 위해 다른 생명체를 이용하기도 한다 여기서 서로 협력해야 하는 경우가 있는데 이는 이타주의 이면서도 결국 자신의 생존을 위한 것이니 이기적이라 할 수도 있다. 그리고 생물은 진화하면서 유전이 되는데 이는 자연 현상이라고 한다. 저자는 유전이 서서히 진화하는 방식으로 책을 소개 하고 있다. 사실, 책은 쉽지가 않아 어느 부분은 알면서도 또 다른 부분은 어렵게 다가왔다.

그 중 유전자의 행동방식을 보면 흥미로운 점도 있는데 뻐꾸기 새의 행동 방식을 보면 왜 남의 새 둥지에 자신의 알을 놓는지 그리고 그 새 둥지의 어미는 자신의 알과 외부의 알을 구분하지 못하고 열심히 뻐꾸기 새에게 먹이를 주는지를 설명하는데 결론은 신경계 때문이라고 한다. 음, 설명을 읽으면서도 인간이 아니기에 아니 인간이어도 꼭 이런 사례가 아니어도 비슷한 사항들을 소개하고 있다. 더 나아가 암수의 전쟁은 여성과 남성의 차이에서도 설명을 하는데 뭐랄까....우선 암컷은 인간 여성과 마찬가지로 가정적인 수컷을 선택한다는 점이다. 최종적으로 교미에 동의하기까지 기다리지 못한 수컷은 성실한 남편이 될 가망성이 없다는 사실은 암컷은 긴 기간동안 구혼자를 골라내어 성실성과 인내를 인정받은 수컷을 선택한다고 한다.

서로의 공생관계, 협력에 대한 부분도 흥미로웠는데 '죄수의 딜레마'는 게임을 두고 두 사람이 서로가 마이너스 또는 플러스가 되거나 아님 둘 중 한 사람이 마이너스가 되는 실험이다. 물론 두 사람도 플러스가 되면 좋으나 사람의 심리는 그렇지 않다. 자신에게 호의를 주면 선을 베풀지만 그렇지 않는 경우는 다른 결과가 나온다. 또 엑셀로드가 말한 독일과 영국의 전쟁다시 두 나라의 군인이 한 행동에 대해서 '보복을 막기 위한 단순한 수단을 넘어 신뢰를 깨뜨린 데 대한 도덕적인 후회를 드러내고 있고, 또 누군가 부상당하지나 않았는지 걱정하고 있다'라는 일화를 말하기도 했다.

이 외에도 기생자와 숙주,문화적 돌연변이 등 소주제문으로 쓰여진 내용들이 많다. 다만, 내가 다 흡수하지 못해 아쉬울 뿐이다. 하지만 한 번 읽고 이 책을 알기엔 너무 욕심이 큰거 같고 어려운 주제인 만큼 책을 몇 번 읽어야 제대로 알거 같다."
65067259,이기적 유전자,8,https://sarak.yes24.com/review/17013023,"너무나도 유명한 책이고, 그래서 나도 읽어야겠다는 생각으로만 시작했다. 사실 많은 이들이 이야기하고, 리뷰만 봐도 어마어마한 양이기에 어렵긴 하겠지만 그래도 읽을만 하겠지..하는 안이한 생각으로 시작했는데,, 사실 내게는 너무나 어려운 책이였는 점을 미리 밝힌다.

""이기적""이라는 말의 의미가 무엇일까? 보통 책을 읽고 나면 세세한면은 잘 이해하지 못해도, 작가가 말하고자하는 큰 그림?!에 대한 의미는 어렴풋이 알것 같았는데, 이 책은 아직도 잘 모르겠다. 지금의 우리가 만들어지게된 유전자는 어떤 것인지, 그것을 왜 이기적이라 명했는지 조차.

살아남았기에 존재하고 있고, 그렇다면 그것은 '강'함을 말하는 것인지, 아니면 그저 무작위의 선택속에서 지금에 이른것인지조차.. 잘 모르겠다.

이타성과 반대에 있는 의미 이기적. 하지만 이타성으로 인해 개체가 호모 사피엔스가 지금까지 살아남은 것인지도 모른다는 내용도 있고, 그렇다면 이 상황 속에서 이기적이란 의미는 어떻게 받아들여야 하는지.. 모호해진다.. 나한테는.ㅠ

그래서 내린 결론은 다시 한번 읽어봐야겠다는 생각이다.

다시 읽고, 다시 정리해 봐야겠다.

참고로 책은 어렵지만, 흥미롭다.ㅋ 이것도 모순일까... 다시 읽기 시작!"
65067259,이기적 유전자,10,https://sarak.yes24.com/review/13161185,"이기적 유전자

이 책은 마치 상상력을 불러일으키는 공상 과학 소설처럼 읽어야 한다.

그러나 이 책은 공상 과학 소설이 아니라 과학서다.

서문

<이기적 유전자>를 읽는 동안 세상을 바라보는 나의 시선에 변화가 생겼다. 주관적이고 느낌적이고 서정적이던 것이 논리적이고 해석적이고 통계적으로 바뀐 부분이 분명히 있다는 것이다.

총 13장에 이르는 대장정의 진화와 유전학에 관한 이야기는 수많은 이론과 예제들을 통해 결국 우리는 생존 기계라는 것을 증명해 주고 있다.

나란 존재는 어디에서 와서 어디로 가는지, 이 땅에 발붙이고 살아가는 동안 최선을 다해 의미 있는 삶을 살다 가도록 열심인 나 자신이었던 것이 사실은 종족 보전과 자기 복제에 열을 올리는 생식의 운반체계에 불과하는 것을 기억해야 한다. 이 임무를 완수하지 못한다면, 살아도 산 것이 아니요, 죽어도 죽은 것뿐인 딱 그만큼의 역할 담당인 것이다.

생존 기계.

유전자는 '자기 복제자'라는 의미로서의 단위이고,

개체는 '운반자'라는 의미로서의 단위다.

리처드 도킨스는 책 제목으로 <이기적 유전자>를 선택했다. 생명에도 계층 구조가 존재하는데 결국 어느 구조가 자연선택이 작용하는 '이기적 수준'이 될 것인가를 고려한 것이다.

이기적인 종, 집단, 혹은 개체, 생태계.

지구상의 모든 생명의 단위별 계층에는 다양한 방법으로 유전자를 운반하고 있다. 이것을 논의하고 쟁점화 시키고 있는 것이 <이기적 유전자>의 핵심 주제인 것이다.

이 책의 제목은 '이기적 시스트론'도 '이기적 염색체'도 아닌, '약간 이기적인 염색체의 큰 토막과 더 이기적인 염색체의 작은 토막'이라고 붙여야 마땅했을 것이다. 그러나 아무리 생각해도 이것은 매력적인 제목이 아니다. 그래서 나는 유전자를 여러 세대에 걸쳐 존속할 가능성이 있는 염색체의 작은 토막이라 정의하고, 이 책의 제목을 <이기적 유전자>라고 한 것이다.

97. 불명의 코일

무리 지어 공동생활을 영위했던 인간이라는 종은 좋은 사회성을 빼놓을 수없는 덕이라고 꼽는데 집단생활을 생존의 도구로 여기며 이를 자연적으로 선택했다는 것은 역시 유전, 그리고 자기 복제를 위한 필수 요소였을 것이다. 그런데 이러한 집단도 자세히 살펴보면 공생을 위한 이기적 집단인가, 이타적 집단인가 생각해 볼 여지를 준다. 리처드 도킨스의 책은 이런 방법으로 의견이 달랐던 나를 설득하는 것 같다. 조건을 제시하고 비교하고 예를 보여주며 합리적인 방법으로 자신의 결론을 도출하고 나는 어느새 아~ 그렇구나 하고 감탄하고 있다.

'인간은 보답하는 것처럼 보이지만, 실제로는 받은 것보다 조금 부족하게 갚는다'라는 말을 곱씹으며 나의 유전자를 어찌할 것인가.... 개인적으로 고민해 보게 된다.

11장 밈 _ 새로운 복제자 편은 너무 매력적이면서 대체적으로 이해하기 쉬운 담론이 많았다. 아마도 생물학적인 분야가 문화적인 측면과 만나서 공감 가는 이야기들이 많았기 때문이 아닌가 싶다.

밈은 자기 복제를 하는 수단으로 모방을 선택한다.

유전자가 자기 복제를 할 때 특히 중요한 성공의 수단으로 장수, 다산 그리고 복제의 정확성을 따진다고 하는데, 밈은 그 수단을 보조하는 역할을 담당한다고 본다. 인간의 뇌를 조종하고 유리한 생존을 선택하도록 하는 것은 밈의 절대적 영향력 행사가 중요하다. 뇌가 모방할 수 있다면 밈은 유리한 쪽으로 진화를 거듭해 가기 때문이다.

나는 공적응된 유전자 복합체가 진화하는 것과 같은 방식으로 밈의 복합체가 진화한다고 추측한다. 선택은 자기의 이익을 위해 문화적 환경을 이용하는 밈에게 유리하게 작용한다. 이 문화적 환경은 함께 선택되는 밈들로 구성되어 있다. 따라서 밈 풀은 진화적으로 안정한 세트의 속성을 가지게 되며, 여기에 새로운 밈은 쉽게 침입할 수 없다.

375

밈은 확실히 매력적인 장이었다. 이 밈을 지나 <이기적 유전자>의 전략적 생존 게임 부분은 나에게 겸손한 자세를 가르쳤다.

처음 도입부에서 가슴 벅차게 시작한 나란 존재에 대한 공격적인 질문은 진화론의 긴 역사와 생명의 생명을 향한 강인한 연속성을 보면서 차츰 진지해졌다. 그리고 겸손해졌다. 나란 존재가 한없이 작은 에너지에 불과하며, 내가 진화적으로 완벽하게 건강하든 완벽하게 돌연변이든 어쨌든 나는 선택되었고, 지금 열심히 지구상의 모든 생물에 보탬이 되는 이기적 삶을 살고 있다.

이제 나에게 남은 질문은 미래를 향한 것이다. 그럼 지금부터 진화론에 힘을 실은 <이기적 유전자>를 언제든지 다시 들추어 보면서 나의 이기적 혹은 이타적인 행동은 어디에서 오는가에 대해 검증해 볼 예정이다.

#리딩투데이 #공유독서타다 #을유문화사 #이기적유전자 #리처드도킨스 #요즘책방 #책읽어드립니다 #리투 #과학교양서"
65067259,이기적유전자,9,https://sarak.yes24.com/review/11675001,"읽는 내내 드는 의문점이 있었다 . 분명 진화론에 근거해서 쓰는 책인데 왠지 기독교인인 내가 읽기에도 큰 저항이 없었다 . 다 읽고 책을 덮어 놓았다가 어제 읽은 정재승의 "" 열두발자국 "" 을 읽으면서 이해가 됐다 . 도킨스의 어머니는 독실한 신자이면서도 한 때 무신론에 빠져 있던 아들을 내버려 두었단다 . 심지어 관련 책까지도 사다 주었단다 . 그래서 이렇게 좋은 책을 쓴 것 같다 . 여기에도 가풍은 녹아 있는 것 같다 . 그래서 모든 사람들에게 별 거부감이 없이 자신의 주장을 펼치는 힘이 있었나 보다 .

모든 것이 결국에는 유전자의 힘으로 귀결되는 느낌이었다 . 왜 유전자의 힘이 환경보다 더 세다는 말이 나오는지 조금은 공감이 되는 내용이었다 . 원시 유전자부터 유전자가 자신을 유지하기 위해서 계속해서 끊임없이 자신을 담을 대상을 선택해나가는 과정은 얼른 잘못 생각하기에는 기생충과 숙주의 관계 같은 느낌이 들게 했다 . 그러나 기생충과 유전자는 엄연히 다르다 . 기생충은 잘못되면 숙주를 죽게까지 해서 결국은 자신까지도 죽이고야 많은 어리석음을 보이는데 유전자는 철저히 자신의 복제자를 남기기 위해 어떻게든 더 좋은 대상으로 이동하고 발전해나가는 모습을 보인다 . 이러한 면에서 제목에 이기적이라는 말이 들어갔는지 모르겠다 .

책을 읽다가 보면 유전자가 자신의 복제자를 남기기 위해 철저히 이기적인 행동까지도 하는 비정함을 맛보기까지도 한다 . 그러나 그것은 어디까지나 선택에 불과할 뿐이다 . 조금 더 환경에 유리한 쪽으로 자기 복제자를 남기기 위해서 … . 이것은 절대 이기적인 행동이 아니다 . 우리 호모사피엔스만이 가지고 있는 훌륭한 선택의 기술이라고 해야 할까 ? 물론 근처에도 못 가지만 만약 나에게 이러한 책을 쓰고 제목을 붙이라고 하면 이기적이란 단어보다 선택적이란 단어를 쓸 것이다 . 그러면 너무나 임펙트가 적으려나 … . 아무튼 , 이 책을 읽고 나서 과학 분야에 조금 더 친숙해진 것은 사진이다 . 이전까지는 거의 인문 사회 분야의 책만 읽었었는데 이제 독서의 스펙트럼이 넓어질 것 같다 . 왜 이 책이 세계적 명저의 반열에 올랐는가 ? 읽어보니 알겠다 . 사실 나도 TV 에서 유시민 씨가 “ 도킨스는 35 세에 ‘ 이기적 유전자 ’ 라는 명저를 썼는데 자기는 그 나이 때 뭐 했나 모르겠다 ” 라는 얘기를 하길래 의아해했다 . 유시민은 ‘ 항소이유서 ’ 를 한 번에 쓴 것으로 너무나 유명해 내가 나름 좋아하는 작가이기도 한데 … . 얼마나 좋은 책이길래 하는 생각으로 읽어본 결과 좋았다 . 암튼 직접 읽어보시라 . 다만 내가 너무나 늦게 이 책을 읽은 것이 조금은 부끄럽다 ."
65067259,번역이 정말 심각합니다,8,https://sarak.yes24.com/review/11173636,저는 30주년 기념판을 가지고있습니다. 제 애장도서 상위에 있는 책입니다만 다시 읽어봐도 눈물 나는 번역입니다. 번역을 해독해야하는 경우가 수두룩합니다. 그런데 이번 개정판도 같은 분이 옮기셨네요...한분이 더 참여하셨으니 많이 나아졌기를 기대합니다만 영어 되시는 분들은 원서를 도전해보시는건 어떨까합니다. 책은 정말 좋습니다 정말 누구에게나 권해주고픈 명서입니다
65067259,264. 175. 이기적 유전자,8,https://sarak.yes24.com/review/10756751,"아무 생각 없이 이 책에 도전했다. 학창 시절 이후 과학에 대해서 그 어떤 관심을 가진 적이 없었고, 알고 있던 것들도 다 잊은 내가 이 책을 아무 생각 없이 도전했다. 심지어 만만하게 봤다. 그리고 그 대가는 참혹하다. 읽는 내도록 고통스러웠다. 읽는 속도도 무척이나 느렸는데, 1/10도 제대로 이해했는지 확신할 수 없다. 하지만 다 읽고 나서의 이 뿌듯함이란. 고전 책이라는 것은 바로 이런 것인가, 라며 씁쓸해 했다. 내가 평소에 책을 읽던 방식이 아니라, 한 장 한 장 읽으며 관련 자료를 찾고, 이해하고, 정리하며 꽤나 공을 들여야 하는 책이다. 난 이제껏 독서를 제대로 하지 않은가 싶기도 했다. 이런 것이 진정한 고전인가 싶을 정도. 너무 만만하게 본 대가는 참혹할 정도다. 어쨌든 읽었다는 의의를 둔…다;; ‘유전자의 이기성’이라는 기본 법칙으로 개체의 이기주의와 이타주의가 어떻게 설명될 수 있는가를 나타내고자 한다. (p.49) 장수의 성질을 갖는 자기 복제자는 다시 그 수를 늘리는 경향이 있었을 것이고, 다른 조건이 같다고 할 때 분자의 개체군에는 한층 더 오래 살아남는 쪽으로 ‘진화하는 경향’이 있었을 것이다. (p.65) 우리뿐만 아니라 기존의 생물학자들은 보통 눈에 보이는 생명체에 집중한다. 하지만 저자는 최소 단위에서부터 생각해야 한다며, 기준점을 옮긴다. 그것이 우리를 자신들의 생존의 수단으로 삼은 유전자이다. 유전자가 살아 남기 위해서는 생존 기계가 살아 남아야 한다. 그리고 생존 기계가 살아남기 위한 전략은 유전자가 어떻게 생존하기 위해 추구하는 방향과 관련이 있다. 유전자는 그저 자신의 지속만을 위해 생존 기계의 진화를 유도하고, 이 과정에서 유전자의 생존과 절멸에 따라 생존 기계의 모든 것을 지배하게 된다. 이와 관련해서 나는 저자가 이야기 하는 진화에 초점을 둔다. 이기적이라는 것과 역설적이게도, 진화는 생존 기계도 이기적인 방향성을 추구하는 것이 아니라, 협력하고 안정적일 수 있는 것을 선택하고자 한다. 진화란 부단한 상승이 아니라 오히려 안정된 수준에서 안정된 수준으로의 계기적인 불연속의 전진인 것 같다. (중략) 유전자는 ‘우수성’으로 선택된다. 그러나 이 우수성은 진화적으로 안정된 세트, 즉 현재의 유전자 풀을 배경으로 한 성과에 기초하여 판정되는 것이다. (p.169) 유전자의 입장에서 우수성이 중요하다. 이 우수성은 잘 났음을 이야기 하는 것이 아니라 얼마나 더 많은 번식을 하느냐에 기반을 둔다. 흔히 인간의 관점에서 볼 수 있는 우수성이 아니다. 생존 기계인 우리들에게도 이 우수성이 안정성임을 인정해야 하지 않을까? 우리가 발전하고 진화한다고 이야기 하는 것이 온전히 무조건적인 더 나음만을 이야기 하는 것이 아니라 안정을 찾고, 편안을 추구하는 과정이라는 생각이 든다. 많은 이들이 지금 이 순간 고군분투하는 것은 오히려 안정적인 삶을 추구하고자 하는 것이었던 것뿐이다. 많은 것을 시사하는 부분이었다. 힘들게 살아가고 있는 많은 이들의 목표는 단순히 더 잘난 내가 되기 위해서가 아니라, 오늘은 힘듦보다 내일의 힘듦을 줄이고 안정을 찾아가기 위해서이다. 저자가 처음으로 제시하는 ‘밈(meme)’이라는 개념은 흥미롭다. 새로이 등장한 수프는 인간의 문화라는 수프이다. 새로이 등장한 자기 복제자에게도 문화 전달의 단위 또는 모방의 단위라는 개념을 함축하고 있는 명사의 이름이 필요하다. = 밈(meme) (p. 335) 최소 단위가 생물의 물질로서만 존재하는 것이 아니라, 인간이 만들어 내는 문화 또한 밈이라는 최소 단위의 자기 복제자가 존재한다는 것이다. 어쩌면 이 책의 내용과 연관성이 없어 보이는 이 내용은 이기적 유전자의 기본 틀과 정확하게 들어맞는다. 차이점이 있을지라도 인간에 대해 논할 때 빼놓을 수 없는 이 문화는 유전자의 입장에서도 꽤나 중요할 수 밖에 없다. 우리는 유전자 기계로서 조립되었지만 밈 기계로서 교화되어 있다. (p.349) 유전자 기계인 우리는 우리만의 밈이라는 또 다른 요소를 만들어 내 우리의 생활을 지속하게 한다. 유전자 입장에서 번식에 유리하기만 하다면 아무렴 어떻겠는가? 이 문화라는 것은 생존 기계인 우리가 삶을 살아감에 있어 좀 더 유리한 부분이 되어 주는 것이다. 문화의 최소 단위 밈이라는 것을 보며 오히려 이기적인 유전자의 특징에 대해서 생각하기가 수월했다. 유전자는 이기적이라 자신의 생존 혹은 복제만을 기준으로 한다. 하지만 그렇다고 해서 그의 생존기계인 우리, 의식을 지닌 우리도 그렇게 살아야 하는가? 우리는 어떻게 살아야 할까? 경쟁자가 게임이 얼마나 계속될 것인가에 관해 끊임없이 갱신되는 추정치를 가지고 행동한다고 예상할 수 있다. 그의 추정치가 길면 길수록 그는 진짜 ‘반복 죄수의 딜레마’ 게임에 관한 수학자의 예측에 보다 더 잘 따르는 자세로 경기를 할 것이다. 바꿔 말하면 보다 마음씨 좋고, 보다 관용적으로, 보다 질투하지 않게 될 것이다. (p.384) 저자는 ‘죄수의 딜레마’ 게임을 한 장 통틀어서 할애할 정도로 다양한 관점에서 이야기 한다. 개인적으로 저자가 결국 하고자 했던 말은 이 12장의 내용이 아닐까 싶을 정도로 강조하고 싶다. 이기적인 유전자는 지속적인 생존을 위해 생존 기계의 번식을 촉구하는 반면, 생존 기계는 이기적으로 살아서는 안 되는 것이다. 라운드가 정해져 있는 않은 삶 혹은 언제 끝날지 모르는 경기를 하는 우리들은 최대한 서로에게 도움이 되고, 협력할 때에 더 높은 승률을 올릴 수 있다. 무조건적인 협력만이 답인 것은 아니지만, 최소한 협력을 기본으로 삶을 살아갈 때에만 우리는 서로를 믿고 의지하며 더 ‘번식’하기 좋을 것이다. 이런 관점에서 현대의 경쟁적인 삶의 방식은 어쩌면 이기적 유전자들의 입장에서는 몸서리 칠 일이 아닐까 싶기도 하다. 인간은 바다표범처럼 우월한 수컷 하나가 하렘을 만들어 번식하지 않는다. 최대한 우수한 유전자를 선택하기 위해 서로가 서로를 평가하며 경쟁적으로 삶을 살아가고 있으며 번식에서도 점점 수치가 줄어 들고 있는 지경이다. 유전자들은 의식 없이 그저 존재하기만 하는 것들이라지만, 좀 신경 쓰이겠다. 읽으면서 흥미롭고, 쉽게 읽었던 부분은 현재 우리가 가지는 남성과 여성의 차이와 사고 개념이 유전자를 기반한다는 걸 찾을 때였다. 저자는 전혀 그런 의도로 이야기 하진 않지만, 수컷이 집을 제대로 짓지 않으면 암컷이 구애에 응하지 않는다던지, 암컷이 자식에게 수컷보다 더 많이 투자하고 있기 때문에, 더 많은 정성을 쏟는다던지 하는 내용은 재미있었다. 우스갯소리로 후생에서는 그나마 양육의 부담이 덜한 물고기 암컷으로 태어나고 싶다는 생각도. 어렵다. 진정한 고전은 이런 것인가 싶을 정도로 어려웠다. 하지만 그만큼 읽고 나니 뿌듯함이 있다. (이와 소화의 여부를 떠나서.) 다음에 다시 기회가 온다면 (부디 안 오길 바라지만) 다시 읽을 때는 좀 더 공을 들여서 읽겠다."
65067259,전공자에게만 좋을듯 ㅠㅠ,6,https://sarak.yes24.com/review/16060891,"과학 베스트 셀러를 뒤적거리다가, 아주 오래되었지만, 꾸준한 판매에 힘입어 리커버 나왔다고 해서 구매해서 봤으나

내용의 어려움때문인지, 아니면 너무 번역체여서 인지, 내용이 잘 안들어왔다.

거기에 내용 자체가 유전자의 이기적인 행태에 대해서 쭈욱 서술하는 것들이 거의 책의 대부분이라 흥미롭지도 않았다.

아무리 훌륭한 고전이라고 하지만 나하고는 맞지 않은 것 같다 ㅠㅠ"
