goods_no,review_title,rating_score,origin_url,review_text
109005292,"짱깨주의의 탄생, 김희교 글, 보리 출판 4.",10,https://sarak.yes24.com/review/16728937,"책의 내용을 정리해 보았습니다.

전후체제는 샌프란시스코체제와 키신저 시스템의 복합체

책을 읽지 않은 분들을 위하여 설명이 필요한 듯하여 별도의 정리를 한다.

일본은 2차 세계대전 이후 만들어진 동아시아 체제를 ‘전후체제’라고 부른다. 아베가 말하는 전후체제는 평화헌법, 샌프란시스코강화조약, 미일안보조약이라는 세 가지 축으로 구성된다. 그러나 아베의 인식과 달리 전후체제는 그것만으로는 규정할 수 없다. 전후체제는 미국 중심의 샌프란시스코체제가 규율해 왔지만 중국과 한국 같은 체제 내 국가들의 성장이 또 다른 한 축으로 역할을 했다. 1972년 미중 간 체결한 키신저 협약(Shanghai Communique)은 아시아 국가들이 성장한 결과물이다. 이 협약은 냉전을 허물고 미중수교, 중일수교, 한중수교로 이어지는 평화적 국가 관계를 만들어 냈고 저자는 이를 ‘키신저 시스템’이라고 부르고자 한다. 전후체제는 1951년 샌프란시스코평화조약을 바탕으로 구축된 샌프란시스코체제와 1972년 키신저 협약을 바탕으로 만들어진 키신저 시스템의 복합체라고 볼 수 있다.

샌프란시스코평화조약은 2차 세계대전 이후 지금까지 동아시아에서 작동하는 가장 기본적인 국제관계의 틀로 작동했다. 이 조약은 두 가지 성격을 지닌다. 하나는 전후 미국 중심의 자유주의적 국제질서가 동아시아에 자리 잡았다는 점이고 이로 인해 각국의 영토가 확정되고 주권이 보장되었다. 이것은 주권 측면에서 구식민주의에 비해 진보된 질서였다. 또한 미국 중심의 자유주의적 경제질서와 정치체제가 구축되었다. 달러를 기축통화로 삼는 브레튼우즈체제와 관세 및 무역에 관한 규정인 관세무역일반협정(GATT)을 적용하는 경제가 확립되었고, 미일 동맹을 주축으로 하는 동맹체제가 국가 간 질서로 자리 잡았다. 그러나 샌프란시스코체제는 구식민주의가 완전히 청산된 대등한 국가 간 체제가 아니다. 미국이 자국의 이익을 우선하여 신식민주의체제를 구축했기 때문이다. 샌프란시스코체제는 1) 경제적 예속관계 2) 수직적 동맹체계 3) 패권적 문화적 영도력 확보와 자발적 복종 매커니즘 구축 4) 종주국과 식민지 엘리트들의 공모로 구축된 신식민주의체제라는 성격을 띤다.

샌프란시스코체제의 구축은 동아시아의 긴 냉전시대를 열었다. 아시아의 냉전이 지닌 폭력성은 샌프란시스코체제의 신식민주의적 특성에서 시작되었다. 자유주의적 질서에서 배제된 지역과 사회주의 질서를 세운 지역 간의 냉전적 진영대결, 분단체제 내의 남북 간 대결, 신식민주의적 위계 내에서 군부정권의 등장과 체제 유지를 위한 미국의 용인이 어우러져 전쟁과 폭력의 시대가 지속되었다. 미국은 전범국가인 일본을 새로운 동아시아 질서를 구축하는 데 가장 중요한 파트너로 삼는 것을 바탕으로 구축되었고, 미일동맹을 축으로 한미동맹을 구축했다.

(최근 다국적 환태평양훈련(RIMPAC·림팩 훈련)에서 일본의 해상자위대가 원정강습단장인 한국해군의 지휘를 받지 않았다는 소식이 전해진 것은 일본이 한미일 군사협력의 틀을 어떻게 가져갈 것인가를 이해할 수 있는 현상으로 이해를 할 수 있겠다)

이상이 김희교 교수가 이 책을 이해하는 동아시아의 기본적 틀이다. 이러한 틀속에서 동아시아의 국가들이 어떻게 중국과 미국을 이해하며 향후 어떻게 두 강대국 사이에서 움직여 갈 것인가 지금의 현상을 설명하며 미래의 전략을 구상하는 것이다."
109005292,"짱깨주의의 탄생, 김희교 글, 보리 출판 3.",10,https://sarak.yes24.com/review/16728896,"책의 내용을 정리해 보았습니다.

저자의 현실 인식: 미국 헤게모니의 추락

저자는 샌프란시스코체제 위기의 근원은 무엇보다도 미국 자체에 있다고 해석한다. 미국의 힘이 예전만 못하다는 것이다. 트럼프행정부가 일방주의와 보호무역주의를 실시한 까닭은 미국 산업의 경쟁력이 전반적으로 현격히 저하된 데서 왔다고 본다. 미국 산업의 경쟁력 저하에는 미국 자본주의가 금융자본주의화하면서 발생한 미국 제조업의 몰락이 도사리고 있다고 설명한다. 미국이 경제적으로 추락하자 전후체제의 핵심적인 경제 기구인 WTO, IMF, IBRD 들에서 미국의 영향력은 현격히 감소했다. ‘미국의 세기가 저물고 있다’(앨프리드 맥코이)라고 표현한다.

은크루마의 정의를 빌리면 신식민주의란 종속국들이 형식적으로 독립을 누리지만 경제체제는 종속적이고 정치적 자율권은 종주국에게 장악당하고 있는 국가 간 체제를 뜻하고, 신식민지체제를 작동시키는 것은 헤게모니라고 말한다. 아리기는 헤게모니란 “지배집단이 지배집단의 이익뿐만 아니라 종속집단이 이익이 되는 방향으로 사회를 이끌어 나갈 때 지배집단에게 생기는 추가적인 힘”이라고 정의한다며 미국 중심의 전후체제가 유지된 핵심 근거로 거대한 국내 시장과 경제적 힘을 가진 미국이 전후체제에 편입된 동아시아 국가들에게 정치적 종속을 요구하는 대신에 경제적 혜택을 주었기 때문이라고 본다면서 그것을 ‘선물’이라고 불렀다고 쓰고 있다. 지금의 미국이 선물을 줄 수 없는 까닭은 선물을 줄 여유가 없기 때문이고 트럼프행정부의 일방주의 선언은 그런 차원에서 나왔다고 주장한다(500~501쪽) 저자는 미국의 신식민주의체제를 유지하는 또 하나의 동력을 이어 설명한다. 군사력이다.

“봉쇄와 군사적 위협”은 미국이 전후체제를 이끌어 온 주요 수단이었지만, 군사력은 국가와 국가 간 적대 진영이 구축되었을 때만 유용한 동력이라면서 지금은 냉전 시대는 가고 탈군사주의 시대가 왔다고 설명한다. 독일은 트럼프의 요구에 따라 독일에 주둔한 미군의 축소를 흔쾌히 수용했고, 중국을 봉쇄하기 위해 동맹국들에게 군사적 동맹 성격의 쿼드 플러스를 가동했지만 군사적 보호보다 경제적 이익이 더 중요한 동맹국으로부터 외면받았다고 한다. 한반도에서도 마찬가지 현상이 벌어졌는데 한국은 경제성장과 더불어 세계 7위 수준의 군사력을 확보하여 이제는 미군 없이도 북한을 상대할 만한 수준의 군사적 억지력을 확보했고, 반면 미국의 군사력이 힘을 발휘할 수 있는 가장 강력한 적대 세력이었던 북한이 노골적으로 키신저 시스템 안으로 들어오고자 노력하고 있다고 보고 있다. 한국은 군사적 대치 말고도 북한의 위협을 감소시킬 수 있는 대안이 생긴 셈이라고 저자는 생각한다. 만약 미국이 마땅한 대가 없이 불필요한 신냉전체제로 몰아가면 미국은 더 이상 자발적 헤게모니를 유지할 수 없는 딜레마에 빠진다고 예상한다.

미국의 헤게모니 붕괴는 미국의 관점에서는 무질서한 세계이지만 우리의 관점에서는 드디어 샌프란시스코체제가 지닌 신식민주의로부터 탈피할 기회가 온 것이기도 하다는 것이 저자의 생각이다."
109005292,"짱깨주의의 탄생, 김희교 글, 보리 출판 2.",10,https://sarak.yes24.com/review/16728856,"책의 내용을 정리해 보았습니다.

짱깨주의의 탄생과 짱깨주의 극복이 필요한 이유

저자 김희교 교수는 짱개주의를 한국에서 급속하게 자리 잡고 있는 주류의 중국의식을 개념화한 말이라고 설명한다. 짱깨주의는 미중 충돌 시기 한국의 안보적 보수주의가 중국을 바라보는 독특한 시각을 말한다. 신식민주의와 유사인종주의가 결합된 한국의 특수한 중국인식체계라고 풀이한다. 짱깨주의는 있는 그대로의 중국을 보지 못하고 ‘상상 속의 중국’을 보게 한다.

모든 혐오는 혐오를 조장하는 집단의 특정한 목적이 숨어 있고 그런 단어(짱깨)가 사용되어 온 역사가 있다며, 그런 집단은 특정한 국가나 인종의 일상을 자기들의 기준대로 채집하여 분류하고 전시하며 혐오를 유발한다. 짱깨라는 개념이 짱깨주의로 구조화되는 데는 그런 집단의 특정한 목적이 숨어 있다고 저자는 주장한다(91쪽) 안보보수주의자들은 우리나라를 미국과 중국이라는 양 강대국 사이에서 필연적으로 생존을 염려해야 하는 조건을 가지고 있기에 미국에 종속되어 중국을 적대시하는 방법이 우리의 생존권을 보장하는 방법이라고 강권한다. 이에 반해 진보적 지식인들은 중국이 과거의 조공체제를 강제하며 새로운 제국주의가 될 것을 염려하면서, 사회주의 중국의 이상이 사라졌다고 실망을 한다. 저자는 이들의 주장이 현실의 중국을 제대로 보지 못한 주장이라고 비판을 한다. 그러면서 평화주의 입장에서 중국과 미국을 활용하여 우리의 자주권을 확보하고 이익을 도모해야 하고, 할 수 있다는 주장을 하고 있다.

그렇지만 저자는 중국의 성장이 미국의 패권을 대체하거나 동아시아 지역의 패권을 차지한다는 것을 뜻하지 않는다고 현실을 직시한다. 미국의 패권적 지위가 무너진다고 해서 동아시아에서 강대국의 일원으로 역할을 할 수 없다는 뜻도 아니다고 분명히 지적한다. 미국의 힘이 동아시아에서 완전히 배제될 리가 없고, 아시아 각국의 힘이 성장해 대항권력으로 작동한다는 점을 고려할 때 중국이 미국의 패권을 대체해 불평등한 국가 간 체제를 형성할 가능성은 당분간은 별로 없다고 말한다(548쪽) 이러한 상황에서 우리가 어떻게 해야 지난 100년 동안 꿈꿨던 항구적 평화체제를 구축할 수 있고, 신식민주의에서 벗어나 자주권을 확보할 것인가를 설명한다. 짱깨주의를 넘어서자고 설득한다. 그는 평화체제적 어젠다를 설정하고 선점하자고 주장한다. 이는 중국의 문제에 눈감고 중국은 무조건 우리 편이라는 식으로 중국을 찬양하라는 말이 아니다. 평화체제 프레임으로 중국을 있는 그대로 보라는 것이다. 평화체제 프레임이 미국중심주의가 될 리가 없듯이 중국중심주의가 될 리도 없다면서 누구의 편에 서라는 식민주의 프레임에서 벗어나 평화체제 프레임으로 평화주의자들을 모으는 싸움을 시작해야 할 때라고 강조한다."
109005292,중공의 통일전선공작에 넘어간 한인간의 중국찬양서,10,https://sarak.yes24.com/review/16565649,"중국을 대하는 언론들의 논조와 비평에 중국공산당의 입장을 대변하는 책입니다. 사실도 일부있고 빈약한 궤변의 논리도 많은 책입니다. 미국헤게모니비판, 우리진보,보수주의자들에 대한 비판 남중국해에 대한 중국찬양 공자학당에 대한 찬양 중국기업들의 스파이행태 주변국과의 갈등 등 여러문제를 중국공산당의 논조를 빌려와 다루었으며 동북공정과 사드문제에 대한 중공의 논리를 궤변으로 옹호하며 이 두사안에 대한 중공은 이에대해 소극적 대항하고 있다는 대목에서 이책을 접게 되었습니다. 문재인이 추천할 만한 책이라고 생각듭니다. 한가지 덧붙이면 중국공산당의 조용히 파고드는 중국식 이데올로기의 침투를 눈앞에서 목격할 수 있는 책입니다."
109005292,"'중국', 고정관념을 버리고 넓게보자.",10,https://sarak.yes24.com/review/16511032,"기승전 '중국은 안돼' 라는 부정적 인식으로 온갖 중국뉴스를 접해왔다. 미세먼지, 대만과 홍콩, 신장독립, 동북공정, 반도체 기술유출, 핸드폰 개인정보 등등, 중국은 존재 자체가 사회악이다. 나 역시도 중국에 대한 기본 인식이 그러했다. 하지만 중국에 대한 상식은 이 책을 읽고난 전후로 바뀌었다. 저자는 우리가 접하는 중국뉴스가 어디에서 오는지, 내가 왜 중국에 대해 저급한 인식을 가지게 되었는지 현실의 방대한 실예로 하나씩 짚어준다. 한 챕터씩 넘어갈때마다 뒷통수를 맞은듯 상식을 확 깬다. 100%내용에 동의할 수 없더라도 다른 사람에게도 꼭 추천하고 싶다. 왜냐하면 이책에서 설명한 짱개주의는 중국에 국한할 문제가 아니라 우리 정치,사회,이념의 문제 전반을 이해하는데도 도움이 될 거라 생각하기 때문이다. 많은 분들이 짱개주의 매트릭스에서 빠져나오는 진실의 선택을 한번 해보길 바란다."
109005292,짱깨주의의 탄생,8,https://sarak.yes24.com/review/17389891,"이 책은 늦게 나왔습니다.

어느 순간부터 중국을 비난하는 뉴스가 쏟아져나오기 시작하더니 종종 커뮤니티에서 중국을 혐오하는 기풍이 일어나더니 완전히 도배가 되었습니다. 사드 배치에 대한 보복과 미세먼지와 코로나 19로 인해서 이제는 대세가 되었다고 할수 있습니다.

문제는 중국이 한국 경제 수출의 가장 중요한 시장이었다는 점입니다. IMF의 극복을 국민과 기업들의 노력만으로 치장하려고 하고.. 그 공이 큰 것은 사실이지만 실상은 당시 고속 성장을 시작한 중국에 대한 수출이 폭발적으로 증가한 탓이었습니다. IMF를 빠르게 극복해낸것을 자랑으로 삼지만 그때 만약 중국 시장이 없었다면 그 속도는 불가능 했습니다. 이 후 2008년 세계 금융위기에서도 한국이 버텨낸 것은 당시 중국이 내부부양을 위해 풀던 어마어마한 자금의 수혜를 받은 나라였기 때문입니다.

그런데 지금은 이런 중국 시장의 중요성을 지적하는 기사는 어디하나 볼수 없습니다. 오직 중국을 공격하고 가치를 따지고 안보와 동맹이야기만 남아 있습니다. 이 상황이 현재 경제 위기에 직면한 한국에 도움이 될지는 의문입니다. 가장 수익성 높은 수출 시장이 사라지고 있고 대체할만한 시장은 아직 나타나지 않았습니다.

중국 혐오에 대해서 문제점을 지적하고 이에 대한 논쟁이 있어야하는데 이런 논쟁은 미미하거나 없었다고 느꼈습니다. 가장 중국 시장에서 이익을 본 기업들이 침묵을 지킨 것으로 볼수 있습니다. 왜 그랬을까요?

저자는 중국의 입장에서 이러한 중국 혐오에 대해서 국내 정치적 이득 목적을 가지고 있다고 단언합니다. 실제 정치 상황은 안보 보수주의자들이 주도권을 가진 상황으로 그 주장대로 끌고 가고 있습니다. 개인적으로 그 결과가 궁금하지만 희망적이지 않다고 보고 있습니다.

저자가 중국쪽에서 편향되었다고 생각하는 점은 바로 진보가 중국도 문제가 있다라는 태도라는 지적입니다. 중국의 문제가 아니라고 지적하면서 근거를 드는 점은 바로 중국의 변명입니다. 그 변명에 일리가 있는 바는 있지만 지금 한국인들이 신뢰하지 않는 점은 바로 우리의 경험입니다. 무슨무슨 민주주의를 내세우면 각자의 사정이 다르기때문에 우리의 민주주의는 다른 모습을 띤다고 하는 주장의 허구성을 경험적으로 안다는 점입니다.

민주주의는 민주주의입니다. 보편적이고 공통적인 점입니다. 이미 그런식의 변명은 너무도 익숙하고 그래서 중국 주장을 신뢰하지 못합니다.

그리고 다자주의 세계에 대한 희망도.. 과연 우크라이나 전쟁이 발발한 이후에 가능할까 의문입니다. 오히려 신냉전이 시작되었다는 불안한 예감이 더 들고 있습니다.

중국이 방어적이라고는 해도 핵심 이익선이라고 하는 제1도련선 안에 한반도가 포함되어 있습니다. 최근 중국 해양력의 증대는 방어적인 수준을 넘어서고 있으며 우리로서는 심대한 군사적 위협이 되고 있습니다.

우리로서는 중국이란 나라에서 대해서 좀더 들여다보고 논쟁을 벌이면서 한중관계를 풀어나갈 필요가 있습니다. 청일, 러일 전쟁은 다 한반도에서 벌어졌습니다. 지금 우리 사회에 대한 과도한 혐중 흐름에 대해서 반드시 다시 한번 생각해볼 필요가 있습니다.

관심 있는 분들의 일독을 권합니다."
109005292,언론에 대한 비판적인 시각이 필요하다는 것을 느끼게 하는 책,8,https://sarak.yes24.com/review/16732545,그동안 중국에 대한 느낌은 솔직히 말하자면 좋지 않았다. 엉론에서 보여지는 모습들을 보고 좋읕 이미지를 가질 수 없었다. 그리고 그런 모습에 대해서 다르게 보려고 하는 시도나 노력도 없었다. 책을 읽고 언론을 대할 때 항상 비판적인 시각을 가지고 바라봐야 하며 언론이 현재 보도하고 있는 모습들이 진실이 아닐수도 있다는 생각을 항상 지녀야겠디는 생각을 하게 되었다.
109005292,편향적 시선의 위험성,7,https://sarak.yes24.com/review/17057980,"49년간 진보이념의 가치를 지지하던 독자로서

중국을 대하는 언론의 편향적 가치가 개입되었을 가능성이 있임을

제시하는 서적입니다,

다만 국내 언론사와 포털의 지향점은 독자가 어느정도 구분을 할 수 있는 환경이지만

일반적인 독자라면 해외 언론사의 방향성을 확인하기 어려운 현실입니다,

필자가 제시하는 센프란시스코 체계를 기반으로한 보수주의 언론의 친미행각은 어느정도

설득력이 있고 중국에 대한 언론의 편향성을 새로운 시각으로 접근해 주게 합니다.

다만 역으로 제시한 중국에 대한 사회적 문화적 중국국민의 정서 등은

이책한권으로 판단하기에는 무리가 있다고 봅니다, 또한 중국과 미국의 사이에게

생존을 위한 경쟁이 필요한 대한민국의 지정학적 상황을 보았을때

이책의 모든 주장을 여과없이 받아 들이기에는 자신만의 객관적인

조사와 정보 취합이 필요해 보입니다.

각설하고 협중 문화가 만연한 요즘세태에 중립적인 시각을

키울 수 있는 괜찮은 도서임에는 분명합니다

다만 동일한 논리구조의 연속(샌프란시스코체, 키신저시스템, 유사인종주의)은

책의 피로감을 가져다 줍니다."
109005292,어쨌든 중국에 대해 한 번 더 생각하게 된 것이 소득이라면 소득.,6,https://sarak.yes24.com/review/16971467,"문재인 대통령의 추천으로 본 책.(나 문대통령하고 이렇게 가까운 사람이야! ㅎㅎㅎ)

'짱깨주의'라는 말 자체가 중국에 대한 혐오 표현이라고 주장하는 저자는 우리가 그동안 중국에 대한 제대로 된 정보를 받지 못했기 때문에 이런 관념이 자리잡게 되었다고 말한다. 모든 매체가 중국을 비하하고 경멸하기까지 하면서도 정작 우리나라의 최대 수출국이기에 결코 외면할 수 없어 이런 이중적인 태도를 취하게 된다는 이야기.

그리하여 우리가 알고 있던 중국과 중국인에 대한 관념을 조목조목 반박하고 실상이 어떤지를 자세히 설명하고 있다. 흡사 전화시대의 논리나 우상과 이성 등 리영희 교수의 책을 다시 보는 느낌. 책 말미에는 사회와 경제에 대한 근본적인 질문까지 던지고 있어 철학의 향기를 풍기기도 한다.

그러나 지금은 죽의 장막이 쳐져있던 그때와는 시대가 다르고 또 상황이 다르다. 중국과 중국인에 대한 좋지 않은 감정은 그들이 실제 보여주는 행동과 그것을 직접 경험한 사람들의 입을 통해 알려진 것도 많다. 이 책의 내용에 무조건 공감하기는 어려운 것이 사실.

그래도 어쨌든 중국에 대해 한 번 더 생각하게 된 것이 소득이라면 소득."
109005292,중국 공산당의 입장에서 쓴 책인가?,2,https://sarak.yes24.com/review/17446277,"읽을 가치조차 없는 책. 이미 혐중 반중은 전 세계적으로 퍼져나갔고, 주요 우방국들과 선진국들도 반중정책을 펼치는데 굳이 우리가 위험 감수하면서 미개한 놈들한테 머리 조아려가며 관계유지를 해야하나?? 그런 생각 가진 놈들이 남한산성 영화보고 질질 짤 자격이 있나 싶다ㅋㅋㅋㅋ 전형적인 좌파의 이중성을 잘 보여주는 책. 정신좀 차려라 정신좀. 중국은 이미 망해가는 중이다. 전세계적으로 왕따가 될수밖에 없는 썩은 민족성과 공산주의로 무너질대로 무너지기 일보직전."
109005292,짱깨주의의 탄생,10,https://sarak.yes24.com/review/21802301,혐중이 심해지다 못해 이제는 당연하게끔 받아들여지는 현 시점에 한번 쯤 읽어봐야 하지 않을까 싶다. 출간된지는 몇년 되었고 요즘 세태에 대한 저자의 해석이 궁금해지기는 하나 기본적인 혐중 프레임을 이해하는 것으로도 충분하지 않을까 싶다.
109005292,다른 시각의 책.,10,https://sarak.yes24.com/review/21407846,"도서관에서 빌렸다가 생각보다 필기하며 읽고 싶은 부분들이 많아서 구매했다. 중국에 대한 부정적인 시각을 상쇄해 주는데, 어느 쪽이 맞다 아니다 생각하기 이전에 다른 시각을 제공해 주는 책이라 맘에 든다. 유튜브나 SNS에 퍼진 인식과 다른 설명들을 필기하며 읽다 보니 13억 중국 인구에 대해 함부로 판단하기 어렵다는 생각이 들었다. 5천만 대한민국 사람들도 다 다른데 중국인은 얼마나 다를까…. 많은 생각을 하게 되는 책이다."
109005292,짱깨주의의 탄생,10,https://sarak.yes24.com/review/20184169,"김희교 교수가 한국 사회에서 중국에 대한 혐오와 차별이 어떻게 형성되고 유통되는지를 분석한 책이다. 이 책은 '짱깨’라는 용어의 등장과 그 역사적 배경을 설명하며, 현대 한국 사회에서 '짱깨주의’가 어떻게 확산되었는지를 다룬다.

저자는 중국에 대한 혐오가 단순히 최근의 현상이 아니라, 역사적, 정치적 배경을 가지고 있음을 강조한다. 그는 1894년 청일전쟁 이후 조선인들이 중국인을 혐오하게 된 배경을 설명하며, 일본 제국주의가 만들어낸 '중국인을 열등하고 미개한 국민’이라는 프로파간다가 한국 사회에 깊이 뿌리내렸다고 주장한다. 이후 해방과 한국전쟁, 반공주의 확산 등의 역사적 사건들이 중국에 대한 혐오를 더욱 증폭시켰다고 설명한다.

초반부는 '짱깨’라는 용어의 역사성과 개념을 설명하며, 현대 한국 사회에서 '짱깨주의’가 어떻게 형성되고 유통되는지를 분석한다. 언론과 정치가 중국에 대한 혐오 정서를 퍼뜨리는 데 큰 역할을 했음을 강조한다. 특히 한국 보수 세력이 이러한 프레임을 만들어내고 확산시키는 데 중요한 역할을 했다고 주장한다.

후반부에서는 중국에 대한 혐오와 차별이 한국 사회에 미치는 영향을 분석하며, 이를 극복하기 위한 방안을 제시한다. '탈식민주의’와 ‘탈유럽중심주의’ 시각에서 중국과의 관계를 재조명할 필요가 있다고 강조한다. 그는 또한 한국이 다자주의 시대의 주역이 될 수 있음을 피력하며, 평화체제로 나아가야 한다고 주장한다. 이 책은 중국에 대한 혐오와 차별이 어떻게 형성되고 확산되었는지를 이해하는 데 유용하다. 중국과의 관계를 재고하는 데 도움이 된다."
