goods_no,review_title,rating_score,origin_url,review_text
65067259,이기적 유전자 - 리처드 도킨스,10,https://sarak.yes24.com/review/17402745,"제목 : 이기적 유전자

저자 : 리처드 도킨스

출판사 : 을유문화사

이기적 유전자 The Selfish Gene

리처드 도킨스 저/홍영남,이상임 공역 을유문화사 | 2018년 10월

우리는 DNA라 불리는 분자를 후세에 전하기 위한 ""생존기계""일 뿐이다

리처든 도킨스의 이기적 유전자는 1976년에 나온 매우 오래된 책이다. 생물공학, 유전공학 등은 그 후로 엄청난 발전을 거듭했고 심지어 '게놈 프로젝트'로 이름 붙인 인간의 유전자에서 32억개에 달하는 뉴클레오타이드 염기쌍의 서열을 밝히는 프로젝트로 이미 끝난 현 시점에서 과연 이 책이 필요한가 하면 그것도 딱히 대답을 하진 못하겠다. 과학은 과거가 중요한 학문이 아니고 발전해나가는 과정과 가장 최신 지견, 최근의 발표가 중요하기 때문에 고전이 힘을 받기는 쉽지 않다. 아마 꽤 오래 된 과학 고전으로 스테디셀러 반열에 오른 책은 이 책과 '코스모스'가 유이하지않나 생각한다.

하지만 이 책의 장점은 정보 전달에 있지 않다. 그 이유를 살펴보려면 저자에 대해 먼저 알아봐야한다.

저자는 유명한 생물학자로 '이기적 유전자'와 '확장된 표현형'을 썼다. 이와는 대조적으로 특이하게 무신론의 최전선에 서있는 지식인이다. '만들어진 신'과 '지상 최대의 쇼' 등 책에선 신이 존재할 이유가 없고 신의 존재가 불필요하다는 강력한 논조로 신의 존재 이유를 부정하고 있다.

나는 중학생 때 이기적 유전자를 읽었지만 당시만해도 어떤 책인지 잘 모르고 읽었고 내용도 와닿지 않았다. 내용이 하나도 기억나지 않는 것을 보면 그렇다. 대학 시절 '만들어진 신'으로 리처드 도킨스를 접했는데 특유의 사람을 끌어들이고 논리적이며 대중을 자극하는 자극적인 문장이 꽤 매력적이었다. 당시에 신의 존재 여부와 그 이유에 대해 알기 위해 참 많은 책을 찾아봤고 그의 문장이 나에게 가장 와닿았다. 당시는 철저한 이성론에 심취해있을 때였고 그의 논증을 토대로 세상을 이해하는 것이 가장 합리적으로 생각이 되었다. 그렇다보니 중립적인(온건한) 무신론의 입장이나 신의 존재 이유를 설명하는 글이 많이 와닿지 않았다. 물론 지금도 무신론에 가깝긴 하지만 이때보단 다양한 분야에서 여러 논점의 책을 읽고 생각은 다소 바뀐 상태이다.

이 경력만 보면 저자는 대중을 위한 책을 집필하는 인물이라 생각하기 쉽다. 하지만 그는 꽤 많은 생물학적 업적을 남겼으며 그 정수가 이 '이기적 유전자'와 그 다음 내용을 잇는 '확장된 표현형'에 잘 나와있다. 이기적 유전자는 물론 본인 스스로의 의견을 썼다기보단 당시 있던 과학자들의 신다윈주의를 집대성해서 쓴 책으로 보는 것이 옳지만 이 책이 훌륭한 저자의 훌륭한 '과학 고전 명작'이라는데 의의는 없을 것이다.

이 책이 명작으로 불리는데는 여러가지 이유가 있겠지만 위의 무신론을 얘기할 때도 나타나는 특유의 어조가 한 몫을 할 것이다. 게다가 그는 이 책에서 연구에 대한 복잡한 수식을 전혀 사용하지 않고 그의 의견을 피력했다. 지금 읽으면 다소 식상하거나 옛 지식도 많이 있겠지만 일반인인 나는 잘 모르겠고 단순히 진화론의 중요한 한 줄기를 쉽게 알 수 있어 너무 좋다.

책의 주제는 사실 간단하다. 종의 보존을 위해 개인을 희생한다는 '집단선택설'을 전면 부정하는 내용이다. 즉 자신을 희생하여 다른 개체와 크게 보아 종을 보존하는 것이 아니라 모든 이타적으로 보이는 행동은 각각의 유전자의 이기적 선택에 의해 자연선택된 가장 합리적 행동이라는 것이다.

여기서 이기적이라는 것은 의도가 있는 것은 아니고 자연 선택 결과 생존 확률이 가장 높은 유전자가 살아남음을 말하고 있다. 즉 집단을 위해 희생하는 것으로 보이는 행동은, 그 행동을 하게 유도하는 유전자가 과거부터 통계적으로 유전자를 지속시키기 위해 가장 적절한 행동이었다는 것이다. 그 결과 특정 개체는 죽을 수 있지만 그 유전자는 결과적으로 다른 개체를 통해 생존하게 되었고 이러한 과정이 더 효율적으로 유전자가 전파되는 과정이라는 것이다.

이를 설명하기 위한 것이 근연도라는 개념이다. 같은 유전자를 공유할 확률이 혈연 간 얼마나 가졌느냐를 가지고 그에 따른 유전자의 생존 확률을 얘기하고 있다. 즉 이타적으로 보이는 행동은 결과적으로 형제자매, 자녀에게 전해진 유전자가 안전하게 보존되도록 하는 유전자로서는 개체를 희생시키고 자신이 살아남는 '이기적' 행동이라는 것이다.

결론적으로 집단선택설에서는 보존해야 할 대상이 종 또는 집단이지만 리처드 도킨스의 주장은 정 반대이다. 한 개체도 아닌 유전자라는 것이다. 그 중 쪼개고 또 쪼개 가장 작고 살아남기 효과적인 단위의 유전자만이 후대까지 살아남을 수 있고 전파된다는 것이다. 이 유전자가 복제되고 후대에 전해지는 불멸의 존재이고 우리 각각의 개체는 이 유전자를 나르는 '기계'의 역할만 할 뿐이다.

이 유전자들이 때때론 이타적으로 보이는 혈연간 행동을 통해 결과적으로 가장 효과적으로 후대에 전해지기 위한 전략을 진화적으로 안정된 전략(ESS, Evolutionarily Stable Strategy)라 부르며 그 과정을 찾아간다.

줄거리에 대해 간단하게 이야기를 해보겠다.

지구가 생긴 초기 바다는 원시 수프 상태였다. 이 환경에서 우연히 자기 복제자가 생겨났다. 그 자기복제자 중 불안정하여 똑같이 복제하기 힘든 것은 사라지고 안정적인 복제자만이 살아남았다. 그들은 차츰 복잡한 형태를 띄게 되었고 복제 과정도 좀 더 복잡해졌다. 비로소 우리가 생명체라 부르는 물체가 생겨난 것이다.

자가복제도 있지만 유성생식을 통해 같은 종의 다른 유전자가 서로 섞이게 된다. 이 과정에서 돌연변이가 생기기도 하고 새로운 형질이 발현되기도 한다. 즉 생물의 매 세대마다 새로운 형질이 나타나고 다른 형질과 경쟁을 하는 것이다.

이 과정에서 중요한 개념이 나온다.

진화적으로 안정된 전략 (ESS, Evolutionarily Stable Strategy)

개체군 내의 대부분의 구성원이 일단 그 전략을 채택하면 다른 대체 전략이 그 전략을 능가할 수 없는 전략

이 책에 설명된 예시로 설명해보겠다. 특정 개체의 성격을 매 순간 싸움으로 결정하는 '매파'와 기존의 전투 능력의 차이, 덩치의 차이 등을 보고 공격하지 않고 순응하는 '비둘기파'로 나뉜다고 보자. 비둘기파는 매파가 공격하더라도 반격하지 않는다.

이 때 비둘기파로만 이루어진 개체군은 상대방에게 얻는 것도 없지만 상처도 생기지 않는다. 이 집단에 매파가 한마리 들어온다고 가정하자. 그러면 매파는 비둘기파를 공격하고 결과적으로 매파가 이득을 취하게 되어 세대를 거듭할수록 매파가 많아질 것이다. 하지만 이는 일시적이다. 결국 매파끼리 싸움을 하기 때문에 상처가 생겨 서로 손해만 보게 될 것이다.

결국 매파와 비둘기파가 어느정도 공존하는 것이 개체군 전체적으로 안정적인 전략이라는 것이다.

이는 한 예시를 든 것이지만 대부분의 집단에서 이런 식으로 균형을 맞추는 특정 비율이 존재하게 될 것이다.

유전자는 이기적이라 하였지만 혈연 앞에서 이타적으로 행동하는 경우가 많이 있다. 이 경우는 앞에서 잠깐 이야기한 근연도 로 설명이 가능하다. 근연도란 두 사람의 혈연자가 하나의 같은 유전자를 가질 확률을 말한다. 엄마와 자식을 비교하면 엄마의 유전자 1/2이 자식에게 갔으므로 근연도를 50% 또는 1/2이라고 표현할 수 있겠다. 형제간은 엄마에게 1/2씩 유전자를 받았으므로 (1/2)*(1/2)로 1/4이 일치하지만 마찬가지로 아빠의 유전자도 받았으므로 1/2 또는 50%의 근연도를 가진다고 볼 수 있다.

이를 수식으로 표현하면 두 사람의 근연도는 (공통의 조상 숫자)*(1/2) 촌수 로 표현할 수 있다. 즉 사촌간이고 할머니 할아버지가 같다면 2*(1/2) 4 로 1/8의 근연도를 가지는 것이다.

이를 보면 이타적 행동을 하는 이유가 보인다. 만일 형제가 3명이라면 집단 전체가 희생하는 것보다 내가 먼저 희생하고 나머지 혈연이 안전하다는 보장만 있다면 내가 희생해도 유전자는 3/2가 남기에 내가 사는 것보다 유전자 입장에서 이득이라는 것이다.

이 뒤로는 비슷한 논쟁들에 대한 대답을 하고 있다. 그렇다면 부모의 입장에서 새로운 개체를 계속해서 낳는 것과 현존하는 개체를 돌보는 것 중 어떤 것이 이득인가? 이것도 근연도를 통해 최대의 자손이 살아남는 수를 결정해 개체를 낳는 것이 중요하다고 이야기한다. 예를 들어 새가 한번에 3마리를 낳으면 겨우 성인까지 먹이를 먹일 수 있는데 5마리를 낳는다면 결국 5마리 모두 먹이 부족으로 성인이 되지 못하고 죽을 수 있다는 것이다. 그렇기에 자연선택으로 적정한 3개의 알을 낳는 유전자가 살아남는다는 것이다.

또한 비슷한 개념으로 최대한 많은 수의 자녀를 성인까지 키우려는 부모와 자신이 더 많은 먹이를 먹고 독점하려는 자식간의 생존 경쟁에 대한 이야기도 한다.

또한 암수의 전쟁 은 더 특이한 상황이다. 대개의 경우 암컷은 수컷에게 착취당할 확률이 높다. 무슨 의미냐하면 암컷은 결국 새끼 또는 알을 배 속에 품고 있어야하고 수컷은 그럴 필요 없이 다른 암컷을 찾아 교미를 지속하면 된다. 하지만 이 경우는 암컷이 에너지 소모가 많아 유전자를 후대에 전하는 효율이 떨어지기에 이 부분에서 암컷과 수컷의 경쟁이 시작된다. 암컷은 자신에게 헌신을 다하는 수컷을 찾게 되고 수컷은 결과적으로 짝짓기에 힘을 다시 쏟는 것보다 새끼를 키우는 것이 효율적이어서 육아에 참여한다는 것이다. 하지만 이는 반대의 경우도 있다. 경솔한 암컷과 바람둥이 수컷의 경우이다.

이 또한 앞의 경우처럼 조신한 암컷, 경솔한 암컷, 성실한 수컷, 바람둥이 수컷의 비율이 생존에 가장 적절한 ESS로 귀결될 것이다. (용어는 책에서 사용한 대로 썼음)

이 문제는 이타적 동물의 끝판왕이라 생각되는 사회성 곤충 으로 이어진다. 개미, 벌, 말벌, 흰개미 등이다. 이 경우는 일개미는 여왕개미와 유전자가 같거나 자매이기 때문에 여왕개미가 유전자를 퍼트리는 것을 적극적으로 도우며 결과적으로 나의 유전자가 퍼지도록 하고 있다.

결국 이야기는 유전자를 넘어 인간만의 특이성으로 불리는 문화로 넘어간다. 문화가 전달되는 단위를 지금도 많이 사용하는 단어인 '밈'으로 표현하고 있다. 난 사실 철저하게 과학적이고 데이터 기반으로 이야기하는 저자가 새로운 부분의 이야기를 가져와 놀랍기도 했고 신선하기도 했다.

이후 책으로도 단독으로 출간된 '확장성 표현형'을 이야기한다. 유전자는 그 유전자 자체와 그 유전자를 가진 개체뿐만 아니라 그 주변에도 영향을 미친다는 것이다. 감기 바이러스는 숙주에게 기침을 유발한다. 이 자체가 자신의 유전자를 다른 숙주에게 전달하기 위한 행동이라는 것이다. 즉 이 부분까지 유전자의 확장된 표현형이라 이야기하고 있다.

지금이야 너무나 유명한 개념이 되었고 많은 사람들이 알고 있지만 아마도 이 책이 나올 때는 꽤 많은 논란이 되었을 것으로 생각된다. 그 부분에 대한 저자의 고민과 새로운 대답, 추가대답이 책 뒤의 보주에 잘 나와있다. 논란의 중심이 될 훌륭한 책을 쓴 것도 대단하지만 그 논란을 추가적으로 대답해 책을 더욱 확장시켜 완성한 자체가 너무 대단하다고 생각한다.

게다가 이런 내용을 뭔가 조금은 인문학적인 관점에서 바라보고 접근한 듯한 느낌이 든다. 과학은 아니 자연은 의도가 있지 않다고 생각한다. 명왕성은 행성이던 행성이 아니던 크게 상관이 없다. 우리가 양자역학을 관측 결과만 알고 있고 그에 대한 해석이 어떻게 접근하던, 정답이던 아니던 상관 없이 양자역학은 그대로 적용될 것이다. 진화도 마찬가지이다. 우리가 유전자를 '이기적'이라고 해석하든지, 개체가 '이타적'이라고 해석하든지 진화의 방향이 바뀌진 않는다. 다만 우리가 세상을 이해하는 방식이 바뀌고 어느정도 큰 줄기를 예측해보거나 특정 행위의 인과를 밝히는데 '도움'이 될 것이다.

어려서 읽어보고 다시 읽은 이 이기적 유전자는 오늘도 많은 생각을 하게 만드는 것 같다. 이 책 옆에 같이 꽂혀있던 '확장된 표현형'도 조만간 읽어봐야겠다."
65067259,이기적 유전자 - 리처드 도킨스,10,https://sarak.yes24.com/review/16859476,"오래 전부터 읽기 시작하여 읽다말다를 반복한 책이다.

이번에 드디어 읽기를 마치게 되었다.

올해 출간 40주년 기념 리커버판이 나왔다.

일반인을 위한 내용이라고 하는데 전문 내용은 얼마나 어려울 지 상상이 되지 않는다.

'이기적 유전자'라는 제목 차체가 독자의 호기심을 부르는 것이 무척 흥미롭게 다가온다.

저자의 의견은 여러 제목을 이야기하고 있지만 제목 덕분에 더 관심을 끄는 책이 아닌가 싶다.

'이기적'이라는 단어보다는 '유전자'에 관심을 기울이고 읽어야 더 접근이 쉽다.

책의 내용은 리처드 도킨스 단독의 연구 결과가 아니다.

그의 동료들의 연구 결과를 독자에게 소개하고 종합하는 역할이다.

무신론자인 그는

""우리는 우리의 창조자에게 대항할 유전자가 있다.

인간만이 유일에게 이기적인 유전자의 폭정에 반역할 수 있다""

고 이야기한다.

생물은 유전자의 이름으로 자기 복제를 하면서 살아간다.

유전자는 여러 세대를 거쳐 사본을 남긴다.

그 과정에서 변이가 나타난다.

안정한 전략(ESS)은 대부분의 구성원이 그 전략을 채택하게 하는 프로그램된 행동방침이다.

동물은 집단을 형성하게 되면서 여러 이익을 얻게 된다.

포식자에게 먹히는 것을 피하게 되기도 한다.

'밈'이라는 단어를 처음 사용한 사람이 리처드 도킨스라고 한다.

이러한 밈은 모방을 통해 문화적 전달을 만들어 낸다.

인간의 독특한 면이다.

TFT(이에는 이, 눈에는 눈) 등 마음씨 좋은 전략이 사기꾼 등 못된 전략보다 대체로 성적이 좋은 결과를 가져온다.

이러한 사실을 사회에서 시사하는 바가 크다.

사람들이 생각하는 것보다 세상에는 좋은 사람이 많다는 것이다.

진화 생물학이라는 분야는 다윈의 진화론을 바탕으로 한다.

내용에 등장하는 수많은 생물의 행동을 읽다보면 책의 주 내용보다는 단편적인 사실에 더 관심이 가는 경우도 있다.

출간 후 40년이라는 시간이 지나도 내용은 새롭기만 하다.

사람들이 잘 알지 못하는 사실을 소개하여 읽고 싶어하는 책이다.

또한 어려운 책을 읽어냈다는 보람을 느낄 수 있는 기회이기도 하다.

#이기적 유전자 #리처드 도킨스 #을유문화사 #과학"
65067259,이기적 유전자,10,https://sarak.yes24.com/review/16841825,"이기적 유전자 #내돈내산 ? 제목: 이기적 유전자 저자: 리처드 도킨스 분류:생물학/유전 출판년도:2018년 40주년 기념판 출판사:을유문화사 ? ? ? 우리는 어떻게 진화해 왔는가? ? ? ? ??세계에서 가장 영향력 있는 과학자이자 저술가인 리처드 도킨스의 책 <이기적 유전자>는1976년에 초판이 나오고 나서 과학계 뿐만 아니라 사회 전반에 큰 반향을 일으켰고 그 이후 꾸준히 관심의 대상이 되는 책이며 이미 40년이 지난 지금까지도 과학을 넘어 우리시대의 고전으로 일컬어지는 책이다. ? ? ??이 책은 인간을 포함한 모든 생명체는 DNA 또는 유전자에 의해 창조된 ‘생존계'이며 자기의 유전자를 후대에 남기려는 이기적인 행동을 한다고 주장한다.이런 생물학적 유전을 확장해서 ‘밈'이라는 문화적 유전 현상까지도 저자만의 논리로 해설한다.생물 유전의 영역을 인간의 문명과 문화로까지 확장해서 말하는 도킨스의 통찰력과 논리적 설명에 매료되어 읽을 수 있는 책이다.이 책은 총 13장으로 구성되어 있는 분량이 좀 많은 책인데 1장에서부터 사람은 왜 존재하는가라는 가장 근본적인 질문에 대하여 이기주의와 이타주의,집단선택설을 통해서 해설한다. ? ? ? ?? 다윈이 진화론을 주장한 이후로 인류는 다윈주의와 자연선택설을 바탕으로 진화에 대해 설명했다.도킨스는 다윈의 진화론을 바탕으로 하지만 자기복제와 이기적 유전자로 모든 생물의 진화를 설명한다.생물은 왜 노화를 하고 죽게 되는지, 부모와 자식의 관계,가족 세대간의 갈등,암수가 짝을 맺는 관계,모든 생물이 집단을 형성 하는 이유 등도 이기적유전자의 영향을 받아서 진화해 왔다고 주장한다. ? ? ? ??48쪽,우리 자신의 이기적 유전자가 무엇을 하려는 녀석인지 이해해 보자.그러면 우리는 적어도 유전자의 의도를 뒤집을 기회를 ,다른 종이 결코 생각해 보지도 못했던 기회를 잡을 수 있을지도 모른다.관대함과 이타주의를 가르치는 것에 덧붙여 말하자면 유전되는 형질이 고정된 것이어서 변경이 불가능하다고 감정하는 것은 오류다.우리의 유전자는 우리에게 이기적 행동을 하도록 지시할 지 모르나,우리가 전 생애 동안 반드시 그 유전자에 복종해야만 하는 것은 아니다.다만 유전적으로 이타적 행동을 하도록 프로그램되어 있는 경우보다 이타주의를 학습하는 것이 더 어려울 뿐이다.동물 중에서 인간만이 학습되고 전승되어 온 문화에 지배된다. ? ? ? ?? 378쪽,순수하고 사욕이 없는 이타주의라는 것은 자연계에는 안주할 여지도 없고 전 세계의 역사를 통틀어 존재한 예도 없다.그러나 우리는 그것을 의식적으로 육성하고 가르칠 방법도 논할 수 있다.우리는 유전자의 기계로 만들어졌고 밈의 기계로서 자라났다.그러나 우리에게는 우리의 창조자에게 대항할 힘이 있다.이 지구에서는 우리 인간만이 유일하게 이기적인 자기 복제자의 폭정에 반역할 수 있다. ? ? ? ??일란성 쌍둥이는 유전적으로 같다고 할 수 있다.그러나 한 명이 시베리아 처럼 추운 나라에서 살게 되고 한 명이 아프리카 같은 더운 나라에서 살게 된다면 서로 다른 모습으로 성장하게 될 것이다.인간은 유전자의 영향을 받지만 환경의 영향도 함께 받으며 성장한다고 할 수 있다.태초의 어떤 창조물에서부터 자기복제를 통해서 끊임없이 자기의 좋은 유전자를 후대에 전달하려고 진화해 왔다는 이 책의 논리에 깜짝 놀라며 읽었다.내용은 생물학을 전문적으로 공부하는 사람이 이해할 수 있는 어려운 내용도 나온다.그러나 전혀 생물학이나 진화에 대해 잘 모르는 사람이라하더라도 생물의 진화를 인간의 문명과 문화까지 확장해서 설명하는 것을 이해하는 데 무리가 없고 오히려 논리의 매력에 빠지게 된다.저자는 다양한 동물들의 실제 예를 방대하게 들어가며 이기적유전자의 힘을 증명하며 설명한다.진화에 관심이 있는 사람이거나 사람이 어떻게 이기적 유전자의 영향을 받으며 오늘날 사회를 이루고 살아가는지 궁금하다면 꼭 이 책을 읽어보기를 추천한다. 리처드 도킨스의 논리적인 매력에 빠지게 될 것이다. ? ? ? #이기적유전자 #리처드도킨스 #을유문화사 #생물학 #진화 #내돈내산 #서평촌 #서평 #북스타그램 #책스타그램 #독서스타그램 #책소개 #독서 #싱가포르 #국제학교 #ib한국어 #UWCSEA #CIS ?"
65067259,이기적 유전자,10,https://sarak.yes24.com/review/15869772,"리처드 도킨스의 이기적유전자를 처음 접했을때 내용도 이해하기 힘들고 어려웠지만 읽을 수록 도킨스작가의 '예지력'이라고 해야할까, 확고한 인간에 대한 신념은 놀라웠다.

인간에 대한 탐구를 주제로 한 찰스다원의 '종의기원'도 유명하고 최근 많은작품들이 있지만,

도킨스의 이기적유전자는 많은 세월이 지났음에도 아직도 많은 독자들의 관심을 가지고 있다. 인간의 어려운 유전자를 해석함으로써 동물과 또 다른면과 생물학적 비유로 적절하게 설명해 놓았다.

이기적 유전자를 읽기전 유발하라리의 사피엔스를 읽었는데 여기에는 인간의 역사에서 경제적,사회적,정치적 혁명이 일어났음에도 인간은 여전히 동일한 몸과 마음을 지니고 있다고 설명하고 있다.

그러나 최근 과학 기술이 발달하면서 우리의 몸과 마음은 새로운 산물에의해서 바뀔수 있다고 설명한다. 이기적 유전자에서는 제목과는 역설적이게도 오히려 협력하는 유전자로 이해 해야한다.

이기적 유전자들 사이의 협동에 대해 중점적으로 논의하고, 각각의 유전자는 다른 유전자들을 배경으로 하여 그 자신의 이기적인 계획을 이행함으로써 다른 유전자들은 각 유전자가 살아가는 환경의 일부다. 모든 생명체를 만들수 있는 건 바로 유전자라는 사실이다.

개인적으로 이기적유전자는 인간과 다양한 생명체가 이세상에 존재하는데에는 유전자가 자신들의 영원에 가까운 생존을 위해 현재의 우리모습을 유지하기 위한 다양한 생명체의 개체를 필요로 했을것이라 생각하며,인간의 존재의 역사와 앞으로의 삶을 이기적 유전자를 통해 알게되었다.

꼭 지금이 아니더라도, 이 책을 읽을 이유가 있으니 한 번 쯤 읽어보시길 바란다.

정말이다."
