goods_no,review_title,rating_score,origin_url,review_text
176913274,읽기 편한책,10,https://sarak.yes24.com/review/21999715,"내용이 쉽게 쓰여져 있고, 사이즈가 작아서 들고 다니며 읽기 편해요. 익히 알고 있다고 생각했던 내용들인데 다시 책속에서 마주하게 되니 생각을 정리해보는 좋은 기회가 되는거 같아서 좋기도 해요. 옆에서 보던 직원이 자기도 읽어보고 싶어했던 책이라고 해서 하나 더 주문했어요."
176913274,[서평] 부처님 말씀대로 살아보니,10,https://sarak.yes24.com/review/21968366,"시간이 아무리 지나도 미워한 사람에 대한 마음을 접지 못하고 산다. 부처님 말씀대로 살아보니 는 주옥같은 15장에서 "" 무해하게 살기 ""가 가장 마음에 와 닿았고 나를 깨치는 울림이 있었다. 이 책을 펼치는 순간부터 미워하는 감정은 멀리 떠나보내고 싶은 간절한 소망이 함께 했다.

1부 正見_바른 견해 의 내용은 보는 법부터 바꾼다: 왜 우리는 행복을 오해하는 가 에서 집착에 대한 이야기가 있다. "" 집착은 스트레스와 고통, 불만족을 낳는다. "" 상대를 있는 그대로 보는 법을 배워야 한다. 나의 틀에 맞추기 보다는 상대를 이해하고 합리적인 사고로 해석하면 지혜의 문은 열리게 된다.

제일 관심있는 부분은 2부 계-戒 에 해당하는 내용으로 삶을 먼저 정렬한다: 스스로 두 발로 서는 방법 이다. 내가 미워했던 사람은 적어도 "" 반사회적인 사람""은 아니라고 본다. 주변사람들의 의견이나 객관적으로 볼 때도 욕심이 많다. 그렇다보니 나에게 적대감을 갖고 분노의 감정을 재우지 못하고 발산하는 경우가 있었다. 나의 친절함이 물거품이 되거나 비웠다고 생각했는데 원만한 소통이 이루어지지 않을 때 또 하나의 벽이 생기게 된다.

가까이 지내는 이들의 비슷함이란 끼리끼리, 유유상종이란 말과 흡사하다. 인간 개개인의 그릇의 차이가 있고 생각이 다르므로 삶과 사람을 바꿀 수는 없다. 생각의 변화를 주기 위해서는 더 많은 노력이 필요하거나 마음을 더 내려놓는 일이다. 사람을 미워하는 일에 나날이 에너지가 많이 소모되고 집착이 되고 미움과 원망이 샘솟는다. 따라서 선한마음, 친절을 베푸는 마음, 관대한 마음, 양심이 있는 마음으로 나를 가꾸고 성장시키는 일에 몰두 한다면 이것이야말로 부처님 말씀대로 하루 하루를 실행하는 것이다. 미워하는 마음이 싹트게 하는 것보다 "" 친절하고 따뜻한 연민의 마음은 결국 우리에게 되돌아온다. "" -82쪽. 부처님 말씀대로 살아보니 를 읽고 희망과 용기를 얻어본다.

"" 거룩한 침묵은 인내와 내려놓음의 미덕을 기르는 것은 물론이고 자기 절제의 근력을 키워준다. "" -109쪽. 침묵은 들어주는 것이고 기다림이다. 그래서 인내가 필요한 것이고 그런 훈련을 통해 마음을 가볍게 내려놓을 수 있게 된다. 꽉찬 마음, 뭔가를 움켜쥐고 놓지 않으려는 마음이 있어 상대를 미워했던 것 같다는 생각이 들었다.

3부 布 施_보시 집착을 느슨하게 : `쥐는 힘`을 약하게 만드는 훈련 은 나를 포함한 지금 이 시대를 살아가고 있는 많은 사람들에게 해당되는 내용이다. 보시와 베품은 더할나이 없이 좋은 실천이다. 그러나 상대에게 돌아오는 것은 배신이 현실이라면 나의 베품과 친절은 허무한 결과이다. 그래서 이 책을 읽고 떠오른 생각이다. 미운 상대에게 보시를 한 것이 아니고 나자신에게 보시를 했다고 마음먹기로 했다. 건강하고 행복한 생각이다.

다음 4부 에는 나를 위로 하고 격려하는 내용으로 定_정 마음을 관찰하는 힘 기르기: 내 마음이 가는 길 은 바로 받아들이는 길이다. "" 지금 이 순간 당장 바꿀 수 있는 것은 아무것도 없다. 이 사실을 받아들이면 고통은 줄어들거나 아예 사라진다. 이 때 평화가 찾아온다."" - 230쪽. 4부에서는 마음 챙김에 관련된 다양하게 명상하는 방법을 이야기가 하고 있다. 집착하거나 흩어져 있는 마음, 감정에 휩쓸려 있는 마음을 다잡아주는 것, 정면으로 바라볼 수 있는 내면의 힘이 마음챙김으로 해석한다.

5부 惠_혜 일상에서 드러나는 지혜: 단순하게 살기 를 읽다보면 물건 `비우는 연습`, 감사하는 습관을 키우고자 하는 의도로 `감사일기 연습` 쓰는 내용이 담겨 있으며 집착을 버리는 일 또한 지혜를 얻을 수 있고 단순하게 사는 것이 행복으로 가는 길이라는 것을 알게 해준다. "" 설거지 명상 ""이 등장하는데 나또한 세수를 하거나 손을 씻을 때 좋은 아이디어나 마음이 힐링이 된다.

6부 慈悲_자비 함께 아파하는 마음: 평안에 이르는 마지막 걸음 에서는 4부에 이어 명상수련을 강조하였으며 자비경은 자애를 크게 두 가지로 나누었는데 "" 자애를 실천하는 사람의 행동과 성품 ... 모든 존재의 안녕을 축원하는 내용 ""을 담고 있는 자비의 실천이 소개되었다. -290쪽. 마음을 맑게 하는 글 291~293쪽. 자비경이 있다. "" 마음이 관대하고 평안하면 상대를 바라보는 받아들이는 폭이 넓어지리라 생각한다.

부처님 말씀대로 살아보니 를 읽고 떠오르는 키워드는 관대함, 진실함, 마음챙김, 비움, 자비 등이다. 이를 통해 연민과 자애를 깨달을 수 있고 느낄 수 있는 경이로운 책이다."
176913274,보통의 인간이라면 누구나 겪는 보통의 감정들에 대한 성찰,6,https://sarak.yes24.com/review/22055809,부처님이 제목에 들어가서 불교관련 책인줄 알았는데 전혀 그렇지 않고요. 정신과의사인 작가의 지아성찰의 경험과 내용이 들어있는 책입니다. 이런 감정이 들땐 이렇게 해야하고 저럴땐 저래야하고 라는 바이블의 내용을 기대한다면 오산이고요. 이러이러한 감정이 드는것은 지극히 정상적인 일이다. 나또한 당신과 같은 감정의 소용돌이속에서 살고 있었다. 하면서 그렇다고 치유에 대한 내용을 주진 않아요. 현재진행형인 보통의 인간들의 감정에 대해 나열하고 설명하고 그런 감정이 드는 우리는 지극히 정상입니다. 다만 내려놓는 불교의 이러한 가르침도 있어요 라는 책이예요. 음 광고빨을 너무 받았네요
176913274,부처님 말씀대로 살아보니,10,https://sarak.yes24.com/review/21990436,"🔖한 줄 평 ㅡ

부처님의 지혜로운 불교 수업

🔖사색평 ㅡ

""욕구는 참는 것이 아니라 다스리는 것

많은 사람이 다양한 충동을 겪는다.내 자리라고 생각되는 주차 공간을 사수하려는

충동,정치적 견해를 방어하려는 충동,

초록색 신호로 바뀌었는데도 즉각 움직이지

않는 차를 향해 경적을 울리고 싶은 충동 등 다양하다.더 본능적인 수준에서 우리는 매력적인 사람을 계속 보고 싶은 충동,

옷 가게에서 물건을 만지고 싶은 충동,

옷 가게에서 물건을 만지고 싶은 충동,

공항 면세점 향수를 일일이 다 맡아보고

싶은 충동,배가 부른데도 디저트를 다 맛보고

싶은 충동 등을 느낀다.또한 많은 사람이 스마트폰의 노예로 살고 있다.지루해질 때면

몇 분마다 스마트폰을 들여다보고 싶은 충동을 느낀다.전 세계적으로 스마트폰 평균 사용 시간은 하루 세 시간 이상이여,이는 계속

증가하고 있다.어떤 충동은 제대로 조절하지 않으면 문제를 일으킬 수 있다.한 잔 마시면 더

마시고 싶은 충동,화가 날 때 폭력적으로 행동하고 싶은 충동 같은 것들이다.계율을

지키는 것은 이런 충동을 잠재우는 훈련이다.

나는 때때로 불필요한 말을 하거나 반감을

표현하고 싶어질 때가 있다.그럴 때마다 충동을 알아차리고 친절한 말의 계율을 떠올린다.또한 세차를 마친 차 안에 돌아다니는 개미를 눌러버리고 싶을 때

안전함이라는 선물과 무해의 계율을 떠올린다.요즘은 '절제'라는 단어 대신

'만족의 지연'이라는 표현이 자주 등장한다.

1970년대 스탠퍼드대학교에서 실시한

만족의 지연에 관한 유명한 실험이 있다.

실험에서 아이들에게 두 가지 선택권을 준다.

지금 당장 쿠키 1개를 먹을 것인가,아니면 15분을 기다려서 쿠키 2개를 먹을 것인가?

15분의 기다림을 선택한 아이들은 나중에

더 뛰어난 자기 절제력을 보였으며, 신체적으로나 정신적으로나 건강 면에서

더 좋은 결과를 보였다.또한 그들은 경제적으로도 성공적인 삶을 살았다.

꾸준히 계율을 실천하면 욕구를 다스릴 줄

알게 되며,더 나은 미래를 위해 순간의 쾌락을

미루는 법을 배울 수 있다.""

정신과 의사이자 수면의학 분야의 세계적인

권위자인 토니 페르난도 저자가 쓴 불교 수업이다.불교 수행을 삶 속에서 실천하며

의학과 수행을 가로지르며

'마음의 고통을 줄이는 실제적 방법'을

평생을 걸쳐 탐구하며 쓴 심리학 도서이다.

부처님의 가르침과 저자의 의학과 수행이

더해져 삶의 지혜를 만날 수 있는 책이다.

스트레스와 행복에 대한 삶의 극복법과

생활의 지혜에 대해 다루고 있어

곁에 두고 교과서로 틈나는대로

펼치면 마음의 평안을 안겨주는

심리학 교양서로 권장하여 봅니다.

삶에 대한 태도로 자신의 마음챙김이

중요하다고 합니다.이성과 감성의 조화가

무엇보다 현대에 필요하다고 생각됩니다.

🔖윌마 출판사와 인디캣 책 곳간으로부터 제공받은 도서입니다. 대단히 감사드립니다.

#📚책통령📚

#부처님말씀대로살아보니

#토니페르난도_지음#강정선_옮김

#윌마출판사#윌마#철학#인문학#명상

#자기계발#15가지불교수업#불교

#부처님#심리학자#심리학

#인디캣#인디캣책곳간

#명상#위로#위안

#힐링도서추천#위안도서추천

#인문학#책#서평단#서평#추천도서

#신간소개#신간추천#베스트셀러

#양서소개하는알고리즘

#양서추천하는여자"
