goods_no,review_title,rating_score,origin_url,review_text
176913274,정신과의사가 알려주는 부처님의 지혜로운 말씀,10,https://sarak.yes24.com/review/21968301,"이 책은 정신과 의사이자 수면의학 분야의 세계적인 권위자 토니 페르난도 저자 가 불교의 가르침과 인간의 정신적인 면을 아울러 설명하면서 삶의 고통을 줄이는 방법을 알려주는 책 이다.

저자는 '마음의 고통을 줄이는 실제적 방법' 에 대해 평생에 걸쳐 연구해왔다고 한다. 수많은 환자들을 만나면서 기존의 치료법만으로는 한계를 느끼고, 부처님의 말씀과 명상을 활용 하고 많은 환자들의 치료에 좋은 변화를 가져왔다.

저자는 부처님을 역사상 가장 명석한 심리학자 라고 말한다. 저자의 말씀에 나 또한 마음 깊이 공감하며 책을 읽어나갔다. :)

* '파판차'란 무엇인가?

부처님은 말했다. ""파판차를 알아차리고 그것을 질병처럼 여기며 벗어나야 한다."" 그는 파판차에 빠진 상태가 곧 고통이라고 말했다. p.72

머릿속 모든 생각과 말을 진실이라고 믿지 말자. 그것만으로 우리는 편안해질 수 있다. p.68

부처님은 말했다. ""파판차를 알아차리고, 그것을 질병처럼 여기며 벗어나야 한다."" p.72

'파판차'란 부처님의 가르침을 기록한 고대어 팔리에서 유래한 말이다. 마음이 생각과 이야기나 발상에 매몰되어 소용돌이처럼 확산되는 과정 을 파판차라고 한다. 흔히 생각에 푹 빠져서 갈 곳을 잃은 상태를 말하며, 때로는 마음이 머릿속을 마구 뒤섞어 놓으며 나의 생각에 매몰되는 것 을 말한다고 한다.

정신과 의사인 저자는 우울증을 겪고 있던 70대 참전용사 윌리엄을 만났다. 황소같이 우람하고 몸집이 큰 환자는 치료를 계속해도 나아질 기미가 보이지 않았다. 그러던 어느 날 환자는 아직 솔직하게 말씀드리지 못한 말이 있다고 말한다. 저자는 그때부터 머릿속이 폭주하기 시작한다. 파판차에 빠진 것이다 ! '의사 자질이 없다고 말하고 싶은건가?, 증상이 나아지지 않아 불평하는 건가, 환자가 정신을 놓고 나에게 살의라도 품는 걸까?!!!' 여러가지 생각이 소용돌이치고 혼자만의 생각에 갇혔던 저자에게 환자는 자신의 가장 깊숙한 내면의 이야기를 고백하게 된다. 소용돌이 같던 파판차라는 생각이 지나가고 저자는 자신이 만든 생각에 사로잡혔음을 깨닫게 된다.

이처럼 우리는 타인의 행동이나 말 한마디에 나혼자만의 생각 속에 빠지게 된다. 그런 생각은 내가 만들어낸 두려움에 갇힌 생각일 뿐, 실제로 일어나는 확률은 극히 드물다. 내가 만든 상념에 사로잡혀 현실을 객관적으로 보지 못하거나, 화가 나거나 두려움에 사로잡히는 오류를 범하게 된다. 이것이 인간이고 부처님은 이런 자신의 파판차를 알아차리라고 말한다.

이 책을 읽으면서 작가에 대해 친근한 마음이 들었다. 특히 '파판차'에 대한 부분에서 작가 또한 우리가 겪는 마음의 동요와 어려움을 느꼈던 일화를 읽고, 나 또한 '파판차'를 외치며 나의 마음 상태를 알아차리고 나아질 수 있다는 긍정적인 생각이 들었다.

이 책은, 여러 일상적인 상황을 예시로 들고 그에 따른 설명을 덧붙인다. 그래서 부처님의 말씀이 더 쉽게 다가온다. 불교를 믿지 않는 사람도 책을 읽으면서 고개를 끄덕끄덕 할 이야기들이 많이 있다.

* 정견 (正見) _ 인생을 바라보는 방법(태도)

우리는 삶에 대한 불만과 불안을 어느 정도 안고 살아간다. 모든 게 괜찮아 보여도, 만족감이나 편안함은 오래가지 않는다. 나 역시 마찬가지다. 결국 우리는 모두 두카(스트레스)를 경험하며 살아간다. p.28

인간관계는 기본적으로 불안정하다. 인간 자체가 육체와 감정이 끊임없이 바뀌는 존재이기 때문이다. p.33

자신을 특별하게 생각할지라도 누군가가 당신이 원하는 만큼 관심을 주거나 존중해 주지 않는 것은 어쩌면 당연한 일이다. p.41

'마이 네(무상)' 는 그럴수도 있고, 아닐 수도 있다는 뜻이다. 모든 것은 본질적으로 불확실하다. 정말로, 모든 것이 그렇다. 날씨와 건강, 인간관계, 생각, 감정, 심지어 아원자 수준의 물질까지 세상의 모든 것은 끊임없이 변화한다. p.60

1부에서는 우리에게 인생을 바르게 바라보는 법에 대해서 가르쳐 준다. 우리는 왜 행복에 대해 오해하는지, 어떤 시선으로 행복을 바라보고 받아들여야하는지, 스트레스를 어떻게 대해야 하는지 부처님의 말씀을 통해서 지혜를 알려준다.

부처님은 인간은 항상 불안하고 불만족하는 존재이며, 우리 삶이 어떤 모습이든 불안과 불만족은 늘 따라다닌다고 한다. 집착이 스트레스를 만들며, 이 스트레스를 '두카'라고 한다.

* 친절하고 정직하게 말하라

부처님은 이렇게 말하셨다. 모든 사람을 다 이해할 필요는 없다. 이해하려는 마음만으로 충분하다. p.105

인생을 살다보면 타인의 말로 인해 상처를 받거나 오해가 생길 수 있다. 책에서도 그런 상황을 피해가는 사람은 없을거라고 말하며, 이런 상황에 어떤 마음가짐을 가져야하는지 책을 보면 알 수 있다.

또한 나의 마음과 다르거나 자신만의 신념을 강요하거나 이해할 수 없는 말을 하는 타인을 모두 다 이해할 필요도 없다. 더구나 말로 싸워서 이기기 위한 논쟁도 불필요하다. 부처님의 말씀처럼 이해하려는 마음만으로 충분한 것이다. 나는 말에 대한 부처님의 말씀과 저자의 배려깊고 어떤 상대든 존중하는 마음이 깊이 와닿았다.

* 좋았던 문장들

무해의 정신이 얼마나 중요한지 알게 되었다. 해를 끼치지 않고 친절하게 사는 것이 부처님이 제자를 훈련하는 기본 중의 기본이었음을 깨달았다. 연민이 없는 마음챙김은 피상적이고 불완전하다. p.80

<법구경>에서 45년간의 가르침을 다음과 같이 압축했다. ""악한 행위를 삼가고, 선한 행위를 실천하며, 마음을 정화하라."" p.87

최선을 다해 노력해도 삶의 평온은 오래가지 않는다. p.179

내가 끊임없이 극복하고자 하는 중독 중 하나가 '내가 옳다'라는 생각이다. 다른 사람이 잘못된 방식으로 일하거나 더 많이 알지 못한다는 생각이 들면 그때부터 판단이 들어간다. 다른 사람이 내 기대대로 행동하지 않으면 짜증이 난다. p.244

숨을 쉬지 않으면, 몇 분도 채 되지 않아 죽고 맙니다. 숨을 인정하세요. 들이쉬고 내쉬면서 조용히 말해봅니다. ""숨을 쉴 수 있어 감사합니다."" p.261

위에는 내가 특히 좋았던 내용을 일부만 적었다. 저자는 이외에도 여러가지 불교의 계율에 따른 마음챙김에 대해 이야기한다. 또한 불교에서 중요하게 실천하는 '보시'라는 베풂에 대한 이야기 도 이 책에 들어있다. 내 마음을 관찰하고 들여다보는 4부의 이야기 에서는 마음챙김의 중요성 을, 5부에서는 소유하지 않고 내가 틀릴 수도 있음 을 알아차림을, 6부에서는 타인에 대한 친절과 연민에 대한 자비 를 논한다.

----------------------------

글을 읽고나서 ....

현대적이고 이성적인 저자의 말씀과 철학적인 부처님의 말씀이 한데 어우러진 책이었다. 심리학과 불교가 만난 책으로, 현실의 상황을 예로 들어 부처님의 말씀을 쉽게 풀이해놓았다. 어려운 불교용어가 나오는 책이 아니라서 글이 쉽게 이해된다.

평소 불교의 철학적인 말씀에 마음 깊이 공감하고 있던 나에게, 이 책은 기본적으로 인간이 가진 심리학적인 면도 동시 만나 볼 수 있는 시간이었다.

부처님은 나에게 늘 많은 깨달음을 주신다. 부처님의 말씀 한 문장 한 문장에 깊게 위로받던 시절이 있었다. 오랜만에 부처님의 말씀을 마음에 다시 새기는 계기가 된 이 책을 읽으면서도 위로받고, 공감하고 또다시 깨달음을 얻는 귀중한 시간이었다. :)

#부처님말씀대로살아보니 #토니페르난도 #강정선옮김 #윌마출판사 #인디캣 #인문학책추천 #불교책추천 #신간책추천 #자기계발 #명상 #마음챙김 #심리학책 #부처님말씀으로마음의위로받는책 #삶의지혜를얻는책 #도서제공"
176913274,반복해서 읽기 좋은 책,10,https://sarak.yes24.com/review/22063178,"어떻게 살아야 하는지 방향을 잡도록 도와준 책입니다. 제 자신을 되돌아보기도 하고요. 책 내용이 이해도 잘 되고 마음이 편해지면서 저의 과거 행동도 다시 점검하며 어떻게 해야 좋을지, 제가 살아가고 싶은 삶의 형태는 무엇인지 찾도록 도와주었습니다. 다만 제가 읽고서 실천을 하다가 다시 회귀..하려고 해서 계속 반복해서 읽고 실천을 지속해야겠더라고요^^ 주변에도 추천해주고 싶은 책입니다."
176913274,부처님 말씀대로 살아보니,10,https://sarak.yes24.com/review/22055348,"*도서 제공* 부처님 말씀대로 살아보니 윌마 나는 평소에 법륜스님의 말씀을 듣는 시간을 좋아한다. 스님의 말씀에는 이해도 있고, 유머도 있고, 듣다 보면 웃음도 나고 마음이 한결 편안해진다. 그래서인지 종교를 떠나 ‘좋은 말’로서 스님의 이야기를 자주 찾게 된다. 사실 나는 이 책을 종교적인 관점으로 접근하지는 않았다. 우리 집은 특별한 종교가 있는 가정은 아니지만, 아이와 함께 다양한 종교를 경험해 보려고 노력하는 편이다. 크리스마스 시즌에는 명동성당에 가서 촛불을 켜고 기도를 하고, 5월이 되면 조계사나 봉은사를 찾아가 조용히 시간을 보내기도 한다. 아이와 함께 종교를 ‘믿음’이라기보다 ‘이해하고 경험하는 것’으로 받아들이고 있는 것 같다. 그래서인지 나는 종교를 떠나 부처님의 말씀 자체를 좋아한다. 《부처님 말씀대로 살아보니》라는 제목을 처음 봤을 때도 읽기 전부터 마음이 편안해지는 느낌이 들었고, 요즘처럼 마음이 바쁘고 생각이 많아지는 시기에 나에게 꼭 필요한 책이라는 생각이 들었다. 이 책은 단순히 종교적인 가르침을 전하는 것이 아니라, 마음을 어떻게 바라보고 다루어야 하는지에 대해 차분하게 풀어내는 책이다. 특히 부처님의 가르침을 현대 심리학과 연결해서 설명해 주는 부분이 인상 깊었는데, 우리가 왜 스트레스를 받고 왜 같은 생각을 반복하며 스스로를 더 힘들게 만드는지에 대해 읽다 보니 자연스럽게 내 이야기를 돌아보게 되었다. 읽으면서 느낀 점은 생각보다 나는 내 감정을 그대로 받아들이기보다 더 크게 키우고 있었고, 아직 일어나지 않은 일까지 미리 걱정하거나 이미 지나간 일을 계속 떠올리며 스스로를 지치게 하고 있었다는 것이다. 그런데 이 책은 그런 나의 마음을 지적하거나 바꾸라고 강요하기보다, 그저 알아차리고 바라보는 것만으로도 충분하다고 이야기해 주는 것 같아서 읽는 내내 부담 없이 받아들일 수 있었다. 또 마음을 다루는 방법이 거창하거나 어렵지 않고, 일상 속에서 충분히 실천할 수 있는 방식으로 설명되어 있다는 점도 좋았다. 생각이 많아질 때 잠시 멈추어 보는 것, 감정이 올라올 때 그것을 그대로 바라보는 것, 그리고 지금 이 순간에 집중해 보는 것 같은 작은 실천들이 쌓이면 마음이 훨씬 가벼워질 수 있다는 메시지가 자연스럽게 전해졌다. 무엇보다 좋았던 건 이 책이 단순한 위로에서 끝나는 것이 아니라, 스스로를 이해하고 돌아볼 수 있는 시간을 만들어 준다는 점이었다. 바쁘게 흘러가는 일상 속에서 잠시 멈춰 서서 나의 마음을 바라보고 싶을 때 다시 꺼내 읽고 싶은 책이라는 생각이 들었다. 종교를 떠나 마음에 대한 이야기를 편안하게 읽고 싶은 분들, 그리고 바쁜 일상 속에서 스스로를 돌아보는 시간이 필요했던 분들이라면 한 번쯤 꼭 읽어보길 추천하고 싶은 책이다. 📘✨ 📌출판사로부터 도서를 제공받아 작성한 주관적인 후기입니다. #부처님말씀대로살아보니 #윌마 #부처님말씀 #통찰 #지혜 #성찰 #위로 #평온"
176913274,[리뷰]『부처님 말씀대로 살아보니』,10,https://sarak.yes24.com/review/22053750,"도서를 무료로 협찬 받아 주관적으로 작성한 리뷰 입니다. 이 책을 읽으며 가장 크게 느낀 감정은 안도감이었습니다. 그동안 저는 감정의 기복이 심하거나, 사소한 일에도 쉽게 상처받는 제 모습을 보며 스스로를 부족한 사람이라고 생각해왔습니다. 하지만 이 책은 그런 저의 시선을 완전히 바꾸어 주었습니다. 문제는 제가 특별히 예민하거나 부족해서가 아니라 인간이라는 존재 자체가 원래 불완전하고 비합리적이라는 사실을 이해하지 못했기 때문이라는 것을 깨닫게 되었기 때문입니다. 특히 인간은 원래 비합리적이다라는 메시지는 제게 큰 전환점이 되었습니다. 우리는 늘 더 나은 판단 더 완벽한 선택을 해야 한다는 압박 속에서 살아갑니다. 저 역시 실수하거나 감정적으로 반응할 때마다 스스로를 자책해왔습니다. 하지만 이 책을 통해 ‘완벽하지 않아도 괜찮다’는 것이 단순한 위로가 아니라 인간의 본질에 대한 정확한 이해라는 것을 알게 되었습니다. 그 이후로는 감정이 흔들릴 때마다 “이건 자연스러운 반응이다”라고 스스로를 다독일 수 있게 되었습니다. 또한 ‘파판차’라는 개념은 제 일상에 바로 적용할 수 있는 매우 실용적인 배움이었습니다. 저는 종종 한 번의 부정적인 경험이 머릿속에서 계속 확장되며 불안으로 이어지는 상황을 겪어왔습니다. 하지만 이 책을 통해 그것이 단순한 ‘생각의 습관’이라는 것을 알게 되었고, 그 흐름을 인지하는 것만으로도 충분히 멈출 수 있다는 점이 인상 깊었습니다. 이제는 부정적인 생각이 이어질 때 “지금 내가 두 번째 화살을 쏘고 있구나”라고 인식하며 한 발짝 떨어져 바라보려고 노력하고 있습니다. 언어에 대한 부분도 깊이 남았습니다. 평소 저는 말을 크게 의식하지 않고 사용하는 편이었지만, 이 책을 통해 말이 단순한 의사소통 수단이 아니라 나의 마음 상태를 반영하고, 동시에 내 마음에 영향을 미치는 중요한 요소라는 것을 깨달았습니다. 특히 불필요한 말이나 타인을 평가하는 말이 결국 나 자신의 에너지를 소모시킨다는 점에서, 앞으로는 말을 하기 전에 한 번 더 생각하는 습관을 들이고 싶어졌습니다. 이 책을 통해 제가 배운 가장 중요한 점은 ‘마음을 관리하는 것도 훈련이 필요하다’는 사실이었습니다. 우리는 공부나 운동에는 꾸준한 노력이 필요하다는 것을 알면서도, 마음은 자연스럽게 잘 다스려질 것이라고 착각해왔습니다. 하지만 이 책은 마음 역시 매일 돌보고 관찰해야 하는 대상이라는 점을 강조합니다. 이 깨달음은 제 일상에 큰 변화를 가져왔고, 앞으로도 계속 실천해보고 싶은 부분입니다. 결국 이 책은 저에게 완벽한 사람이 되는 방법이 아니라, ‘있는 그대로의 나를 이해하고 받아들이는 방법’을 알려주었습니다. 그리고 그 이해를 바탕으로 조금 더 평온한 삶을 살아갈 수 있는 방향을 제시해 주었습니다. 앞으로 힘든 순간이 찾아올 때마다 이 책에서 배운 개념들을 떠올리며, 감정에 휘둘리기보다 그것을 이해하고 다루는 사람이 되고 싶습니다. 이 책은 단순한 자기계발서를 넘어, 스스로를 괴롭히며 살아가는 많은 사람들에게 꼭 필요한 ‘마음의 사용법’을 알려주는 책이라고 생각합니다. 저처럼 자신의 감정 때문에 힘들었던 경험이 있는 사람이라면, 이 책을 통해 분명히 위로와 동시에 현실적인 해답을 얻을 수 있을 것이라고 느꼈습니다. #부처님말씀대로살아보니 #토니페르난도 #윌마 #리뷰의숲 #리뷰의숲서평단"
176913274,추천해요,10,https://sarak.yes24.com/review/22050635,"ㅡ 주말이었어요. 남산에 가는데 많은 차들이 우리 차 앞으로 끼어들려고 준비를 하고 있더라고요. 한 두대를 양보해주고 출발을 하려는데 자꾸 끼어들어서 남편에게 이제 양보하지 말자고 말했어요. ""그래봤자 몇 초 차이밖에 안나"" 그 차가 내 허락도 없이 내 공간을 차지했다는 생각에 언잖았던 것이죠. 그렇다.‼️ 우리 마음은 끊임없이 무언가를 소유하려 한다. 내 주차장, 내 도로, 내 아이, 내 가족... 그러나 이 중에 실제로 내 것은 아무것도 없다는 것. 비슷한 예로, 깜빡이를 켜고 주차를 하려고 할 때, 작고 빠른 차가 나타나 그 자리에 주차를 해버리는 상황. 그 차가 '내' 자리를 뺏었다는 생각이 들지 않나요? ❓️ 정말로 이 자리가 내 것인가? ❓️ 정말로 내 이름표라도 달려있는가? ❓️ 정말로 내가 먼저 발견한 것이 맞는가? 진정한 내 소유라면, 완전히 통제할 수 있어야 한다는 것‼️ 기껏해야 물질적인 것들의 임시 관리인에 불과한 것이며, 그 조차도 온전히 통제할 수 없다는 것이죠. 우리의 착각은 결국 많은 고통과 슬픔을 낳는다는 것. 가볍게 쥐는 법을 배우는 것이야 말로 이 시대를 즐기는 방법이 아닐까싶어요. 이 책은 6가지의 큰 주제와 15가지의 메세지를 전해주고 있어요. 쥐는 힘을 약하게 만드는 훈련을 통해 관대함과 베풂에 대해 이야기를 하고, 마음을 관찰하는 힘을 통해 마음챙김과 일상에 들이는 방법, 돌아오는 방법에 대해 이야기를 나누고, 단순하게 사는 방법을 통해 느슨함과 중독에 대해 깊은 지혜의 이야기를 평안에 이르는 마음을 통해 친절과 연민, 마음이 머물러야 할 네 가지의 자리에 대해 다루고 있어요. ""너무 꽉 주고 있으면 밧줄에 손이 덴다."" 집착은 스트레스와 고통, 불만족을 전하고 느슨함은 평화와 만족, 행복을 누릴 기회를 전해준다는 것을 일상에 맞이하는 방법들이 기억에 남더라고요. 몸과 마음 그리고 공간도 느슨하게 바라보는 방법. 우리는 손에 무엇을 꽉 쥐고 있나요? ""여러분은 어떻게 놓을 것인가요?"" 이 책은 리뷰의숲을 통해 출판사로부터 도서를 제공받아 작성하였습니다. 귀한 책 감사합니다 💕"
176913274,마음을 비우는 가벼움의 길,10,https://sarak.yes24.com/review/22049946,"일상의 무게를 덜어내고 마음을 맑게 하는 지혜를 담은 책이다. 저자는 불교의 가르침을 단순한 교리로 머무르지 않고, 현대인의 삶 속에서 실천할 수 있는 15가지 수업으로 풀어낸다. 집착을 내려놓는 법, 타인을 이해하는 시선, 순간을 온전히 살아내는 태도는 독자에게 깊은 울림을 준다. 읽는 동안 마음이 차분해지고, 책을 덮은 후에는 삶을 조금 더 가볍게 바라볼 수 있는 힘을 얻게 된다."
