goods_no,review_title,rating_score,origin_url,review_text
65067259,믿기지 않을 정도로 실망한 책,2,https://sarak.yes24.com/review/16560110,"어째서,

50년 전에 나온 이 책이 아직도 과학계의 정점으로 추앙받고 있을까?

'후성유전학'이라는 학문에서, 유전자, 즉 DNA는 얼마든지 우리의 경험과 일상을 통해 변화할 수 있음이 증명되었고, 인정되었는데..

왜

어째서,

'유전 형질은 일반적인 경험을 통해 바뀔 수 없다!'라고 주장한 사람의 책이 이토록 각광받고 있을까?

내가 무슨 이야기를 하고자 하느냐 하면,

'틀렸잖아.'

예의 있게 말한다면,

'틀렸잖아요.'

리처드 도킨스의 50년에 가까운 주장과 그에 가설이 '후성유전학'에 의해 '틀렸다!'라는 게 밝혀졌잖아요. (예의 있게 또 말해서)

아니,

틀렸는데.

왜 이 틀린 가설이 아직도 호응을 받느냔 말이다.

사람들이 아직 '후성유전학'에 대해 잘 모르기 때문일거고,

이 책이 인기가 있으니까, 많이 읽혔으니까, 다수를 따라서 패딩을 입는 한국인 특성상 그냥 읽고 똑같이 박수치는 게 두 번째 이유일거고,

뭔가 이 책을 읽었다는데에 있어 어떤 만족 내지 우월감을 얻었기 때문일건데..

뭐,

일반인들은 그렇다쳐도,

생물학자와 같은 학자들은 왜 이런 사실을 이야기 안할까?

욕먹을까봐?

모르겠다.

정말 솔직하게 말해서, 애초에 이 책은 이만큼 인기있을 만한 책이 사실 아니다.

왜냐하면,

이 책은 처음부터 끝까지 증명 이나 입증 없는, 리처드 도킨스 개인의 주관적 주장, 잘쳐줘봐야 증명 없는 '가설', '제안' 이니까.

그리고,

여기서 말하는 주 내용이 결국 닭이 먼저냐, 달걀이 먼저냐 하는 논제와 같기에 장장 50년 동안 리처드 도킨스는 자신의 가설을 지킬 수 있었다.

리처드 도킨스는 그저 '닭이 먼저다!' 라고 주장했을 뿐이니까.

다만, 현대 사회나 현대인들이 '리처드 도킨스'에 '닭이 먼저다! = 인간은 유전자를 담는 그릇이다' 하는 개인 주장을 선호했기 때문에 그런 시대상이 여기까지 이어져, '사실상 학술적 천운으로' 아직도 과학의 정점 취급을 받게 된 것.

이게 다인데.

만일, 후성유전학에 따라 우리 인간의 DNA가 진실로 변화한다면(변화 한다.), 리처드 도킨스에 인간은 유전자를 담는 그릇이란 소리는 틀린게 된다. 다른게 아니다. 틀렸다.

조속히, 이런 과학적 사실을 많은 사람들이 알아서, 반세기 전에 고리타분한 유사과학에 대한 신봉과 맹신 좀 멈췄으면 한다.

그래야 우리나라가 조금이라도 더 발전하지 않을까 싶으니까."
65067259,왜 이 책 읽기를 두려워했을까?,10,https://sarak.yes24.com/review/13165209,"이 책을 읽기 전에 가지고 있던 선입견들... 리처드 도킨스의 책을 읽어본 사람들이 주위에 몇 명이나 있을까? 내 주위에는 그리 많치는 않을 것 같다. 하지만 리처드 도킨스의 이기적 유전자란 책에 대해서 모르는 사람은 또 몇 명이나 될까? 내 주위에는? 아마 거의 없을 것 같다. 이처럼 리처드 도킨스의 책은 읽기도 전에 평가되어지고 화자되어지고 그리고 그 내용이 다 알려진듯한 책이다. 그래서 그런지 별로 읽고 싶지 않았다. 물론 내가 크리스찬이기 때문일런지도 모르겠다. 그런데 이제는 읽어봐야 겠다는 생각이 들었다. 아마 반평생 살아온 내력이 작용을 했을 수도 있고 이번에 40주년 기념판이 나왔기 때문이지도 모르겠다. 그런데 마침 리딩투데이 카페에서 읽는 기회도 주어졌다. 야호~~~ 그래 한번 도전해 보자!!! 읽으면서 드는 생각들... 뭐시기... 왜케 어려운듯 무슨 말을 하는 지 모르겠는듯, 거기다 우리는 생존기계 ㅋㅋㅋ 그런데 1장에서 3장까지 읽어가자 은근 읽는 속도가 붙기 시작하더니 재미있어졌다. 어라~~~ 도킨스가 의외로 글쓰기의 파이터 일쎄... 얌전한 샌님 같은 과학도는 아니신듯... 신랄하게 몰아부칠때도 있고 자기가 틀린것에 대해서 쿨하게 잘못 생각했다고 말하기도 하는 속시원한 글쓰기의 달인이 아니신가... p180 다윈 이후 진화론에서 가장 중요한 진보를 꼽으라면, ESS 개념의 창안을 들어야 할 것이다.(처음 간행된 책) p529 이 문장은 조금 지나치다. 나는 아마도 그 당시의 생물학 문헌, 특히 미국에서 ESS 개념이 무시되고 있는 것에 과잉 반응을 했던 모양이다. 푸하하~~~ 이런식의 자신의 오류? 자진납세 하신다. 물론 자신이 보기에 얼토당토 하지 않은 이론과 글에 대해서는 주저함 없이 깐다? p70 우리는 잘못된 사본을 나쁜 것으로 생각한다. 더욱이 인간의 문서인 경우에는 오류가 더 나은 것으로 간주되는 사례는 생각하기 어렵다. 구약성서의 그리스어 판본을 만든 학자들이 '젊은 여성'이라는 히브리어를 '처녀'라는 그리스어로 오역하여 ""보라 처녀가 아들을 잉태하여,,,,"" 성서 무오점을 주장하는 학자들에게는 날벼락 같은 이야기 일것 같은데,,, ㅋㅋ 꼭 싸움을 걸려고 그러는 것 처럼 글을 썼다. 어쩌면 그래서 더 유명해 지지 않았을까? 란 생각도 해본다. 제목도 이기적유전자가 가지고 있는 사람들이 오해 하고 화나고 뭐그래 할 수 있는 걸로 선택한 것만 봐도 재미있는 분이다. 전체적으로 다 읽고 나서는 내가 왜 이 책을 읽기를 두려워 했을까? 였다. 이상하게 내가 생존기계라는 것이 처음에는 기분 나쁘게 드렸다. 그런데 책을 어느 정도 읽게 되는 순간 겸손이라는 단어가 내 안에 떠오르는 이유는 무엇일까? 나는 그냥 하루하루 열심히 생존하는 개체일 뿐이다. 말로 설명하기 어려운 세상 돌아가는 이치가 만약 도킨스가 말하는 이기적유전자의 원리대로라면 그럴수도 있겠다 라는 생각도 들었다. 물론 내가 가진 상식과 머리 지성의 한계로 인해 다 이해하지 못한 점이 아쉬울 뿐이지 재미있었다. 도킨스가 말한 이기적유전자 사람은 왜 존재하는가? 지구상에 생물이 생기기 이전에 일반적인 물리 화학적 과정을 통해 분자의 초보적인 진화가 일어났을 수 있다 이기적유전자 p65 즉 DNA 출몰의 배경이다. 이 유전자들은 생존을 위해 자연선택에 의해 자기에게 가장 이로운 방법으로 자기복제를 해가며 생명을 연장시켜 살아간다. 그중에 자연선택이므로 여러가지 생명들이 탄생하게 되며 자기 복제의 오류는 또한 생명진화가 되는데 필수적인 요소였다고 말한다. 즉 도킨스가 말하는 사람은 유전자가 자연선택에 의해 택하게 된 하나의 개체인 인간이란 종으로 유전자가 생존하기 위해 존재하는 하나의 개체라는 설명이다. 처음엔 뜨아 했지만 어찌보면 인간이 태어나자마자 엄마의 젖을 빨고 자기의 생존을 위해 기본적인 생리욕구를 한다는 것은 유전자의 힘일런지도 모른다고 생각이 들었다. 인간만이 가진 진화중의 하나 - 의식(자아의식) 이기적인 새끼 새는 둥지에서 부모로부터 먹이를 공급 받는다. 이상적인 경우는 똑같은 분배를 말하지만 현실은 더 심하게 우는 새끼 새에게 먹이가 더 많이 간다. 이기적인 유전자는 더 심하게 울어대려고 할 것이다. 즉 사기를 치는 것이다. 하지만 이것이 항상 통하는 것은 아니다. 왜냐하면 자연선택에 의해 심하게 울면 외부에 의해 공격을 당할 가능성이 많기 때문에 그런 속임수는 무의미 함을 알게 되는 것이다. 그것은 우리가 자식들에게 인간의 윤리에 대한 교훈을 도출한다면, 그것은 우리가 자식들에게 이타주의를 가르쳐 주지 않으면 안된다는 것이다. 자식들의 생물학적 본성에 이타주의가 심어져 있다고 기대할 수 없기 때문이다. 이기적유전자 p276 이런 발상이 아주 신선했다. 이 책이 처음 쓰여졌을 때가 1976년이니까 그후 몇 십년동안은 유전자가 모든 사회문제에 해결책이자 문제점 처럼 말해졌던 시기이다. 살인을 했다면 그 사람한테는 살인유전자가 있겠지,,, 모든게 유전자 탓으로 돌려 인간의 책임을 회피하려는 말들을 많이 했는데 이기적유전자란 아주 이기적일것만 같은 책의 저자가 그러기 떄문에 인간에게 교육해야 한다고 말하고 있는것이다. 도킨스가 이 책을 통해 제일 말하고 싶은 것은 이것일지도 모르겠다. 인간은 혼자 살수 없기 때문에 서로 호혜적 이타주의를 실현해야만 하는 집단이라고,,,, 마지막으로 요즘 유행하는 밈에 대해서 잠깐 이야기 하자면 밈은 문화적은 진화이다. 인간은 기록을 할수 있는 생명체이기 때문에 그것이 더 잘 문화라는 이름으로 진화되는 것이 아닐까 싶다. 도킨스의 다른 책들을 읽어보고 싶다. 리처드 도킨스 스스로 자신의 저서 가운데 최고의 역작으로 확장된 표현형을 꼽는다고 한다. 다음엔 이 책을 도전해서 읽어 보고 싶다. *이 책은 리딩투데이로부터 지원받아 읽고 작성했습니다."
65067259,이기적인 자기 복제자의 폭정에 반역을...,10,https://sarak.yes24.com/review/12256513,"너무나도 유명한 책 이였기에 오히려 한참이나 지난 이제야 손에 들게된 책이다. 나의 유전자는 그 동안 이 책을 알면서도 왜 거부했을까. 그러다 최근에 다윈의[종의 기원]과 [이기적 유전자]를 연달아 읽어 볼려고 했을까. 코로나라는 바이러스의 정체를 알아볼려는 걸까. 도킨스는 출간후 40년을 원문은 그대로 두고 그 사이 변화된 시대상황이나 타 학자들의 반박에 대한 재반박을 뒤에 있는 보조주석을 통해 말 하고 있다. 그 만큼 본인의 연구와 이론에 대한 주장이 절대적이며 자신감이 넘쳐난다. 책 전체 각 문단 시작에 ""~ 이야기할 것이다""나 문단 말미에도 "" ~이야기할 것이다"" 를 보면 이런 자신감이 느껴진다. 힘도 느껴지고. 첫장을 펼치고 끝장 덮으면서 첫 평가는"" 도킨스옹은 정말 글을 잘 쓰네"" 다. 관련 분야를 전혀 몰라도 읽는이가 전혀 어렵지 않게 쉬운 비유까지 들어가며 친절하게 이기적 유전자론으로 끌어 들인다. 저자의 이론대로 자기 복제자의 생존기계에 지나지 않는 나로서는 한단락 한단락 넘길때 마다 ""햐~"" 하고 힘빠지는 한숨이 나왔다. 그럼 우린 그냥 사는 거네. 시키는대로. 그러다가 보조주석 제일 뒤 "" 이 지구에서는 우리 인간만이 유일하게 이기적인 자기 복제자의 폭정에 반역할 수 있다"" 는 문구. 힘 빠지는 책에서 힘 솟는 책으로 변했다. 나는 이 책에서 저 문구를 보지 않았으면 이 책을 누구에게도 권유하지 못했으리라. 코로나다 위성정당이다 보고 있으면 복잡하고 머리만 아플 세상. 나의 이기적 유전자는 생존을 위해 무념무상의 바보로 나를 이끌테지만 나의 책읽기 도전은 "" 반역 "" 을 위해 계속 하련다. 앞표지 현재의 도킨스옹 흑박사진과 뒤에 젊은 시절의 도킨스옹 흑백 사진을 번갈아 보며 "" 글 잘 쓰고 똑똑한 사람이 늙기도 중우하게 잘 늙었네. 당신 정말 이기적인 유전자군 """
65067259,이기적 유전자 The Selfish Gene,10,https://sarak.yes24.com/review/12162861,"이기적 유전자 The Selfish Gene

과학을 넘어선 우리 시대의 고전, 이기적 유전자 40주년 기념판 리처드 도킨스의 새로운 에필로그 수록 새로운 디자인으로 다시 태어난 세계적 베스트셀러 현대 생물학의 새로운 지평을 연 세계적인 석학 리처드 도킨스의 대표작 이기적 유전자의

40주년 기념판이 출간되었다.

진화론의 새로운 패러다임을 제시한 이 책은 다윈의 적자생존과 자연선택이라는 개념을

유전자 단위로 끌어내려 진화를 설명한다.

2013년 영국의 정치평론지 프로스펙트지가 독자들의 투표로 선정하는

세계 최고의 지성 1위에 오른 바 있는 도킨스는 일찍이 촉망받는 젊은 과학자로

간결한 문체와 생생한 비유, 논리적인 전개를 갖춘 글로 능력을 인정받아 왔다."
65067259,성공하고 싶지만 결혼도 하고 싶어,10,https://sarak.yes24.com/review/12147195,"성공하고 싶다. 내 분야에서 의미 있는 사람이 되고 싶다는 생각을 한다. 하지만 한편으로는 언제 결혼해야 하나라고 생각하고 있다. 달려야 할 때인가 결혼이 너무 늦어지지 않을까 마음 한편이 불안하고 찝찝한 마음. 학부를 졸업하고 30대가 되고 난 이후의 나의 가장 큰 고민이다.

선택을 하지 못하고 계속 고민하는 것은 나의 '욕심' 때문이라고 생각해왔다. 뭐든 잘하고 싶은 마음. 하지만 사실상 이러한 고민은 욕심이 나 환경 등의 문제가 아니다.

문제는 유전자이다.

[이기적 유전자]의 리처드 도킨스에 따르면 모든 생명은 유전자가 살아남기 위한 생존 기계이다. 우리는 유전자가 생존할 수 있는 방향으로 프로그램 되어있고, 우리가 행하는 모든 행동은 이에 따라 할 수밖에 없다고 한다.

자기 복제자는 기나긴 길을 지나 여기까지 왔다. 이제 그들은 유전자라는 이름으로 계속 나아갈 것이며, 우리는 그들의 생존 기계다.

이기적 유전자, p75

얼마나 명확한 설명인가. 내가 결혼하고 싶은 이유, 아니 결혼을 언제 해야 할지 고민하는 이유는 바로 아이를 제때 낳을 수 있을까이다. 나이가 많은 산모에게서 유전질환에 걸린 아이가 태어날 확률이 높다는 것은 조금만 관심을 가져도 누구나 알 수 있는 사실이다. 나는 내 유전자를 온전히 보존할 수 있을까. 이런 걱정이 되다 보니 상황이 여의치 않다고 생각하더라도 미련을 버릴 수 없다.

그렇다면 왜 꿈은 포기하지 못할까? 이 역시도 유전자와 관련이 있다. 나의 꿈에 대해서 잘 생각해보면 궁극적으로는 나의 유전자가 잘 보존될 수 있는 세상을 만드는 것이다. 꿈을 위한 노력도 아이를 낳고 싶다는 마음도 결국 모두 나의 유전자를 세상에 보존하기 위한 방법이니 둘 다 포기하지 못하고 고민하고 있다.

이해는 하지만 부정하고 싶다.

유전자, 그리고 생존 기계라는 개념을 넣으면 많은 것들이 설명된다. 많은 자연 현상과 사회 현상도 얼추 들어맞는 듯해 보인다. 내가 지속해온 고민에도 그 원인을 설명하는데 부족함이 없었다. 하지만, 그래도 뭔가 부정하고 싶은 마음은 한편에 남아있다. 남보다 못한 가족이 있는가 하면 가족보다 더 진한 남도 있다. 대부분 모성애가 더 강하다고 하지만, 매정한 어머니도 분명 존재하고 자식을 향한 아빠의 애정도 만만치 않다.

인간은 뭔가 달라, 인간은 좀 더 특별해. 그래서 생존 기계 그 이상의 것이 될 수 있어.라고 말하고 싶지도 않다. 대화도 할 수 없는데 동물은 어떠한 상황인지 어떻게 알 수 있는가. 알 수 없을 뿐이지 동물도 인간이 알지 못하는 생존 기계의 역할 그 이상의 것을 하고 있을 수 있다.

그리고 지금 나를 구성하고 있는 유전자가 나의 모든 것을 결정한다는 사실도 마음에 들지 않는다. 나는 지금 보다 더 나아가고 싶고 성장하고 싶다. 마음에 들지 않은 유전자가 자신을 보존하려고 애쓰더라도 나는 그 유전자의 발현을 막고 좋은 유전자가 더 발현할 수 있는 환경을 만들고 싶다. 이런 생각을 하는 것 자체도 유전자의 생존전략일까?

이해가 되기도 하고 더 혼란해지기도 한다."
65067259,이기적 유전자,10,https://sarak.yes24.com/review/11056764,"최근들어 내가 좋아라하는 소설책을 뒤로 하고 인문,자연 서적에 눈을 돌리게 되었다. 이번에도 그 유명한 리처드 도킨스의 '이기적 유전자'를 접하게 되었다. 이 책은 40주년 기념판으로 재 출간되었고 예스24 홈페이지 메인에 소개되어서 알게되었다. 광고의 힘은 역시 대단한 것 같다. 이 책이 홈페이지 메인에 소개되지 않았다면 과연 내가 알게 되었을까? 이 책 역시 책 두께가 어마어마 했고 내용은 압축과 동시에 간결했다. 진화론의 새로운 패러다임을 제시한 이 책은 다윈의 ‘적자생존과 자연선택’이라는 개념을 유전자 단위로 끌어내려 진화를 설명한다. 저자는 자신의 동물행동학 연구를 진화의 역사에서 유전자가 차지하는 중심적 역할에 대한 좀 더 넓은 이론적 맥락과 연결시키기 시작했다. 목차는 총 13장이나 되었고 유전의 힘에 대해 다시한번 경의를 표하게 되었다."
65067259,감상중이다,8,https://sarak.yes24.com/review/10914681,"유전자를 알지 못했다면? 발견하지 못했다면? 리처드 도킨스를 만나는 즐거움이 있었을까? 라는 생각이 떠나질 않는다. 미토콘드리아에서 왕의 이야기까지 . . . . 그 어느것도 소중한것이 없으리. 물론 내 기준에서 본다면 완벽할순 없다. 유전자가 꼭 한종의 생물체처럼 느껴지기도 했으니까. 단, 내게 변화가 있다면 조금 더 서로의 종에게 피해가 가지 않게 행동해야겠다는 마음가짐이 생겼다. 간접이든 직접이든 내게도 영향이 미칠테니까. . ."
65067259,모든 것이 유전자 때문이라는 주장은 입증될 수 있을까,6,https://sarak.yes24.com/review/14035906,"도킨스가 쓴 책으로는 두 번째 읽는 책인데, 그래도 자신의 전공을 중심으로 쓴 이 책이 그나마 읽을 만했다. (처음부터 끝까지 자신과 다른 신념체계를 가진 사람에 대한 혐오와 조롱으로만 가득 찼던 다른 책을 보고는, 적어도 이 사람의 인격에 대해서는 큰 기대를 하지 말아야겠다고 생각했었다.) 적어도 이 책은 최소한 논리성을 띠려고 애쓰는 것 같긴 하다.

저자가 이 책에서 말하려고 하는 핵심은, ‘사람을 비롯한 모든 동물이 유전자가 만들어 낸 기계’(40)이며, 이 책의 제목에도 드러나듯, 그 유전자는 생존 기계와 신경계를 조립하는 방식을 지시함으로써(123) 자신의 유전정보를 최대한으로 남기기 위한 방식으로 기능한다는 것이다. 흔히 ‘종의 보존, 번성’과 같은 이유를 대며 동물의 행동을 설명하려는 다른 다윈주의자들과의 가장 큰 차이는, 저자는 그 행동의 핵심은 ‘종’과 같은 단위가 아니라 ‘유전자’로 좀 더 좁혀져야 한다고 주장한다는 점이다.

사실 이 부분만 이해한다면, 책의 나머지 부분은 같은 주장의 반복임을 알 수 있다. “중요한 것은 오직 ‘유전자’일 뿐이다. 동물의 행동을 설명하는 다른 이론들은 다 틀렸다. 모든 것은 유전자의 자기복제, 혹은 자기와 가까운 유전자(심지어 그게 50%정도의 유사성이라도)를 더 많이 남기기 위한 행동일 뿐이다.”

책을 읽으면서 가장 많이 들었던 생각은, 저자의 주장이 귀납적이라기보다는 연역적으로 보인다는 점이었다. 저자는 동물의 행동에 관한 ‘만물 유전자 기원설’을 주장하는데, 저자 자신도 인정하듯이 여기에는 심지어 다윈주의자들 안에서도 다양한 이설이 있다. 이 책에서 저자가 했던 작업은 다른 설명들에 대한 ‘반박’이 아니라, 자신의 주장에 대한 ‘반복’일 뿐이다. 반박으로 볼 수 있는 몇 부분은, 일부 동물들의 행동에서 이설로 설명되지 않는 예외적 패턴이 발견된다는 점 정도인데, 과연 그 정도로 충분한 걸까?(물론 이 책이 대중교양서로 나왔다는 점은 감안해야 한다)

저자의 주장은, 정확히 말하면, “동물들의 행동을 ‘이기적 유전자 기원설’로 설명할 수 있다”는 것이다. 그러나 우리는 유전자들이 정확히 어떤 기제로 특정한 행동하는 개체를 선택하고 만들어 내는지 그 과정을 정확히 관찰할 수도, 실험할 수도 없다(여기엔 인간의 수명을 훨씬 뛰어넘는 엄청난 시간이 걸린다고 가정된다). 저자의 주장을 뒷받침 하는 건 그의 가정들에 근거한 설명이지, 과학적 증거가 아니다. 저자의 주장은 ‘그럼직 할’ 뿐이다.

저자가 자신의 주장을 설명하기 위해 만들어 낸 다양한 게임 이론은 말 그대로 인위적인 것에 불과하다. 특히 각 게임에 임하는 개체들의 선택과 그 결과로 부여된 점수들이 그렇다. 예컨대 승자는 50점, 패자는 0점, 중상자는 -100점과 같은 점수체계는(140) 자연에서 볼 수 없는 가정일 뿐이다. 이런 건 말하기에는 좋지만, 정말로 사정이 그런지는 알 수 없는 법이다.

저자는 반복해서 자신이 비유적인 표현을 사용하고 있을 뿐이며, 실제로 유전자가 어떤 의식을 가지고 특정한 방향으로 유도하는 것은 아니라고 말한다. 모든 것은 충분히 어떤 일이 일어날 수 있는 ‘유전자 연못(수프)’과 ‘평균’이라는 수학적 모델이 만들어 낸다. 이 부분에서는 저자의 의견에 정확히 동의한다. 유전자는 의식을 갖고 있지 않으며, 우리를 특정한 행동으로 몰아간다는 말이 아니다.

문제는 그 다음 부분이다. 저자는 분명 자신이 ‘진화에 근거하여 도덕성을 옹호하려는 것이 아니다’(41)라고 말한다. 보주에서 저자는 유전자가 결정하는 것은 아니라고까지 덧붙인다(429). 하지만 책을 읽어본 사람이라면 다들 느꼈겠지만, 저자는 유전자가 마치 인간의 어떤 행동을 결정하는 것처럼(그리고 그것이 자연스러운 것처럼) 말하는 데다가, 인간이 어떠해야 하는지에 대해 제시하려고 한다.(가끔 이 과정은 조롱과 빈정거림으로 이루어진다.)

예컨대 ‘합리적 출산’라는 부분(209)에서 저자는 (절반 정도 유사한) 유전자를 더 많이 남기는 쪽으로 진화하는 원리에 따르면, ‘복지국가는 극히 부자연적인’ 것이라고 하면서, 아이들이 굶어 죽어가는 시대로 돌아가자는 것은 아니라면서도, ‘아이에 대한 생활보장의 특권’을 남용해서는 안 된다고 결론짓는다. 이게 유전자 단위의 특성을 가지고 윤리에 대해 한 수 조언을 하려는 게 아니라면 무엇인가.(하긴 저자는 앞서 언급한 ‘다른 책’에서 유산을 가리켜 자연의 “품질관리”라고 설명하기도 했다.)

걱정했던 것보다 내용이 어렵지는 않았다(일단 쉽게 읽을 수 있도록 글을 잘 쓰긴 했다). 그리고 책에서 설명하려는 주장 자체도 그리 난해하지 않다. 문제작이고, 관련된 이야기들이 종종 사용되니 교양삼아 한 번 읽어 볼만하다."
65067259,이기적 유전자,10,https://sarak.yes24.com/review/18074991,"리처드 도킨슨의 이기적 유전자 The Selfish Gene의 리뷰입니다. 인간은 이기적 유전자의 복제 욕구를 수행하는 생존 기계다라는 문구에 흥미가 생겨 읽기시작한 이기적인 유전자 유전자에 미리 프로그램된 대로 먹고 살고 사랑하면서 자신의 유전자를 후대에 전달하는 임무를 수행하는 존재라 주장이 흥미롭다 도킨스는 인간을 포함한 생명체는 DNA 또는 유전자에 의해 창조된 기계에 불과하며, 그 기계의 목적은 자신을 창조한 주인인 유전자를 보존하는 것이라고 보고 있다. 자기와 비슷한 유전자를 조금이라도 많이 지닌 생명체를 도와 유전자를 후세에 남기려는 행동은 바로 이기적 유전자에서 비롯된 것이다. 마찬가지로 인간을 포함한 생명체가 다른 생명체를 돕는 이타적 행동도 자신과 공통된 유전자를 남기기 위한 행동일 뿐이며, 유전자는 유전자 자체를 유지하려는 목적 때문에 원래 이기적일 수밖에 없고 그러한 이기적 유전자의 자기 복제를 통해 생물의 몸을 빌려 현재에 이르게 되었다는 이야기 흥미로워 두꺼운 책임에도 놓을 수 없는 매력이 있었습니다."
