goods_no,review_title,rating_score,origin_url,review_text
176913274,부처님말씀대로살아보니,10,https://sarak.yes24.com/review/22001091,"2월 12일 목요일 저녁 잠들기 전에 책을 집어들고 손에 잡히는 페이지를 읽었다. 펼친 페이지는 p.149 였고 내용은 배풂은 크기가 아니라 마음이다. 아무리 가난한 자라도 물질적 배풂을 충분히 실천 할 수 있다. 라는 부분을 읽고 잤다. 2월 13일 금요일도 평소와 다름없이 출근 준비를하고 서둘러 집을 나섰다.

출근길 동선에는 작은 절을 지나가게 된다. 절의 문은 항상 열려 있어 마당 가운데 계신 부처님 불상과 주5일은 매일 만난다. 부처님 불상을 보며 마음속으로 가벼운 다짐을 하거나 기분이 좋을 때면 안녕하고 손을 흔들어 인사한다. 오늘도 손을 흔들어 “부처님, 안녕”하고 인사를 했다. 종교를 가지고 있지 않는 나는 정말 힘든 일이 있을 때는 부처님, 하느님을 찾는다. 그 순간에도 제 소원을 들어 주신다면 “당신을 믿겠어요”라고 말하지는 않는다. 그건 거짓말이기 때문이다. 나에게 있어 종교는 아직 어렵다.

가벼운 인사를 마치고 이런 생각 저런 생각을하며 출근길을 재촉하고 있었다. 때마침 폐지를 수집하는 할머님께서 박스를 정리하고 계셨다. 길가에 떨어진 박스를 주워서 들고 할머니께 가져다드리니 “그냥 가도 되는데 고맙소”라고 하셨다. 그 말씀이 다른 날보다 마음에 와닿아 주머니에 있던 사탕 봉지를 꺼내 “사탕 하나 드릴까요?”하며 사탕 봉지를 벗겨 드렸다. 할머니께서는 “그냥 줘도 되는데”하시며 넙죽 받아 물으시며 “참 고맙소. 잘 먹을게.”하며 일면도 없는 할머니와 그렇게 마음을 나누었다. 기분이 좋았다. 그렇게 좋은 기분으로 길을 가는데 단골 세탁소 아저씨가 가게 문을 열고 “지금 출근 하는 거야?”라고 반가이 인사를 나눠주신다. 나는 “네, 안녕하셨어요” 하며 안부 인사를하며 가던 길을 가던 중 나는 무슨 마음에서인지 주머니 속을 뒤졌다. 내 체온으로 미지근하게 데워진 사탕을 꺼내어 “사탕 드세요”하며 드렸다. 아저씨는 “내가줘야 하는데”하시며 내 두 손을 꼭 잡고 “왜 이렇게 손이 차나, 장갑끼고 다녀”하시며 말씀을 해주셨다. 아저씨의 손도 따뜻했고 그 말씀에도 마음이 너무 좋았다.

‘배풂은 크기가 아니라 마음이다’라는 문장이 내게 와 닿는 순간이었다. 사탕 한 알로 전해지는 ‘베풂’을 실천 할 수 있었다.

이 책의 목차 구성은 아래와 같다.

머리말 – 인생에는 더 깊은 의미가 있다.

(p.13) 부처님의 가르침은 맹목적인 믿음을 강요하지 않기에 더 특별하다. 그의 가르침은 절대자나 천상의 존재가 밝힌 깨달음이나 계명이 아니다.

1부 정견 – 바른 견해 보는 법부터 바꾼다 :왜 우리는 행복을 오해 하는가

2부 戒계 – 삶을 먼저 정렬한다 : 스스로 두 발로 서는 방법

3부 보시 – 집착을 느슨하게 :‘쥐는 힘’을 약하게 만드는 훈련

4부 정 – 마음을 관찰하는 힘 기르기 : 내마음이 가는 길

5부 혜 – 일상에서 드러나는 지혜 : 단순하게 살기

6부 자비 – 함께 아파하는 마음 : 평안에 이르는 마지막 걸음, 그리고 스스로 두 발로 서는 법

인생이 가벼워지는 15가지 불교 수업의 가르침과 부처님 말씀에 한발 다가 설 수 있었다. #부처님말씀대로살아보니 , 저자 토니 페르난도는 뉴질랜드, 호주에서 존경받는 대중적인 정신건강 전문의로, 부처님을 ‘마음을 해부한 최초의 심리학자’로 보며 스승으로 삼아 부처의 방식대로 삶을 살고 있는 사람이라고 한다. 나는 부처님 말씀대로 살아 보기는 어려울 것 같지만 노력하는 사람까지는 할 수 있을 것 같다. 버리는 연습(방하착), 미워하지 않는 연습(자애), 조건 없이 웃는 연습(보시),불필요한 말을 멈추는 연습(정어)이 네 가지는 운을 ‘좋게 만들라’는 주문이 아니라, 고통을 키우지 않는 아주 현실적인 마음 훈련 시작임을 알고 내가 살아가는 동안에 기준으로 삼고 삶도 꽤 괜찮을 것 같다.

@gbb_mom @wilma.pub 잘 읽었습니다."
176913274,부처님 말씀대로 살아보니,10,https://sarak.yes24.com/review/21999725,"❤️ 정신과 의사의 실제 진료 경험과 🧡 네번의 단기 출가 수행이 더해져 💛 욕망, 생각, 감정, 관계로 인한 고통이 💚 어떻게 분노, 불안, 집착, 중독으로 얽히는지 🩵 어떻게 평화와 행복에 이를 수 있는지 설명 💙 관대한 태도, 마음챙김, 정직, 소박, 진실됨 💜 그리고 친절과 연민 종교 교리가 아닌 마음의 작용 원리를 설명하고 그 마음을 연습하는 방법을 알려주는 책 고통은 습관이며 습관은 바꿀 수는 것 인간은 안락함과 행복을 추구하는 존재 고통 또한 모든 인간이 경험하는 것 * 정신과 의사로 자신의 수행 경험과 상담한 환자들의 임상이 적절하게 잘 배치되어 있어 이해하는데 도움이 많이 되고 지루하지 않아요 관계로 인한 고통을 설명할 때 불가근 불가원(不可近 不可遠) ""너무 가까우면 집착, 너무 멀면 상처"" 이 표현이 참 좋았어요. 친절은 타인을 선의로 대하는 태도 연민은 고통에 반응하는 마음 명확하게 구분이 되기도 했구요. * 출판사로부터 도서를 제공 받아 읽고 쓴 리뷰입니다"
176913274,부처님 말씀 대로 살아보니,10,https://sarak.yes24.com/review/21999681,"인간은 항상 불안하고 불만족하는 존재다. 우리 삶이 어떤 모습이든 이면에는 불안과 불만족이 따라다닌다는 뜻이다.

부처님은 이것을 ‘두카’라고 불렀다.

현대어로 표현하자면 ‘스트레스’

‘움켜쥐다’라는 단어가 집착을 잘 표현한다고 생각한다.

기대와 소유와 쾌락 그리고 자신을 풍요롭고 행복하게 할 만한 것에 집착한다.

더 세세하게 말하자면 생각과 개념, 익숙한 습관과 방식에 집착한다.

그리고 ‘이것이 나다. 이것이 내 것이다.‘ 라는 개념에 집착한다.

육체적 쾌락

물질적인 소유도 포함된다.

사람들은 더 많이 소유하면 더 행복할 거라고 착각한다.

광고업자들은 이 사실을 잘 알기에 더 소유 하고자 하는 우리의 약점을 이용한다.

신념이나 반복되는 습관,또는 생활방식

자신만의 생각과 루틴을 가진게 잘못된 것은 아니다.

인간이란 존재는 자신만의 견해와 행동방식을 가진다.

우리는 습관의 창조물이기 때문, 하지만 자신만의 생각에 너무 집착하면 다른 사람의 의견을 듣지 못한다.

이것이 문제가 된다.

’이것이 나다. 이것이 내 것이다.‘라는 고정관념

우리는 흔히 세상이 자기 중심으로 돌아간다고 생각한다. ’사람들이 내 말에 집중해야해, ’

‘나는 인정받아야 해‘ ’나는 존중받아야 해‘ ’나는 행복해야 해‘

자신을 특별하게 생각할지라도 누군가가 당신이 원하는 만큼 관심을 주거나 존중해주지 않는 것은 어쩌면 당연한 일이다.

자녀가 당신을 무시할 수 있다.

직장동료가 당신의 제안을 유치하다고 말할 수 있다.

배우자가 당신을 얼간이라고 말할 수 있다.

부처님은 이런 말을 남겼다.

모두에게 사랑받아도 인간은 불행할 수 있다.

스스로를 잃으면 방황이 길어 진다.

생각은 대부분 실체가 없다.

순간 피어올랐다가 사라지는 거품에 가깝다.

우리는 그 어느 것도 진정으로 소유하지 못한다.

모든 것은 찰나이며 무상하기 때문이다.

머릿속 모든 생각과 말을 진실이라고 믿지 말자.

그것만으로 우리는 편안해질 수 있다.

사람은 하나같이 정신적으로 온전치 못한 존재다.

이 사실을 받아들이면 타인에게 더 너그러울 필요가 있다는 결론에 이를 것이다.

불교신자들이 공통으로 따르려고 노력하는 5계

1.불망어 거짓말을 하지 않고 남에게 상처주는 말을 삼간다.

2.불살생 살아 있는 생명을 함부로 죽이거나 해지지 않는다.

3.불투도 남의 것을 훔치거나 부당하게 취하지 않는다.

아잔 수지토는 계율에 따라야 하는 이유를 명확하게 설명한다.

“저는 당하고 싶지 않은 일은 타인에게 하지 않습니다...이런 태도가 결국 평화로 이어집니다.”

진정한 베품은 남을 이롭게 하고자 하는 마음에서 비롯된다.

쓸모 없는 것을 주는 것은 그냥 주는 것이지. 진정한 나눔이 아니다. 자신에게 해를 입히는 베풂도 진정한 베풂이 아니다.

아무것도 남지 않더라도, 가장 좋은 것을 기쁜 마음으로 선뜻 내주는 것이 부처님의 가르침이다.

이 책에서 가장 마음에 와닿은 구절이 있다.

원래 인간은 아무것도 소유하지 않는다.

우리는 이 세상의 것을 잠시 맡아 관리하는 관리자일 뿐이다.

이 깨달음이 깊이 뿌리내리면, 얻고 소유하고 주는 행위 자체가 무의미해진다.

흘러가는 대로 내버려두는, 있는 그대로의 흐름에 머무르는 태도만 남게 된다.

이것이 공의 지혜이다.

당신의 평온은 스스로 내어주지 않는 한 누구도 빼앗을 수 없다.

#부처님말씀대로살아보니

#윌마출판사

#인문교양서

#요조앤서평단

#토니페르난도

#불교수업

이 도서는 요조앤이 모집한 서평단 선정으로 윌마 출판사로부터 해당 도서를 지원받아 주관적으로 작성한 서평입니다."
176913274,그럴 수도 있고 아닐 수도 있다,10,https://sarak.yes24.com/review/21998458,"📚 《부처님 말씀대로 살아보니》 서평 * 단단한 맘의 서평단 모집을 통해 도서를 협찬받아 작성하였습니다. 의학과 불교를 접목하여 연구해온 토니 페르난도가 쓴 책입니다. 제목에서 볼 수 있듯이 부처님의 말씀을 바탕으로, 인생을 살아가는 데 도움이 되는 부처님의 지혜를 알기 쉽게 풀어 쓰고 있어요. 불교 용어나 스님들의 얘기도 나오지만, 우리의 마음챙김과 평온을 위한 글이어서 종교에 상관없이 거리낌 없이 읽었습니다. 내 과거의 경험과 현재 나의 상황, 그리고 미래를 모두 고려하며, 책에서 전하는 부처님의 말씀을 적용해 볼 수 있었어요. 그 중에서 '마이 네 Mai Nae (무상)' 의 지혜에 관한 내용이 기억에 남습니다. 일이 내 뜻대로 되지 않고 오히려 생각과 완전히 다르게 흘러가기도 하는데, 과거에는 그럴 때마다 좌절하거나 크게 실망한 적도 많았습니다. 하지만 그런 경험들을 통해 성장하며 요즘에는 불확실성을 초연하게 받아들여야겠다고 생각했었습니다. 이 책을 읽으며 다시 한 번 '그래야 한다'의 집착을 버리고, '그럴 수도 아닐 수도 있다'는 Mai Nae를 새기려 합니다. * 하이라이트 문장 🏷평화와 행복에 이르는 마음의 연습법이 있다. 바로 관대한 태도와 마음챙김, 정직하고 소박 하며 진실하게 사는 것, 친절과 연민으로 행동 하는 것이다. 집착은 스트레스와 고통, 불만족을 낳는다. 따라서 우리는 느슨하게 쥐는 법을 배워야 한다. 그래야 마음의 평화와 만족, 행복을 누릴 수 있다. 이제부터 우리의 질문은 이것이다. “어떻게 놓을 것인가?"" 🏷인생에는 기억에 남겨야 할 장면이 있는가 하면, 빨리 잊어버려야 하는 장면도 있다. 즉, 신경 쓰는 것이 나은 경우가 있고, 신경 쓰지 않는 것이 나은 경우가 있다. 🏷물질과 생각, 사람에 집착하기보다는 그것들을 가볍게 쥐는 법을 배우자. 더 나아가 완전히 놓는 법을 배워보자. 우리는 그 어느 것도 진정으로 소유하지 못한다. 모든 것은 찰나이며 무상하기 때문이다. 🏷 '마이 네 Mai nae (무상)'의 지혜 마이 네는 그럴 수도 있고, 아닐 수도 있다는 뜻이다. 모든 것은 본질적으로 불확실하다. 정말로, 모든 것이 그렇다. (중략) 모든 변수를 통제할 수 없기에, 어떤 일이든 일어날 수 있음을 인정해야 한다. 결과를 완전히 확신할 수 있는 사람은 없다. 그럴 수도 있고, 그렇지 않을 수도 있다. 결국, 모든 가능성은 열려 있다. 따라서 결과나 미래에 집착하는 대신 열린 태도를 가지는 것이 훨씬 건강하고 현실적인 접근법이다. #부처님말씀대로살아보니 #토니페르난도 #월마 #단단한맘서평단"
176913274,수행의 목표는 고통의 소멸이다,10,https://sarak.yes24.com/review/21994963,"『부처님 말씀대로 살아보니』는 삶의 고통과 스트레스를 줄이기 위한 부처님의 가르침을 실생활에 바로 실천할 수 있도록 실례를 들어 쉽게 설명한 마음챙김 가이드북이다. 마음챙김은 영문의 Mindfulness가 하나의 단어인 것처럼, 이를 번역한 '마음챙김'도 하나의 합성어로 간주하고 띄어 쓰지 않는다.

정신의학자인 저자 토니 페르난도 는 부처님을 역사상 가장 뛰어난 심리학자이자 스승이라고 생각한다. 그는 프로이트 나 융 같은 서구 심리학자의 접근법보다, 가설을 세우고 직접 검증하며 해결책을 찾아가는 부처님의 접근 방식에 깊이 공감했고, 더 많은 사람과 그 가르침을 나누고 싶어 이 책을 쓰게 되었다.

부처님은 집착하지 않고 가볍게 사는 법을 가르친다. 부처님의 가르침이라는 충격 흡수 장치를 통하면 인생을 순탄하게 살 수 있다. 부처님의 가르침은 믿음을 강요하지 않는다. 유용한지 직접 실천해 보고, 맞지 않으면 기꺼이 버리라고 한다. 자신의 가르침을 과감히 버려도 된다고 말하는 스승이 세상에 얼마나 있을까?

부처 (Buddha) 님을 깨어있는 자 (佛陀) 라고 부르는 것은 우리가 대부분 집착과 생각 과잉이라는 잠든 상태를 말하는 마음 놓침 (mind-wandering) 속에서 산다는 것을 전제로 한다. 특히 스마트폰은 마음 놓침과 강하게 연결되어 있다. 어떤 승려는 스마트폰을 마음챙김을 파괴하는 기계라고 했다.

이 마음 놓침 의 잠에서 깨어나는 연습을 반복하는 것이 명상이다. 우리는 과거의 후회나 미래의 걱정으로, 생각이 꼬리를 물고 이어져 지금 이 순간 실제로 일어나는 일을 알아차리지 못한다. 스마트폰에 중독된 사실 자체도 모를 것이다.

마음챙김 (깨어있음) 은 이 자동 흐름을 알아차리는 것이다. 생각에 끌려가는 것을 멈추는 게 아니라, ""아, 내가 지금 끌려가고 있구나""를 아는 순간 이미 깨어난 상태가 된다. 이런 일상 속 알아차림으로 고통과 스트레스에서 자유로워질 수 있다.

부처님은 고통을 겪는 근본 원인을 집착 으로 보았다. 모든 것이 영원하지 않고 끊임없이 변하는데 거기에 집착하는 일은 무의미하다. 우리 몸 역시 늙고 병들다 흙으로 돌아가는데 젊음을 붙잡으려는 집착은 부질없는 짓이다. 인간관계도 마찬가지다. 모든 관계는 결국 이별이나 죽음으로 끝난다.

우리는 꺼지지 않는 욕망의 생산 공장이다. 욕망이 충족돼도 만족은 순간일 뿐, 완전히 만족하지 못한다. 항상 더 많은 것을 원하기 때문에 늘 문제가 생긴다. 이때 부처님은 쾌락에 집착해 더 많은 고통을 겪거나, 마음을 훈련하여 평화로운 상태에 이르거나 둘 중 하나를 선택하라고 한다. 이 책은 두 번째 길을 안내한다.

그 핵심이 마음챙김 (Mindfulness) 이다. 마음챙김은 부처님이 제시한 팔정도 중 하나다. 팔정도란 부처님이 고통을 줄이고 행복을 성취하기 위해 마련한 지침인데, 마음챙김을 제외한 다른 일곱 길은 바르게 보기, 바른 생각, 바른말, 바른 행동, 바른 생활, 바른 노력, 바른 의식이다.

마음챙김 이란 말은 다른 책에서도 많이 들어봤는데, 이 책을 통해 그 방법을 제대로 배울 수 있었다. 한마디로 몸의 근육을 키우려면 운동을, 마음의 근육을 키우려면 마음챙김을 한다고 생각하면 된다. 마음챙김은 이해하기도 쉽고 실천도 간단하다. 걷고, 먹고, 설거지하고, 빨래를 널면서도 할 수 있다.

p.173 마음챙김이란 마음과 몸이 순간순간 무엇을 경험하는지 알아차리고 주의를 기울이고 깨닫고 온화하게 받아들이는 마음의 상태를 말한다. 이는 궁극적으로 친절과 연민으로 이어진다.

저자가 마음챙김 을 처음 알게 된 건 빌리라는 환자 덕분이었다. 5살에 사고를 당해 다리를 절었던 빌리는 온갖 의학적·심리학적 치료에도 자기혐오와 자해를 멈추지 않았는데, 마음챙김 치료를 시작하고 나서 호전되었다. 이후 빌리와 비슷한 증상을 보이는 환자들에게 마음챙김을 추천했고, 그들도 크게 도움을 받는다.

마음챙김 은 단순한 스트레스 해소나 긴장 완화가 아니다. 마음속의 모든 생각이 떠올랐다가 사라지는 과정을 지켜보는 훈련이다. 생각과 감정이 어떻게 일어나는지를 지켜보며 그 흐름에 휩쓸리지 않는 것이다. 그래서 마음챙김은 이성과 감정이 만들어내는 고통에서 조금씩 자유로워지는 길이 된다. 저자는 별로 효과를 못 느끼면서도 몇 달 동안 매일 약 15분씩 꾸준히 마음 챙김 명상을 했다고 한다.

그 결과, 고속도로에서 어떤 차가 갑자기 끼어들어 죽을 뻔했는데도 분노 대신 상대 운전사의 안녕을 빌게 되었다. 옛날 같으면 분노를 주체하지 못하고 화를 냈을 텐데 마음챙김 명상이 뇌의 회로를 바꿔 놓은 것 같다는 것이다.

지금 화가 났어도 그것을 알아차리면 평온하게 받아들일 수 있다. 지금 당장 바꿀 수 있는 것은 아무것도 없기 때문이다. 이 사실을 받아들일 때 고통은 줄어들거나 아예 사라진다. 이때 평화가 찾아온다.

인간의 마음은 계속해서 생각하고 느끼도록 진화해 왔다. 그래서 생각을 멈추려 할수록 오히려 생각에 더 집착한다. 마음챙김 은 흘러가는 주의력을 지금 이 순간으로 되돌리는 훈련이다. 나도 평상시 책을 읽을 때 몹시 산만한 편인데, 마음챙김 을 연습하면서 집중력이 조금씩 나아지는 것을 느꼈다.

p.152 우리가 타인에게 줄 수 있는 가장 큰 선물은 그에게 오롯이 집중하며 귀 기울이는 것일지도 모릅니다.

이 책이 좋았던 가장 큰 이유는 저자 자신의 솔직한 이야기를 통해 나만 이런 게 아니라는 편안함을 주었다는 것이다. 막연한 마음챙김 이라는 말을 다양한 실제 사례로 보여줘서 금방 이해가 되고 와닿는 부분이 많다는 점도 참 좋았다.

마음챙김 은 마음과 몸 건강은 물론이고, 노화 방지까지 과학적으로도 효과 가 입증되었다고 한다. 그래서 스님들이 젊어보이나? 거창한 수행이 아니라, 지금 내가 있는 자리에서, 내가 하고 있는 일에서 내 마음 상태를 알아차리고 인정하는 것으로 시작할 수 있다.

이 책의 맨 뒤에는 다양한 마음챙김 명상법이 나온다. 그중에서 나와 가장 잘 맞는 것을 하나 골라 오늘부터 마음챙김을 실천해 보자. 가장 먼저 더 이상 핸드폰의 노예로 살지 않게 되는 자유를 만끽할 수 있을 것이다.

p.313 고통과 불안으로부터 벗어나기를, 진심으로 행복하기를, 지금 이대로 만족하기를, 평안이 깃들기를 진심으로 기원합니다."
176913274,부처님 말씀대로 살아보니,10,https://sarak.yes24.com/review/21993382,"부처님이 건네는 다정한 마음 처방전 📚⠀ ⠀ '부처는 인간의 마음을 해부한 인류 최초의 심리학자였다'⠀ ⠀ ⠀ 일어나지도 않은 일에 대한 불안,⠀ 현재의 삶에 대한 불만족에서 오는 스트레스, '두카'⠀ ⠀ 자신의 마음에 빠져서 ⠀ 헤어나지 못하는 생각 중독, '파판차'⠀ ⠀ 2600년 전 부처는⠀ 이를 병으로 여겨⠀ 그 마음의 작동 원리를 밝히고⠀ 마음을 다스릴 수 있는 ⠀ 구체적인 수련법을 제시했다고 해요. ⠀ ⠀ ⠀ ⠀ 부처를 인류에서⠀ 가장 명석한 심리학자로 바라본⠀ 정신과 의사 토니 페르난도는⠀ ⠀ 출가 수행을 통해 ⠀ 고통에서 벗어난 저자 자신의 경험과⠀ 20년 동안의 실제 진료 현장의 사례를 바탕으로⠀ ⠀ 부처님의 마음 수련법과 ⠀ 현대의 인지과학, 심리학이 ⠀ 어떻게 연결되는지 ⠀ ⠀ 오늘을 살아가는 우리가⠀ 알기 쉽게 ⠀ 실천하기 쉽도록 풀어내었습니다. ⠀ ⠀ ⠀ ⠀ ⠀ 《부처님 말씀대로 살아보니》 ⠀ ⠀ '인생이 가벼워지는 15가지 불교 수업'⠀ ⠀ 〰️〰️〰️〰️〰️⠀ 머리말. 인생에는 더 깊은 의미가 있다⠀ ⠀ 1부 正見 _ 바른 견해 : 보는 법부터 바꾼다⠀ 2부 戒 _ 계 : 삶을 먼저 정렬한다⠀ 3부 布施 _ 보시 : 집착을 느슨하게⠀ 4부 定 _ 정 : 마음을 관찰하는 힘 기르기⠀ 5부 慧 _ 혜 : 일상에서 드러나는 지혜⠀ 6부 慈悲 _ 자비 : 함께 아파하는 마음⠀ ⠀ 맺음말. 마음에는 돌아갈 곳이 있다⠀ 〰️〰️〰️〰️〰️⠀ ⠀ ⠀ ⠀ ⠀ 📖⠀ '생각은 단지 떠오르는 현상일 뿐,⠀ 반드시 믿거나 따를 필요는 없다.'⠀ ⠀ 📖⠀ '사람은 하나같이 정신적으로 온전치 못한 존재다.⠀ 이 사실을 받아들이면 ⠀ 타인에게 더 너그러울 필요가 있다는 결론에 이를 것이다.'⠀ ⠀ 📖⠀ '베풂은 어두운 방에 촛불 하나를 밝히는 행동이다.⠀ 1개의 촛불이 또 다른 촛불을 밝히고,⠀ 그렇게 방 전체가 환해진다.'⠀ ⠀ ⠀ ⠀ ⠀ '고통은 마음의 습관이며, 습관은 바꿀 수 있다'⠀ ⠀ 오늘 내 마음이 불안하고⠀ 화가 나며 고통스러운 것은⠀ 마음을 길들이는 방법을 모르기 때문입니다.⠀ ⠀ 원인을 알고 방법을 배우고⠀ 끊임없이 실천한다면⠀ ⠀ 한 달, 일 년 뒤에는⠀ 평온이 마음의 습관이 되리라 믿으며⠀ 책에 기대고 싶어졌어요. ⠀ ⠀ ⠀ ⠀ '일상에 마음챙김을 들여놓기'⠀ ⠀ 가부좌를 틀지 않는 ⠀ 다양한 명상법에 놀랐어요. ⠀ ⠀ 호흡부터 걷기 명상, ⠀ 설거지 명상에 이르기까지.⠀ ⠀ 일상에 마음챙김을 들여놓는다면⠀ ⠀ 매일매일 언제 어디서든지⠀ 지친 마음을 안아줄 수 있습니다. ⠀ ⠀ ⠀ ⠀ ⠀ '부처님의 가르침은 새로 얻는 것이 아니라⠀ 이미 갖고 있는 것을 알아차리는 일입니다.'⠀ ⠀ ✔️불안과 걱정으로 머리 속이 복잡한 분⠀ ✔️일과 관계에 지쳐 마음이 힘든 분⠀ ⠀ ⭐️ 현실적이고 구체적인 방법으로⠀ 내 마음 속 평온을 되찾고 싶은 ⠀ ⠀ 모든 분들께 권해드립니다.⠀ ⠀ ⠀ ⠀ ⠀ #부처님말씀대로살아보니 #토니페르난도 #부처님말씀 #심리학 #마음챙김 #명상수련 #신간추천 #윌마출판 #협찬"
