goods_no,review_title,rating_score,origin_url,review_text
109005292,(서평)짱깨주의의 탄생,8,https://sarak.yes24.com/review/17630965,"우리가 다른 민족, 인종, 혹은 국가 구성원을 일컫는 비칭이 하나씩은 갖고 있다. 예를 들어 일본인보고는 쪽발이, 미국인 보고는 양코배기, 흑인을 보면 깜씨등으로 부르곤 한다. 그럼 중국인을 보면 뭐라고 하나. 떼놈이 가장 먼저 떠오르고 그 다음은 짱깨가 아닐까 싶다. 세태가 변하면서 이들 비칭이 득세하는 때가 오는데 최근을 기준으로 하면 아무래도 이 짱깨의 활용이 가장 빈번할 듯 싶다.

대학교수인 저자는 어쩌다가 한국에서 중국의 처지가 이렇게 변하게 되었는지 사회학적 관점으로 풀어내고 있다. 짱깨라는 말은 掌櫃(장궤) 즉, 카운터(돈 통)을 지키는 사람이라는 의미로 흔히 중국집에 가면 주인쯤 되는 사람은 카운터에 앉아 주문을 받거나 돈 계산을 주로 하곤 한다. 원래는 좋은 뜻이었는데 이들이 한국에 들어오면서 아마 이들을 보는 시선이 포폄을 오고 갔던 모양이다. 노동력을 발휘하기 보다는 돈을 세는 모습에서 부러움을, 한 번 주머니로 들어간 돈은 절대 나오는 법이 없어서 야박하다는 의미에서 그렇게 불렀던 듯 싶다. 또 짱꼴라라고도 불리운다.

초창기 한국 프로야구에서 활약한 장호연이라는 선수가 이 별명으로 불렸다. 둥글둥글한 얼굴로 능글맞게 변화구로 승부하던 모습과 그의 성을 합쳐 만든 별명으로 보인다. 아무튼 한중 수교가 있고난 90년대 이후 몇 년 전까지만 해도 한국과 중국은 경제적 동반자 관계라며 서로 이득을 주고 받으며 선린관계를 유지했고 수많은 인적 교류가 있었다. 한국 경제의 태반이 중국에서 나온다는 얘기도 과장은 아니었다.

그러나 난데없이 사드를 배치하면서 틀어지기 시작한 시점부터 우리에게 중국은 자신의 이익을 우선으로 하면서 주변국들을 깔보는 덩치만 큰 욕심스러운 사회주의 국가로 인식되기 시작했다. 급기야는 대중국으로 가는 수많은 물자들이 줄어들고 코로나는 그 결정타가 되었다. 코로나의 시작이 중국 우한이라는 점을 집요하게 노리며 중국을 경원시 하고 그렇게 해서 이득을 보는 무리와 정치 세력들에게는 공격하기 아주 좋은 타겟이 되어 버렸다.

외교는 실리다. 그런데 우리가 이득을 보기 위해서는 내줘야 하는 것도 만만치 않은 눈치게임 의 끝판왕이다. 절대 먼저 우리의 패를 내보여서는 안된다. 앞에서는 큰 소리를 치더라도 수면 아래서는 계속 물장구를 치는 오리 같은 모습이 바로 외교다. 그런데 어느 순간부터 동결화되어 버렸다, 한 겨울 잘 얼지도 않는 한강이 오랫만에 얼어버린 것처럼 말이다.

책을 읽어보지도 않은 혹자들의 비난과는 달리 책에선 중국을 일방적으로 찬양하지 않는다. 심지어 아주 드라이 하게 한중관계를 언급하려고 한다. 몇 개의 예시를 들어 굳이 이렇게 해야 하나 하는 아쉬움이 끓어 넘치는 부분도 있기는 하지만 그건 오랫동안 중국을 공부해온 학자로서의 자존감 같은 것으로 이해했다.

나 역시도 중국어를 공부한 사람으로 경색 국면이 달갑지만은 않다. 하지만 뉴스를 통해서 보는 중국은 그 에전에 직접 접했던 그런 나라의 모습에서 너무 달라져 버리고 말았다. 우리나라에도 자국의 이익을 위해 극단으로 행동하는 무리가 있지만 중국의 그것은 좀 차원이 다르다. 중국에 대한 비칭을 넘는 멸칭이 분분하는 것도 국민 감정에 따라 있을 수 있기는 하다, 그러나 그렇게 해서 우리가 얻는 게 무엇일까?

주변국들의 영토 싸움과 분쟁에 의해 우리는 중국을 통한 경제적인 이득을 너무 많이 상실하고 있다. 역대급 무역수지 적자의 대부분은 대중국 경제 적자에서 나타나고 있다. 큰일이 아닐 수 없다. 언제까지 뺄셈 외교만 하고 있을 것인지, 장기적인 대안은 있는 지 답답하다."
109005292,"짱깨주의의 탄생, 김희교 글, 보리 출판 9. 끝.",10,https://sarak.yes24.com/review/16729104,"책의 내용을 정리해 보았습니다.

우리의 선택은?

샌프란시스코체제나 키신저 시스템이 더 이상 굴러갈 수 없을 때 한국은 어떤 선택을 할 가능성이 높을까. 그것은 어느 때보다도 한국인의 선택에 달려 있을 가능성이 높다. 한국은 한미일 삼각군사동맹을 체결하여 신냉전 시대로 후퇴할 수도 있고, 키신저 시스템을 포기하고 다시 미국의 ‘선물’만 바라보며 살 수도 있다. 반대로 다자주의 시대에 걸맞게 미국에게 신식민주의 요소를 줄이라고 요구할 수도 있고, 주도적으로 종전 선언을 하고 평화체제로 나아갈 길을 모색할 수도 있다. 한국의 힘은 샌프란시스코평화조약 체결 시기와 분명히 달라져 있다. 그때는 열강들의 이해관계에 따라 한국이 배제되었지만 이제는 우리도 우리의 운명을 결정할 힘이 생겼다. 미국이나 중국이 선택했다고 우리가 그때처럼 따라야 할 필요도 없다. 한국은 선택할 힘이 있고, 그 선택이 앞으로 동아시아에 생겨날 새로운 체제의 방향을 결정할 수 있을 만큼 중요하다.

1960대에 아프리카 가나의 은크루마가 미국 중심의 새로운 체제를 신식민주의라 규정하고 “신식민주의는 그것을 자행하는 선진국가들의 목에 걸린 맷돌이다. 만일 그것을 없애지 않는다면 그것이 그들을 압살할 것이다”고 확신했다. 그런 점에서 평화체제는 동아시아에서 미국도 연착륙이 가능한 나라가 될 수 있다는 합리적 대안이다. 종전협정이나 북미수교는 미국에게도 열려 있는 평화체제를 향한 첫걸음이 될 것이다. 바이든행정부가 역사를 다시 되돌리는 선택을 한다면 그것은 단순히 바이든행정부의 몰락이 아니라 미국의 급속한 몰락으로 이어질 가능성이 높다. 이미 세계는 샌프란시스코체제를 구축하던 시대가 아니기 때문이다.

새로운 시대가 오려면 구시대를 넘어서려는 대항세력의 성장이 반드시 필요하다. 신식민주의 성격을 지닌 샌프란시스코체제는 대항세력의 끊임없는 저항을 받아 왔다. 대항세력의 성장이 가장 강력한 곳은 한국이었다. 그러나 이 대항세력은 아직은 조직화된 세력으로 보기에는 미흡할 정도로 느슨한 형태의 진보연합 수준이다. 조직화하지 못했고, 평화체제를 지향하는 프레임과 어젠다를 정립하지 못한 상태이다. 그러나 촛불집회와 서초동 집회를 살펴보면 예전과 다른 새로운 주체들이 역사의 전면에 등장했다는 사실을 발견할 수 있다. 그러나 주체적인 근대 시민이 역사의 전면에 등장했다고 해서 그들이 승리의 노래를 부를 수 있는 것은 아니다. 역사는 헤게모니 싸움이기 때문이다. 프랑스 혁명은 오랜 기간 반동의 시기가 있었고, 중국 혁명은 승패를 가늠하기 힘든 오랜 내전이 동반되었다. 대항권력이 기존 권력 체계를 넘어설 때 새로운 진보는 이루어진다.

미국이 키신저 시스템을 공격하고 있는 이상 안보는 미국, 경제는 중국이라는 이중정책은 불가능하다. 일방적으로 미국 편에 서고 중국을 등지는 일은 시대착오적인 선택이며, 이 선택으로 전후체제의 위기를 넘어설 수는 없다. 그러나 다자주의 시대가 왔다고 해서 그런 시대가 곧 우리의 시대가 되는 것은 아니다. 우리가 짱깨주의를 넘어서서 더 나은 미래로 나아가기 위해서는 단순히 ‘그래, 짱깨주의가 문제가 있구나’라는 인지만으로는 불가능하다. 행동해야 한다. 짱깨주의가 무서운 것은 그들이 원하는 시대로 만들어 나갈 힘은 없지만, 새로운 시대로 만들어 나갈 세력들을 그들 기획에 포로로 만들 수 있다는 점이다(회사에서 부당한 업무지시를 하는 상사들에게 그 부당함을 따지지 못하는 것은 그들이 나의 성공을 보장하지는 못하지만, 나의 앞길을 막는 방해꾼이 될 수 있기 때문이었다. 이러한 질곡은 이제는 많이 없어졌다)

중국이 부상하고, 미국의 신식민주의체제가 흔들리고, 아시아의 역량이 성장했고, 미국과 중국 중 어느 쪽도 패권을 장악하지 못하는 지금이 우리에게 기회이다고 저자는 확신하는 듯하다."
109005292,"짱깨주의의 탄생, 김희교 글, 보리 출판 8.",10,https://sarak.yes24.com/review/16729068,"책의 내용을 정리해 보았습니다.

다자주의 시대를 열 기회가 왔다.

미국의 중국봉쇄 정책은 실패했다고 저자는 주장한다. 세계 자본은 트럼프행정부의 신냉전 전략이 중국을 봉쇄하거나 중국을 추락시킬 것이라고 믿지 않았다. 미국이 미중 무역전쟁을 통해 도달하려고 했던 핵심 목표는 달러 패권을 지키고 위안화를 추락시키는 것이었지만 별다른 성과를 못 얻었다고 판단한다.

중국의 경제성장과 더불어 커진 정치적 영향력은 미국의 봉쇄 정책을 뚫고 나와 전 지구적 세력으로 등장했다. 미국의 화웨이 제재에 대해 유럽이 보여 준 반응은 유럽에서 미국의 패권이 얼마나 무너져 가는지, 중국의 정치적 힘이 얼마나 성장했는지 잘 보여 준다. 미국의 쇠퇴로 중동에서도 중국의 정치적 영향력이 강해졌다. 중국은 석유 구매력을 바탕으로 이란과 사우디아라비아와 동시에 관계 맺는 국가가 되었다. 중남미에서도 미국의 지위는 추락하고 중국의 지위는 상승했다. 1990년대 국제금융 위기는 라틴아메리카에서 미국의 헤게모니가 흔들리는 결정적 계기가 되었다. 미중 무역전쟁이 한창 진행되던 2018년 9월 베이징에서 열린 중국-아프리카 협력포럼 회의가 열렸다. 57개국 중 단 한 국가도 빠짐없이 참석하여 앞으로 중국과 관계를 발전시켜 나갈 것을 다짐했다. 동남아시아도 마찬가지이다. 미국의 중국봉쇄 정책이 시행되었지만 2020년에 중국은 아세안의 최대 교역국이 되었다.

그러나 중국의 성장이 미국의 패권을 대체하거나 동아시아 지역의 패권을 차지한다는 것을 뜻하지 않는다. 미국의 패권적 지위가 무너진다고 해서 동아시아에서 강대국의 일원으로 역할을 할 수 없다는 뜻도 아니다. 바이든이 내세운 ‘규범 있는 질서’라는 미국 중심의 질서가 아니라 다자주의가 반영된 ‘규범 있는 국제질서’라면 중국은 기꺼이 수용할 가능성이 높다. 그런 점에서 미뇰로가 “중국의 민족주의는 서구 신자유주의에 대한 일종의 대응”이라는 언급은 일리가 있다. 중국의 부상은 중국의 의도와 상관없이 전후체제를 균열시키는 데 가장 큰 진원지 역할을 하고 있을 뿐 아니라 다자주의적 세계질서를 여는 중심축이 되고 있다.

전후체제의 위기가 전후체제의 중심부에서도 일어나고 있다. 동아시아 전후체제의 핵심은 미일동맹이다. 일본의 평화헌법 개정은 전후체제를 근본적으로 뒤흔드는 체제 변혁적 시도이다. 미일동맹은 샌프란시스코체제의 핵심이고, 일본의 평화헌법은 이웃 국가들이 미일동맹을 받아들인 핵심장치였다. 만약 일본이 평화헌법을 파기하고 한반도의 분단체제를 강제하고 중국을 봉쇄하는 신냉전 정책을 감행한다면, 이웃 국가들이 그것을 용인할 리가 없다. 그런 점에서 일본의 정상국가화는 중국에 대한 적대적 봉쇄를 풀고, 한반도의 분단체제를 해소할 때나 가능한 전후체제 이후의 체제 문제이다.

중국의 부상과 더불어 아시아에 다자주의 시기가 다가오게 된 또 하나의 동력은 샌프란시스코체제에서 배제되었던 남북한의 힘이 성장한 것이다. 북미 정상 간에 협상 과정에서도 한국의 힘은 여실히 증명되었다. ‘볼턴 회고록’에서 드러나듯 북미 정상들을 한 테이블에 앉힌 동력은 한국의 힘이었다. 한국은 이미 예스맨이 아니다. 한국에게 중국의 부상은 미국이 IMF 사태와 같은 일을 벌일 때 피해 갈 수 있는 하나의 대체통로로 활용할 수 있다

(IMF때 일본에게서 빌리기로 한 외화를 막은 놈이 미국이었다는 것을 듣고는 피가 거꾸로 쏟는 기분이었다)

전후체제 위기 시대에 미국이 한국에게 줄 수 있는 가장 큰 ‘선물’은 여전히 군사적 지원이다. 그러나 그 효력은 예전만 못하다. 우선 한국의 독자적 군사력이 성장했다. 핵은 보유하지 못했지만 한국의 군사력은 세계 7위로 북한을 억제하는 군사력으로는 충분하다

(왜 진보정권이 들어서면 군사력을 강화했는지 그 이유를 알 수 있는 대목이었다) 북한이 글로벌 경제체제에 편입하려는 시도는 한반도에서 미국의 군사력이 더 필요없게 만들고 있다. 한국의 안보 보수주의자들의 세력이 약화되고 분화되어 미국의 비합리적인 요구를 집행할 조력자의 동력도 현저히 떨어져 있다."
109005292,"짱깨주의의 탄생, 김희교 글, 보리 출판 7.",10,https://sarak.yes24.com/review/16729027,"책의 내용을 정리해 보았습니다.

저자의 현실 인식: 안보적 보수주의와 경제적 보수주의의 분화

한국의 보수주의는 급속하게 변화하는 세계와 샌프란시스코체제의 위기 속에서 분화하고 있다. 샌프란시스코체제하에서 주류 이데올로기였던 반공주의, 친미주의, 경제지상주의 세계관이 새로운 세계의 등장으로 서로 충돌하기 시작했다. 가속화되는 글로벌 경제시대는 반공주의를 무너뜨리고, 미국 패권의 추락은 친미주의를 흔들리게 만들고 있으며, 저성장 국면은 경제지상주의의 위기와 맞닥뜨리고 있다. 보수주의의 위기다.

보수주의의 위기가 가져온 가장 큰 변화 중 하나는 경제적 보수주의의 분화이다. 중국의 부상으로 만들어진 다자주의적 자유무역체제는 경제적 이익을 최우선 가치로 삼는 한국의 보수주의자가 중국을 기회의 땅으로 생각하게 만들었다. 이것은 체제의 위기를 극복하기 위해 유사인종주의와 반중주의를 내세우며 적대 진영을 구축해 대응하려 한 안보보수주의자의 전략과 근본적으로 부딪친다. ‘안보는 미국, 경제는 중국’ 시대에 걸맞게 보수주의 안보관과 경제지상주의를 동시에 가지고 있었던 경제 보수주의자는 경제적 이익과 안보관이 충돌할 때 경제적 이익을 우선할 것이 분명하다. 월가의 선택이 그 예이다. 미국 자본가들도 반중적이지만 세계관과 경제적 실익이 부딪칠 때는 경제적 이익을 선택하며 중국봉쇄 정책에 반대하고 나섰다.

한국에서 안보적 보수주의자의 기획대로 경제적 보수주의가 중국봉쇄에 가담한다면 그 결과는 한국 경제의 부활이 아니라 손해로 나타날 가능성이 높다. 사드 부지를 제공하고 난 뒤 롯데가 입은 피해를 보면 한중 사이 전면적 충돌이 일어날 때 벌어질 피해 규모를 충분히 상상할 수 있다. 중국이 자기들에게도 불만족스러운 ‘3불정책’을 수용한 것은 한국이 적대 진영으로 완전히 재편되는 것을 두려워했기 때문이다. 그러나 한국이 중국봉쇄에 가담할 경우 중국은 더 이상 한국의 이중적 태도를 수용할 필요가 없다. 이해하기 힘든 것은 사드 사태 이후 안보적 보수주의가 짱깨주의로 나아갈 때 한국의 경제적 보수주의의 목소리가 들리지 않았다는 점이다.

중국과 전면적인 충돌이 벌어질 때 한국의 경제 보수주의자는 어떤 선택을 할까?

장기적 관점에서 보면 이데올로기가 실익을 이기는 경우는 거의 없다. 미국의 신봉쇄 정책이 성공할 것인지 아닌지 상관없이 중국의 부상은 한국에서 경제적 보수주의의 분화를 가속화시킬 가능성이 매우 높다 미국의 중국봉쇄 정책이 성공한다면 반대급부로 돌아올 경제적 손실이 양 계파 간에 분화를 만들어 낼 것이며, 봉쇄 정책이 성공하지 못한다면 중국의 성장이 주는 매력이 분화를 촉진할 것이다. 결국 미국의 패권 상실은 주변국 내부에 새로운 이데올로기 지형을 만들어 내고 있다."
109005292,"짱깨주의의 탄생, 김희교 글, 보리 출판 6.",10,https://sarak.yes24.com/review/16728996,"책의 내용을 정리해 보았습니다.

저자의 현실 인식: 동맹국 사이 상호 이해관계의 충돌

트럼프행정부가 키신저 시스템을 무너뜨리고 중국을 봉쇄하기 위해 선택한 국가 간 체제는 지역동맹 확대 정책이다. 정치적으로는 쿼드 플러스와 클린네트워크를 계획했고, 경제적으로는 경제번영네트워크(EPN)을 선택했다. 트럼프행정부는 2020년 8월에 쿼드를 공식기구로 만들고 한국과 베트남, 그리고 뉴질랜드를 포함시키는 쿼드 플러스로 확대하려고 했다. 이들 세 나라는 참여하지 않았다. 3개국 모두 중국이 제1교역 대상국이다. 쿼드 플러스에 가입하는 순간 중국과 경제적 마찰은 불을 보듯 뻔한 일이었다.

미국이 중국봉쇄를 구축하는 신냉전 전략은 동맹국들과 중국 간에 문제만 일으키는 것이 아니다. 동맹국 사이 상호충돌도 일으킨다. 특히 일본과 한국의 충돌은 미국의 신냉전 전략을 실패로 만들 수 있는 가장 주요한 요인이 될 수 있다. 일본의 신냉전 전략은 한국의 분단체제를 지속시키는 것을 전제로 삼고 있기 때문이다. 한국이 일본의 팽창주의 경향에 경계하는 것은 미국이 컨트롤할 수 있는 수준을 넘어섰다.

(그러나 최근 윤석열 정부가 일본에 저자세를 보이는 모습을 보면 미국의 압력이 오기도 전에 미리 알아서 일본에게 꼬리를 흔드는 모습이다. 일본의 전략이 바뀌지 않았음에도 이런 태도를 보이는 것을 보면 윤 정부는 신냉전 전략에 적극적으로 찬성하는 것이 아닐까 의심이 든다. 북한과 적대관계를 만들면서, 일본과는 군사적 협력관계가 가시화되었을 경우 우리 국민들은 어떻게 반응을 할까? 혹시 같이 만세를 부를까? 설마…)

장기적으로 볼 때 미국의 아시아회귀 정책에 가장 강력한 적은 유럽일 가능성이 높다. 미국의 중국봉쇄가 곧바로 유럽의 손해와 이어지기 때문이다. 중국에 대한 봉쇄는 유럽의 피해로 나타나는 경우가 많다. 철강과 알루미늄 관세가 대표적이다. 이 제품 수입은 중국보다 유럽에서 더 많이 이루어지고 있다. (포린폴리시)의 마이클 허쉬 기자는 이런 현상을 두고 미국의 ‘배우자 학대(spousal abuse)라는 상징적인 표현을 사용했다. 중국을 군사적으로 봉쇄하기 위해 프랑스를 버리고 미국, 영국, 호주가 만든 새로운 안보동맹 오커스(AUKUS)는 ‘배우자 학대’의 결정판이었다. 프랑스와, 프랑스와 공조하는 EU는 이 같은 ‘배우자 학대’에 극단적으로 반발했다.

프랑스는 노골적으로 중국봉쇄 정책에 반대하고 나섰다. AUKUS 결성 이후 프랑스가 어디로 갈지는 불분명하지만 중국이 유럽에게 주는 경제적 이익을 미국이 보완해 줄 방안을 마련하지 않고 학대를 계속한다면, 미국이라는 배우자에 대한 존중이 사라질 가능성이 높다. 아리기가 주장하듯 “단연코 세계 최강국으로 남아 있지만 이제 나머지 세계에 대한 미국의 관계를 가장 잘 보여 주는 말은 헤게모니 없는 지배”를 하고 있다."
109005292,"짱깨주의의 탄생, 김희교 글, 보리 출판 5.",10,https://sarak.yes24.com/review/16728974,"책의 내용을 정리해 보았습니다.

저자의 현실 인식: 미국 중국봉쇄정책의 목적과 전망, 눈먼 우리 정부.

트럼프행정부의 동아시아 정책은 한마디로 정리하면 미국의 경제적 헤게모니를 부흥시키기 위하여 키신저 시스템을 파괴하고 샌프란시스코체제를 강화하는 것이었다. 키신저 시스템을 붕괴하기 위해 미국은 정치적으로 중국봉쇄 정책을 사용했다. 그러나 트럼프행정부의 신냉전 전략은 미국이 원하는 결과를 가져오지 못했다. 군사주의적 지역 동맹체인 쿼드는 미국 이외에 호주, 일본, 인도만 가입했다. 아세안과 한국조차 가입시키지 못했다. 또 다른 군사주의적 동맹체인 클린네트워크는 나토 회원국 30개국 이외에 겨우 20개국 정도만 참여한 유명무실한 단체가 되었다.

중국봉쇄를 성공했는지 아닌지와 별개로 중국과 벌인 무역전쟁이 무역수지 개선이나 미국 내 제조업의 부활을 가져오지도 못했다. 중국이 문제여서 미국이 추락한 것이 아니라 전 지구적 자본주의 체제에서 미국의 지위가 하락한 것이다. 바이든행정부는 트럼프행정부가 실패한 미국 우선주의를 버리고 가치동맹을 역설하며 자유민주주의 국가 동맹의 결성을 통해 중국봉쇄 정책을 수행하고 있다. 그러나 민주주의를 표방하며 권위주의 중국에 대항하자는 가치동맹은 사실상 자기모순에 빠질 수밖에 없다. 선출된 독재라 불리는 인도 모디정부와 우익화된 일본을 묶어서 가치동맹을 표방할 때 여기에 동의하고 참여할 국가는 많지 않다. 인도 모디정부의 가치동맹 참여는 인도 내부에서 강력한 반발에 직면해 있다. 바이든의 가치동맹이 성공할 것인지 아닌지는 미국의 동맹국들에게 중국이 주던 몫까지 선물로 줄 수 있어야 성공할 가능성이 높다. 일부 군사 동맹국을 제외하면 중국과 마찰을 벌여 경제적 손실을 입을 각오까지 하며 신냉전체제 구축에 가담할 가능성은 거의 없다.

(그런데 최근 나토에 가서 최상목 대통령실 경제수석이 “중국 성장이 둔화되고 있고, 내수 중심의 전략으로 전환되고 있다며, 지난 20년간 우리가 누려 왔던 중국을 통한 수출 호황시대는 끝나가고 있다”는 발언으로 추정해보면 신냉전체제 구축에 가담할 가능성이 높을 것도 같다. 최근 성주의 사드기지를 정상화하겠다고 발표하고, 3불정책은 중국과 합의된 사항도 아니고, 국방자주권의 문제라고 강하게 나대는 것을 감안하면 중국과 거래하는 업체들의 고민이 현실로 나타날 가능성도 클 것 같다. 윤석열이 선거공약으로 내건 사드기지 추가 설치는 언제쯤 실현하려고 할까? 김희교 교수의 예상과 다르게 우리나라의 향후 행보가 결정될 것 같아 걱정도 되지만 뭐 어쩔 것인가? 갑자기 일주일 안에 철수하라며 개성공단 사업주를 죽이던 박근혜 정부가 떠오른다. 중국과 관련하여 일하시는 모든 분들은 조심하시라.)

그렇다면 미국 내 이익집단은 중국봉쇄정책에 어떠한 태도를 보일까? 미국에서는 반중정서가 공화당과 민주당을 떠나 폭넓게 퍼져 있으니, 다들 쌍수를 들어 환영하고 있는 것일까? 막연히 존재하던 반중정서와 달리 실제로 중국 때리기를 실행하자 미국 내의 반응은 엇갈리기 시작했다. 인권단체들, 종교단체들, 극우인종주의자들, 노동계, 일부 산업계는 우호적이지만, 중국 제재로 직접적인 타격을 입은 산업계는 적극적인 반대에 나섰다. 중국 제재 방안으로 외국인 비자 취소 조치를 시행하자 하버드대와 MIT는 시행 중단을 요구하는 행정가처분 신청을 냈다. 곧이어 예일대와 대부분의 아이비리그 대학이 포함된 미국의 59개 대학이 이를 지지하는 의견서를 냈다. 미국 대학에서 중국 유학생을 추방할 경우 미국 정부는 거의 모든 미국 사립대학에 막대한 재정을 지원해야 한다. 미국인들은 대개 중국 상품을 소비한다. 소비자로서 미국인은 중국과 디커플링을 원하지 않는다. 2022년 초반 중국과 디커플링은 미국 물가 상승의 가장 큰 요인으로 작용했고, 물가 상승은 바이든 행정부의 가장 큰 고민거리가 되었다."
