goods_no,review_title,rating_score,origin_url,review_text
17254345,역사란 무엇인가는 철학의 문제,7,https://sarak.yes24.com/review/9585719,"124쪽

그러나 이것은 즉시 우리를 역사가의 연구방법의 두 번째 특징으로

이끈다. 앞에서의 우리의 질문에 대해서 10여 가지나 되는 러시아 혁명

의 원인들을 차례로 열거하고 나서 그것으로 그만두는 데에 만족하는

수험생은 B학점을 받을 수는 잇겠으나 A학점을 받기는 어려울 것이

다 ; 시험관들은 많이는 알고 있으나 상상력이 부족하다고 판정할 것

이다. 진정한 역사가라면 자신이 수집한 원인들의 목록을 앞에다 놓고

서는 그것을 정리해야 한다는, 원인들간의 상호관계를 결정해줄 일정

한 위계질서를 수립해야 한다는, 아니면 어떤 원인이나 어떤 범주의 원

인들이 결국에 가서는 또는 최

종적인 분석에 따라서 궁극적인 원인, 즉 모든 원인들의 원인으로 간

주되어야 하는지를 결정해야 한다는 직업적인 강박감을 느낄 것이다.

그렇게 하는 것이 곧 연구주제에 대한 역사가의 해석이다 ; 역사가가 어

떤 사람인지는 그가 이끌어내는 원인을 통해서 알려지게 된다. 기번은

로마 제국의 쇠퇴와 몰락의 원인을 야만성과 종교가 승리한 탓으로 돌

렸다. -중략- 모든 역사적 논의는 어떤 원

인이 우선하는가 하는 문제의 주위를 맴돌고 있다.

125쪽

앙리 푸앵카레는, 내가 앞의 강연에서 인용한 저작에서, 과학이 다양

성과 복잡성을 향해 그리고 동시에 통일성과 단순성을 항해 전진하고

있으며, 이 이중적이면서 명백히 모순적인 과정은 인식의 필요조건이라

고 지적했다. 이것은 역사에 대해서도 마찬가지로 진리이다. 역사가는

자신의 연구를 확장하고 심화시킴으로써 왜?라는 질문에 대한 답변을

점점 더 많이 끊임없이 축적한다. -중략-

버트런드 러셀이 학문에서의 모든 발전은 최초에 관찰된 조야한 통일

성으로부터 훨씬 벗어난 원인과 결과의 더욱 틈 분화로, 그리고 관련이

있다고 인정되는 원인들의 범위의 끊임없는 확장으로 우리를 이끈다고

말햇을 때, 그것은 역사학의 상황을 정확히 표현한 말이었다. 그러나

역사가는 과거를 이해하려는 충동을 가진 까닭에 과학자와 마찬가지

로 수많은 답변들을 단순화하는 일, 답변들의 상하관계를 정하는 일,

무질서한 사건들과 무질서한 특수 원인들에 일정한 질서와 통일을 부

여하는 일 등을 동시에 하지 않으면 안 된다. 하나의 신, 하나의 법, 하

나의 요소 그리고 저 멀리 잇는 하나의 성스러운 사건 ; 아니면 헨리 애

덤스(1938-1918,미국의 문학가, 역사가)가 추구한 모든 이들의 아우

성을 끝장내고 길들이게 할 어떤 위대한 일반화 - 이런 것들은 오늘

날에는 한물간 농담처럼 들린다. 그러나 역사가가 원인을 다양화해야

할 뿐만 아니라 단순화하는 작업도 해야만 한다는 사실에는 변함이 없

다. 역사도 과학과 마찬가지로 이렇듯 이중적이면서 명백히 모순적인

과정을 통해서 전진하는 것이다 .

그 하나의 미끼는 역사에서의 결정론 혹은 헤겔의 간계라는 꼬

리표가 붙은 것이고, 다른 하나는 역사에서의 우연 혹은 클레오파트

라의 코라는 꼬리표가 붙은 것이다. -중략-

칼 포

퍼 교수는 제2차 세계대전 기간 중에는 더 대중적인 성격의 두 권의 책

을 영어로 출간했다 : 그것들은 열린사회와 그 적들

과 역사주의의 빈곤이다.

-중략-

이사야 벌린 경은 당연히 인기도 잇고

독자도 많은 저자이다, 지난 5, 6년 동안 영국이나 미국에서 역사에 관

해서 한 편의 논문이라도 썼거나 어떤 역사책에 관해서 정식으로 서평

이나마 한 편이라도 쓴 사람이라면 거의 모두 헤겔과 마르크스와 결정

론을 잘 아는 체하면서 경멸해왔고 역사에서의 우연의 역할을 인식하

지 못하는 것은 어리석은 일이라고 강조해왔다, 이사야에게 그의 제자

들에 대한 책임까지 묻는 것은 아마 부당한 일일 것이다.

129쪽

결정론은 역사의 문제가 아니라 모든 인간행위의 문

제이다. 원인도 없이 행동하며 따라서 그 행동이 결정되어 있지 않은 인

간이란, 사회의 밖에 존재

하는 개인과 마찬가지로 하나의 추상이다, 인간사에서는 모든 것이 가

능하다는 포퍼 교수의 주장은 의미가 없거나 거짓이다. 일상생활에

서는 누구도 그 말을 믿지 않으며 믿을 수도 없다. 모든 것에는 원인이

잇다는 자명한 명제는 우리 주변에서 무엇이 일어나고 있는지를 이해하

기 위한 우리의 능력의 한 조건이다.

역사란 무엇인가는 1986년부터 지금까지 제게는 숙제로 느껴집니다.

읽을 때마다 맛이 달라서 그리고 제가 제대로 모른다는 느낌을 매번 주거든요

오늘 읽은 부분도 특히 그렇습니다. 칼 포퍼를 이렇게 신랄하게 짚어볼 수 있

는 학자가 몇 명이나 되겠습니까.

그래서 읽기 싫어지기도 하지만 읽고나면 기분이 좋은 책 이 책은 제게

그런 의미로 다가옵니다.

나는 오늘 생각을 많이 하고 싶다는 생각이 드실 때 일독을 권해봅니다."
17254345,역사란 무엇인가,6,https://sarak.yes24.com/review/10265298,"참으로 어렵게 읽었다 .

우리딸 말처럼 참 재미없는 책이다 .

역사적 사건을 기술한 역사책이 아니고,

어떻게 역사를 이해하고 받아들여야 하는지에 관해 논하는 책이다

이 저자는 그 유명한 “E.H. 카 “

“ 역사란 현재와 과거 사이의 끊임없는 대화 ” 라는 유명한 말을 남긴 사람이다 .

나도 사실 딸아이가 읽어보라고 주기전까지는 몰랐다 .

대학교양도서란다 .

유시민의 글쓰기 특강에서도 소개되었다 .

하여튼 재미는 없다 치고 ... 이 책의 요점을 정리해 보자면 ,

1. 역사를 연구하기에 앞서 역사가를 연구하라

역사가 ( 사회적 환경 ) 가 바라보는 관점에 따라

나쁜 존 왕이 될수도 있고 , 훌륭한 존 왕이 될수도 있다는 사실 .

우리의 역사관은 우리의 사회관을 반영한다 .

2. 역사는 개인의 행동이 아니다 .

역사의 사실은 분명히 개인에 관한 사실이지만 , 고립된 채 행한 개인의 행동에 관한 사실 ,

또는 실제적인 동기든 상상적인 동기든

개인 스스로가 자신들을 움직이게 했다고 생각하고 있는 동기에 관한 사실은 역사의 사실이 아니다 .

역사의 사실이란 사회속에 있는 개인의 상호관계에 관한 사실 ,

그리고 개인의 행동에서 본인들이 의도했던 것과

자주 모순되거나 가끔 상반되는 결과를 생겨나게 하는 사회적 힘들게 한 사실인 것이다 .

3. 사회과학의 개념 . 그 안에는 역사가 있다 .

4. 역사와 도덕과의 관계

역사가가 우선 관심을 두어야 하는 것은 그들의 업적이다 .

역사가는 자신의 책에 등장하는 개인의 사생활에 대해서

도덕적인 판단을 내리기 위해서 옆길로 새기 않는다 .

4. 우연을 인과적 결정의 부재와 혼동하지 않는다 .

우연은 결코 단순히 우연으로 발생하지 않는다 .

그 상황이 일어날 수 밖에 없는 여러 가지 사건들이 모여지고 모여게 끝내는 필연처럼 발생한 것이다"
17254345,사학과 진학을 꿈꾸는 사람이라면 필독해야할,6,https://sarak.yes24.com/review/10136144,"요즘 아이들의 대입 전형은 2000년대 초반 대학 입시를 준비 했던 나의 그것과는 상당히 달라져있다. 정시 모집 보다 훨씬 많은 비율의 학생들을 수시 모집으로 유치를 한다. 안정적인 신입생 유치를 위한 대학의 편법일 수 도 있지만 단순한 내신과 수능 성적에 의존하지 않고 신입생들의 전공 접합성을 학교생활기록부와 자기소개서, 면접을 통해 가려 낸다는 것은 나름 고무적인 방법인 것 같기는 하다.

재작년 한 제자 녀석은 상대적으로 낮은 내신 성적에도 불구 하고 영국 축구와 문화에 관심이 많아서 영문학과 진학을 원했고 단 1년 동안 이었지만 교내 영어 관련 대회는 다 참여하고 비록 수상은 못했지만 자기 소개서와 면접에서도 본인의 영어 사랑을 어필해서 결국엔 강원대학교 영어영문학과에 합격을 할 수 있었다.

올해 3학년 올라가는 제자 녀석이 있다. 취업이 힘들지만 본인이 강력하게 사학과 진학을 목표로 하고 있어서 이 책을 선물로 주었다. 미리 보기로 몇 페이지 읽어 보니 역사의 본질에 대해서 생각을 많이 해볼 수 있는 책인 것 같았다."
17254345,역사를 왜 배우는지 고민해 보게 만드는 책이에요.,10,https://sarak.yes24.com/review/21840615,이 책은 역사를 단순히 외우는 과목이 아니라 사람과 사회를 이해하는 과정으로 설명해 줘요. 과거의 사실이 어떻게 해석되고 선택되는지 알려 줘서 생각하며 읽게 돼요. 학부모 입장에서는 아이가 역사에 흥미를 잃지 않고 질문하는 태도를 기르는 데 도움이 된다고 느껴요. 내용은 진지하지만 문장이 비교적 차분해서 천천히 읽으면 이해돼요.
17254345,최고의 명작,10,https://sarak.yes24.com/review/21835325,"『역사란 무엇인가』는 단순한 사건 암기가 아닌, 역사 해석의 관점을 고민하게 만드는 책이다. E.H. 카가 말한 ‘역사란 과거와 현재의 끊임없는 대화’라는 관점은 역사 공부의 태도를 돌아보게 한다. 이 책을 통해 사료를 비판적으로 바라보는 시각과 역사가의 역할을 이해할 수 있었다."
17254345,좋아요.,10,https://sarak.yes24.com/review/21796097,좋아요.좋아요.좋아요.좋아요.좋아요.좋아요.좋아요.좋아요.좋아요.좋아요.좋아요.좋아요.좋아요.좋아요.좋아요.좋아요.좋아요.좋아요.좋아요.좋아요.좋아요.좋아요.좋아요.좋아요.좋아요.
17254345,역사를 해석하는 열쇠의 책,10,https://sarak.yes24.com/review/21541681,역사는 단순한 사실의 나열이나 기록을 뛰어 넘어 현재와 과거의 끊임없는 대화이다. 역사가의 관점과 해석이 반영된 창조적 작업인 것이다. 이 책은 역사학의 본질에 질문을 던지고 독자로 하여금 스스로 사고 하게 만드는 철학적 힘을 가진 책이다.
17254345,역사란 무엇인가,10,https://sarak.yes24.com/review/21471103,"역사란 무없인가. 그저 단순히 과거에 있었던 일에 대한 암기인가? 역사가 가지는 의미는 단순하지 않다. 역사는 단순한 과거 사실의 나열이 아니라, 현재의 역사가가 해석하고 의미를 부여해 구성하는 담론이다. 카는 과거보다 이를 해석하는 현재의 역사가를 더 중요하게 보았으며, 역사는 현재의 문제의식과 미래에 대한 전망 속에서 이해되어야 한다고 강조했다. 한번쯤 꼭 읽어봐야하는 책"
17254345,추천,10,https://sarak.yes24.com/review/20562395,ㅇ ㄴㅂㆍㄷㅅㄷ응ㄷㅇㄷㅇㄷㅇㄷㅇㄷㅇㄷㅇㄷ슷ㄷㅅㅌㅇㄷㅇㄷㅇㄷㅇㄷㅇㄷㅇㄷㅇㄷ읏ㆍㅅㆍㅅㄷㅇㄷㅇㄷ으승ㄷㅇㄷㅇㄴㅅㆍㅂㆍㅇㄷㅇㄷㅇㄷㅇㄷㅇㄷㅇㄷㅅㆍㅇㄷㅇㄷㅇㄷㅇㄷㅇㄷㅇㄷㅇㄷㅇㄷㅇㄷㅇㄷㅇㄷㅇㄷㅇㄷㅇㄷㅇㄷ
17254345,[북클러버] '역사란 무엇인가'를 읽고서,10,https://sarak.yes24.com/review/20282311,"영국 런던 출신으로 외무부에서 수많은 업무에 종사했던 E.H. 카가 1961년 1월부터 3월까지 케임브리지 대학 강단에서 연속 강연한 것을 묶은 '역사란 무엇인가'책에서는 역사란 현재와 과거의 끊임없는 대화라는 것을 보여준다. 역사 전반에 걸친 문제점을 구체적인 예시를 통해 제시하며, 이해하기 쉽게 명쾌한 대답을 제시하고 있다.

이 책을 처음 읽을 때 책의 두께는 얇은데 진도가 잘 나가지 않았다. 두 번 정도 읽으니 조금 내용이 보이기 시작했고, 변호인 영화에 나왔다는 걸 알고 영화를 다시 한번 봤다. 송강호가 변호를 하기 전에 ’역사란 무엇인가’ 라는 책을 밤새 여러 번 읽는 장면이 나오는데 책 페이지를 너무 쉽게 넘기는 걸 보고 나 자신과 많이 비교됐었다.

영화 대사에서 인상적인 표현이 나온다. ""바위는 아무리 강해도 죽은 거고 계란은 아무리 약해도 산 거라고, 계란이 바위 넘는다고 니 안 그랬나?“

아래는 책에서 밑줄 긋기로 볼 수 있는 부분이다.

p.46 역사가는 자신의 해석에 맞추어 사실을 만들고 또한 자신의 사실에 맞추어 해석을 만드는 끊임없는 과정에 종사하고 있는 것이다. ~ ‘역사란 무엇인가‘라는 질문에 대한 나의 첫 번째 대답은, 역사란 역사가와 그의 사실들의 끊임없는 상호작용 과정, 현재와 과거 사이의 끊임없는 대화라는 것이다.

p.64 여러분은 역사를 연구하기에 앞서 역사가를 연구하라. ~ 여러분은 역사를 연구하기에 앞서 그의 역사적, 사회적 환경을 연구하라. 역사가는 개인이면서 또한 역사와 사회의 산물이다. 역사에 대한 좋은 시각과 비판을 배울 수 있는 책으로 어려운 내용들로 이루어졌지만, 우리 아이들에게 이 책을 꼭 읽게 하고 싶다. 친구들끼리 서로 읽고 토론하게 한다면 향후 커나가면서 좋은 가치관 형성에 많은 도움이 될 거 같다는 생각이 든다."
17254345,[책 읽는 아빠학교] 2028년 8월 후기 _역사란 무엇인가?(E. H. 카),10,https://sarak.yes24.com/review/20278856,"독서 모임을 통해 두 번을 읽은 책이지만, 시간이 지나고 기억의 남는 것은 몇 구절뿐이다. 역사란 역사가를 통해서 기록된 역사이다가 가장 인상 깊다. 역사가를 통하지 않은 역사의 서술이란 없기에, 역사에 있어서 역사가의 역할은 중요하다는 논지를 세세하고 어찌보면 지엽적이기까지한 역사 서술과 역사가를 들어 펼친다. 이 책을 읽다보면 논증은 이렇게 해야하는구나 하는 생각을 하게 된다. 관념적이고 모호하기만 한 역사라는 주제에 실체를 부여하는 저자의 박식함과 논리정연함에 감탄했다. 기록되어 전수되는 것만이 역사라면, 인류나 세계사를 볼 때, 역사 그 자체는 얼마나 선택적이고 제한적인지를 알게 된다. 현대까지를 살아온 민초 그리고 살고 있고, 살아갈 사람들과 실체들이 역사 그 자체이지만, 서술되지 않으면, 그저 존재했다 사라질 뿐이다. 그러나 역사에 기록되지 않더라도 개인의 삶은 그 자체로 역사이고, 이 삶을 어떻게 바라보느냐에 따라서 개인의 역사도 변한다. 행복은 지금 가지고 있는 것에 얼마나 만족할 줄 아는가에 달려있다는 말이 있다. 지금 나, 그리고 내 삶이 기록되어 역사의 일부가 되지 않을지라도, 나는 나로서의 역사를 하루하루 스스로 써간다는 생각으로 지금 이순간을 소중하게 여기고 감사하게 살아가길 다짐해본다. 그것이 언젠가 역사의 강물을 이루었던 물한방울로서 의미를 가질터이므로."
17254345,[책 읽는 아빠 학교] 2024년 8월 모임 후기_역사란 무엇인가,10,https://sarak.yes24.com/review/20278803,"1. 간단한 모임 소개 * 광진구 책 읽는 아빠학교

2. 이번 달 모임은 언제 , 어디서 모였나

* 여름 휴가 일정으로 오프모임을 하지 못해, 기 실시한 모임의 주제도서 정리도 대체합니다.

3. 무슨 책을 읽었나

* 역사란 무엇인가(E. H. 카)"
17254345,[서평] 역사란 무엇인가,10,https://sarak.yes24.com/review/17222220,"『역사란 무엇인가(김택현 옮김/까치)2015,What Is History(1961)』는 질문하고 치열하게 답하는 과정을 통해 독자를 자극하고 깨어있게 만드는 E.H.카의 주요 저서다. 러시아 주재 외교관이기도 했던 카의 또 하나의 기념비적인 저작은 14권 분량의 소련사인 『소비에트 러시아의 역사』로 이 책은 “탁월한 역사적 업적”이라는 찬사를 받는다. 『역사란 무엇인가』는 69세였던 카가 1961년 영국 케임브리지 대학교에서 여섯 차례에 걸쳐 진행한 강연을 묶은 책이다. 강연의 이유를 제 2판을 위한 서문에서 “진보에 대한 모든 신념과 인류의 더 나은 진보에 대한 모든 전망을 어리석은 짓이라고 배제해버리는 오늘날의 회의주의와 절망의 조류가 엘리트 주의의 한 형태”(p.12)라 진단하고 이에 대항하기 위함임을 밝힌다. 전쟁과 사건들이 끊이지 않았던 20세기 전반기, 진영 간 갈등이 두드러졌던 냉전기를 몸소 경험했던 저자는 과거와 현재, 그리고 미래를 긴밀히 연결함으로 새로운 시각을 제시한다.

총 여섯 장으로 구성된 『역사란 무엇인가』는 “역사가와 그의 사실들”로 시작한다. 사실은 역사가가 허락할 때에만 이야기하며 어떤 사실에 발언권을 주고 순서나 전후관계를 결정하는 사람 역시 역사가(p.21)라는 주장이다. 저자는 여러 학자가 갖고 있는 견해를 소급해 그들이 놓치고 있는 면을 짚기도 한다. 결국 인간과 그의 환경의 관계를 역사가와 그의 연구주제의 관계와 동일하게 보고 “평등한 관계, 주고받는 관계”로 역사가는 자신의 해석에 맞추어 사실을 만들고 동시에 이와 반대로 사실에 맞추어 해석을 만드는 끊임없는 과정에 종사한다고 지적한다. 여기서 카의 유명한 명제인 “역사란 역사가와 그의 사실들의 끊임없는 상호작용 과정, 현재와 과거 사이의 끊임없는 대화”라는 문장이 등장한다. 2장 “사회와 개인”에서는 역사는 하나의 사회적 과정이며, 개인은 그 과정에 사회적인 존재로서 참여하므로 사회와 개인의 대립을 가정하는 일 자체가 우리의 사고를 혼란시키는 미끼일 뿐이라고 말한다.(p.79) 이를 위해 살펴보는 가정들과 역사 위인설 등 여러 사례는 무척 흥미롭다.

3장 “역사, 과학 그리고 도덕”에서는 역사가를 역사적 사실의 수집가와 구별해주는 것을 일반화로 본다. 일반화의 진정한 핵심은 이를 통해 역사로부터 가르침을 얻고자 하는데 있다. 즉. 사건에서 얻은 교훈을 다른 사건들에 적용하는 것을 의미한다. “과거에 비추어 현재를 배운다는 것은 또한 현재에 비추어 과거를 배운다는 것을 의미한다.”(p.96)는 인상 깊은 주장은 과거와 현재에 대한 이해를 진전시키며 이는 여기서 그치지 않고 미래를 조망하게끔 이끈다. 역사가와 자연과학자가 동일 선상에 있는 이유와 근거들을 제시하기도 한다. 4장 “역사에서의 인과관계”에서는 역사에서의 우연의 문제를 다루는데 저자의 선명한 주장을 볼 수 있다. 5장 “진보로서의 역사”를 넘어 마지막으로 “지평선의 확대”에서는 세계 중심의 이동을 확인한다. 그는 “나 자신으로 말하면, 나는 여전히 낙관론자이다.”라고 전하며 앞서 살폈던 이론가들의 동의하기 어려운 역사관을 소환하고 결론 내린다.

부록으로 실린 제 ‘2판을 위한 노트’는 방대하고 꼼꼼하게 모은 자료철을 통해 세상에 나오지 못한 판본을 잠시 상상하게 만든다. ‘역사이론에 공헌한 가장 소중한 인물들 중 한 명’이라고 일컬어지는 카는 묻기를 멈추지 않은 학자였고 자신이 먼저 답하고자 한계를 두지 않고 시간의 밀도를 높였음을 알 수 있다. 오래 전 읽었을 때 지적 거인의 논리에 감탄해마지 않았는데 마치 초독 같은 재독을 했던 이번에는 결코 쉽게 읽히는 책이 아니었다. 강연이었던 만큼 더욱 자신의 뜻을 오해 없이 명확하게 전달하고자 하는 의도는 두드러졌다. 즉, 논지를 요약하기 위해 거듭 서수를 사용하면서 사례를 대고 다양한 예시로 설명을 보충하기에 이해의 폭을 넓힐 수 있었다.

다만, 엄청난 분량의 인용이 미덕이자 가독성을 떨어뜨리는 걸림돌이기도 했다. 계속되는 인용이 매끄러운 자갈길을 걷는 느낌을 주었다. 돌 하나하나를 주워들고 들여다 보아야 할 것 같았지만 그러다가는 너무 지체되고 혹시 들어섰던 이 길이 애초에 어디를 향했었는지 놓칠 것 같아 일단은 계속 통과하는 여정이었다. 시대와 조류에 대한 이해를 더한다면 책은 다르게 다가올 것이고 이는 독자의 몫인 것 같다. 용이한 독서는 아닐지라도 『역사란 무엇인가』 읽기는 선택보다 필수에 가깝다. 곱씹어 반복해 읽을 필요도 있겠다. 그렇다면 나에게 역사란 무엇인가, 나는 역사를 어떻게 정의내리고 시선을 거두지 않기 위해 무엇을 할 수 있겠나? 역사의 범위와 초점을 조정했을 때 답은 달라질 것이고 정해진 정답 또한 없을 것이다. 그럼에도 묻는 일을 간과하지 않아야 한다는 또렷한 자극으로서도 카의 저서는 멈추지 않고 미래를 변화시킬 것이다.

따라서 ‘역사란 무엇인가?’라는 질문에 대한 나의 첫 번째 대답은, 역사란 역사가와 그의 사실들의 끊임없는 상호작용 과정, 현재와 과거 사이의 끊임없는 대화라는 것이다.(p.46)

역사에서 배운다는 것은 결코 단순한 일방적인 과정이 아니다. 과거에 비추어 현재를 배운다는 것은 또한 현재에 비추어 과거를 배운다는 것을 의미한다. 역사의 기능은 과거와 현재의 상호관계를 통해서 그 두 가지 모두에 대한 보다 깊은 이해를 진전시키는 데에 있다.(p.96)

(전략)역사가는 끊임없이 ‘왜?’라는 질문을 던진다; 그렇기 때문에 답변을 내놓고자 한다면 쉴 수가 없다. 위대한 역사가-혹은 더 폭넓게 말하자면 위대한 사상가-란 새로운 것들에 관해서 또는 새로운 맥락 속에서 ‘왜?’라는 질문을 제기하는 사람이다.(p.121)"
17254345,독재자가 왜 이책을 두려워 했는지 알려준다,10,https://sarak.yes24.com/review/16110949,"과거와 현재의 대화’ 또는 ‘과거의 사실과 현재의 역사가의 대화’라는 이책의 유명한 대목은 누구나 알것이다

역사는 고정되어 있는 것이 아니라 끈임없는 대화로 누가 선택 기술하는냐에 따라 달라진다는 것이다

한때 우리한국에서 불온서적으로 법적 처벌을 받은 적이있였다 그건 (독제 권력자)자신들의 (쿠테다) 승리자의 기억, 역사로 남아야 한다는 생각 때문은 아니였을까

지금 현재의 역사에서는 그렇치 않치 않은가 그들은 승리자가 아니며 역사의 죄인으로 다시금 평가 받고 또 언젠가 누군가의 선택으로 어떻게 바뀔지 모른다는 것"
