goods_no,review_title,rating_score,origin_url,review_text
105775371,데일리 필로소피,10,https://sarak.yes24.com/review/15750070,"나에게 투자하는 10분

하루를 변화시키는 힘!

『 데일리 필로소피 』

2022년이 시작되고 12일이 지나고 있다.

신년이 되면 많은 계획들을 세운다. 지금 시간이면 신년의 계획들이 느슨해지지는 않았는지 실천은 잘 하고 있는지 흐트러진 초심을 잡아야 하는 시점이다.

해이해지기 쉬운 지금의 시점에 딱 어울리는 책을 소개해 본다.

신년에 만나기 시작한 책 『 데일리 필로소피 』 이다.

『 데일리 필로소피 』 는 스토아학파에서 주장하는 이야기들을 주제로 매일 철학적인 질문들을 던지고 있다.

스토아학파 는 헬레니즘 시대에 기존의 그리스 철학에 비해 절충과 화합을 찾는 방향에서 등장한 사상이다. 스토아학파는 생활 속에서 답을 찾고자 하는 생활 철학의 모습이 보인다.

'쾌락주의'를 기본 바탕으로 하기 때문에 스토아학파는 삶의 목적을 '행복에 있다.'라고 주장한다. '행복은 어디에서 오는가?' 행복은 욕망에 사로잡히지 않는 고요한 마음 즉 마음에 평정을 얻을 때 진정한 행복이 구연된다. 고요한 마음 상태인 '아파테이아'가 윤리적 삶의 이상이며, '인간은 어떻게 살아야 하는가?'에 도달하기 위해서 인간은 자연과 이성에 순응하라고 한다.

스토아학파는 추상적이고 관념적인 가치가 아니라 일상을 살아가는 데 쓸모 있고, 실용적인 답을 찾는 것에 집중했다.

""화는 어떻게 다스려야 하는가?""

""눈앞에 닥친 어려움을 어떻게 다스려야 하는가?""

""성공과 행복이란 무엇인가?""

2000년 전 철학자들의 고민이나 현대 사회를 살아가는 우리의 고민이나 별반 다를바가 없어 보인다.

누구나 죽음과 고통은 피할 수 없기 때문에 인간이 바라보는 문제의 본질 또한 시대가 변해도 바뀌지 않는 것이다.

""내 인생의 답은 어디에서 찾을 수 있는가?""라는 질문에 스토아 철학자들은 ""하루는 모든 날의 다른 이름이다. ""라고 말한다. 즉 우리가 살아가고 있는 오늘에서 온전한 일상을 찾을 수 있다는 것이다.

스토아학파는 우리의 삶이 불분명하며 예측 불가능하다는 사실을 받아들이고, 나의 삶에서 해낼 수 있는 것, 자신이 진정으로 하고 싶은 것에만 집중 하라고 한다. 통제할 수 없는 것에 대한 미련을 버리고 통제할 수 있는 자신의 삶에 집중 해야 한다는 것이다.

우리의 삶은 고통에서 완전히 자유로울 수 없으며, 어떤 어려움에 직면하든 남은 삶을 살아가야 한다. 그렇게 살아가면서 하루하루 눈앞의 문제를 해결하다 보면 어제보다 성장한 오늘을 사랑하게 될 것이다.

저자는 사색을 통해 삶의 이유이자 목적을 우선 찾으라 고 한다. 사는 이유를 명확히 알아야 하고 하고 싶은 일이 무엇인지 알고 그 일에 집중할 수 있다. 목적을 찾게 되면 삶의 시련이 닥쳐도 실망을 하거나 후회하며 주저앉기보다 앞으로 나아갈 수 있는 힘을 얻을 수 있다.

저자는 책을 통해 단순히 스토아 철학을 듣고 이해하는 수준에 그치지 말고 자신만의 분명한 삶의 방향을 찾으라고 말한다.

『 데일리 필로소피 』 에서는 나를 찾고 나에게 집중하라고 한다. 끊임없이 주의를 기울이고 자각하다 보면 나를 찾는 여정에서 평정과 평화를 찾게 될 것이다.

일관성 있게 나를 찾고, 할 수 있는 것과 없는 것, 본질적인 것과 아닌 것을 구분하고, 나의 방향과 목적을 찾고 꾸준히 실천하는 힘을 응원한다.

진정 나를 찾아가는 길이 될 것이다.

『 데일리 필로소피 』는 크게 4부로 구성되었다. 1년 동안 매일매일 사색할 수 있도록 월별, 일별 명언들로 구성했다. 하루 한 문장씩 읽을 수 있는 명언들을 선별하고 그에 대한 설명을 보충하는 방식으로 구성되어 있다. 철학자들의 명문장들과 그 의미들이 매일 나를 찾아온다. 문장의 의미를 생각하다 보면 나의 생각을 더 깊이 이해할 수 있게 된다.

책은 깨끗하게 일어야 한다는 강박이 있는 내가 책에 밑줄이 쭉쭉~ 그으며 읽었다.

특히 아래에 있는 여백은 나를 유혹한다. 제발 좀 쓰라고!

그래서 책의 여백에 문장의 단상을 메모했다. 그냥 지나칠 수 없는 문장들이 즐비했기 때문이다.

재독을 하는 지금은 마음에 드는 문장을 필사하며 정독 중이다.

『 데일리 필로소피 』는 한번 읽고 책장에 두기에는 아까운 책이다.

『 데일리 필로소피 』로 매일 명상을 하면 하루를 함께 시작하는 좋은 친구가 될 것이다.

나를 다스리는 한 문장으로 하루를 시작할 수 있고, 나의 날들에 대한 방향성을 찾을 수 있다.

마음이 복잡할 때 아무 페이지나 읽어도 좋고 꽂히는 문장이 있으면 그 문장을 탐독해도 좋다

언제 어디서나 함께 할 수 있는 장점이 있다.

『 데일리 필로소피 』로 나에게 투자하는 10분이면 하루를 변화 시킬 수 있는 힘을 얻게 될 것이다.

날마다 나를 찾는 기운을 받고 싶다면 꼭 함께 하기를 추천한다.

- 출판사로부터 도서를 제공받고 작성한 지극히 개인적인 생각입니다. -"
105775371,데일리 필로소피,10,https://sarak.yes24.com/review/15734055,"이 책의 띠지를 봤을 때 <타이탄의 도구들> 저자 팀 페리스가 쓴 책인 줄 착각했다. 옆에 사진이 있지만 외국 사람의 얼굴을 기억할리 만무하다. 책의 저자는 생소하지만, 어쨌든 팀 페리스와 트위터 CEO 잭 도시의 철학 멘토라 하니 믿어도 되겠다.

이 책은 QT처럼 매일 아침 스토아학파의 철학 한 문장을 읽고 삶의 지혜를 배워서 독자들의 일상에 적용하는 구조이다. 교회에서 받은 <오직 성령이>라는 제목의 365일 묵상집이 있다. 거기에 철학 학문장씩 읽을 수 있는 <데일리 필라소피>를 추가해서 1년을 멋지게 지내 볼 생각이다.

아무리 후회해도 과거를 바꿀 수는 없다. 우리가 변화시킬 수 있는 것은 오로지 미래다. 그것이 바로 지금 이 순간이 가진 힘이다.

데일리 필로소피 013p

부족한 점이 많았던 2021년은 잊어버리자. 과거에 발목이 잡혀 현재를 망치고 미래를 꿈꾸지 못했던 모든 시간들과 이별한다. 내가 할 수 있는 것에 집중하는 한 해를 만들어 보자. 지난해 4분기에 초고를 완성했다. 2년 반만에 이루어졌다. 그동안 쌓아온 내공도 있었겠지만 무엇보다 목표를 정하고 하루 하루 할 수 있는 것에 집중했기 때문에 가능했다. 올 한해 더 집중하고 더 좋은 결과를 만들어 보자.

중요하지 않은 일을 더 많이 거절 할 때 내 자신이 원하는 방향으로 삶을 이끌어갈 수 있음을 기억하리.

데일리 필로소피 015p

""안돼!!"" 라는 말은 왜 이렇게 하기가 힘든지.... 거절을 못해서 내 계획을 망치기도 하고 하루의 기분이 엉망이 되기도 했다. 내 소중한 시간을 낭비한 적은 또 얼마나 많았는지. 어떤 일이든 처음이 힘든 거다. 한 번이 두 번 되고 두 번이 세 번이 된다. 이렇게 반복적으로 실행하다 보면 자연스럽게 거절할 날이 반드시 올 거라고 생각한다. 내 계획, 감정, 시간은 소중하다. 거절함으로 내 자신을 지켜야 겠다. 주도적인 삶을 살기 위해서는 초점이 '나'에게 맞춰져야 한다. 남의 눈치 살피느라 내 인생을 허비하는 것보다 어리석은 일은 없다. 나에게 집중하기!

우리 마음속에 모든 것이 있다. 바깥 세상에 시선을 집중하지 말고 자신의 내면으로 방향을 돌려야 한다.

데일리 필로소리 021p

내가 통제할 수 없는 외부적인 일에 그동안 어떻게 반응했던가? 스스로 어찌해 볼 방법이 없는 순간에도 그 일을 해결하기 위해 맘 졸이며 스트레스를 많이 받았다. 벌어진 현상을 있는 그대로 인정하지 않았기 때문이다. 내 노력으로 되지 않는 일에 에너지를 소모하지 말자. 내가 할 수 있는 일에 집중하기에도 벅찬 인생이다. 올 한 해는 오로지 나에게 집중하며 보내자.

'스토아 철학은 추상적이고 관념적인 가치가 아니라 일상을 살아가는 데 쓸모 있는 실용적인 답을 찾는 것에 열중했다.'고 프롤로그에 소개되어 있다. '스토아 철학을 따르는 사람들은 늘 행동하는 사람들이었고, 이들에게 스토아 철학은 실천이자 삶을 바꾸는 동력이었다.'고도 한다. 매일 스토아 철학 한 문장을 읽고 나 자신을 성찰해 나가면 1년 후에 나는 분명 다른 삶을 살아가고 있을 것이다. 조급한 마음을 버리고 하루 하루 조금씩 성숙해 가는 나를 기대해 본다."
105775371,책을 읽고 나서,10,https://sarak.yes24.com/review/15733950,"안녕하세요. 위드구루입니다.

아침을 바꾸는 철학자의 질문

이 책의 구성은 다음과 같다.

1부 철학자처럼 아침을 시작하는 법

2부 나를 지키면서도 단단하게 관계 맺기

3부 지치고 불안한 마음에 용기를 더하는 말들

4부 매일 저녁, 나의 하루를 의미 있게 만드는 질문들

저자인 ""라이언 홀리데이""는 우리 시대를 대표하는 사상가이자 미디어 전략가이다.

대중들에게 스토아 철학을 소개하여 실리콘밸리의 철학 멘토로 불리기도 한다.

현재도 작가로 살고 있으며, 기업 컨설팅과 개인 브랜딩을 지원하면서 활동하고 있다.

이 책의 주된 목적은 단순하게 스토아 철학을 듣고 이해하는 수준이 아니라, 자신만의 분명한 철학가 정신과 삶의 방향을 찾기 바라고 있는 것이다.

위 문제에 대한 답을 찾기 위하여 이 책이 쓰인 것이고 주된 목적이라 할 수 있다.

총 4부로 구성이 되어 있고 1월부터 12월까지 매일 하나씩 파악하고 해결할 수 있도록 책의 제목처럼 구성이 되어 있다.

조금 살펴보면 12가지 주제로 구성이 되어 있는데, 실천, 열정, 목적, 모욕, 친절, 삶, 평온, 마음, 정의, 계획, 사랑, 만족 이라는 주제를 가지고 알려주고 있는 것이다.

위와 같은 주제를 1년 내내 매일같이 사색하면서 느끼고 생각할 수 있도록 구성한 것이 저자의 돋보이는 점이다.

비록 철학과는 가까운 사이는 아니지만 앞으로 1년 동안 하나씩 보고 생각하면서 진정한 삶의 방향을 생각하고 뒤돌아 봐야 되겠다.

나는 내가 바라는 모습으로 살고 있을까?

다른 사람과 비교하지 않고 살아갈 수는 없을까?

불안과 두려움을 어떻게 극복할 수 있을까?

진정으로 행복한 삶은 어떤 것인가?

이 책은 출판사로부터 도서 지원을 받아 주관적으로 작성한 것입니다."
105775371,"하루 한 장 철학 읽기, 데일리 필로소피",10,https://sarak.yes24.com/review/15733473,"『데일리 필로소피』라는 제목처럼 이 책은 매일매일 한 장씩 읽기 좋은 철학서예요. 딱딱하고 거창한 철학서가 아니라 일상속에서 잠시 짬을 내어 읽을 수 있도록 철학자들의 명언을 제시하고 아래에 그 나름의 해석을 제시합니다.

아우렐리우스, 에픽테토스, 세네카로부터 이어져 온 스토아 철학은 '실천이자 삶을 바꾸는 동력'입니다. 그들의 명언을 현대의 우리 삶에 어떻게 적용해야 할지 읽다 보면 조용한 깨달음을 얻을 수 있어요. 일년을 4분기로 나눠 1월부터 12월까지 매일 한 장씩 읽을 수 있도록 구성되어 있는데요. 짧지만 그 안에 담긴 글은 많은 생각을 하게 해 줍니다.

작가는 이러한 사색을 통해 '삶의 이유'와 '목적'을 찾고 '자신만의 분명한 삶의 방향을 찾기 바란다'며 '당신이 마주한 문제들의 답을 찾는다는 단 하나의 목적을 위해' 이 책이 쓰여졌다고 이야기합니다.

매일 아침 철학 한 문장, 일상 속 사유의 시간을 갖게 하는 책이에요.

1부. 철학자처럼 아침을 시작하는 법

2부. 나를 지키면서도 단단하게 관계 맺기

3부. 지치고 불안한 마음에 용기를 더하는 말들

4부. 매일 저녁, 나의 하루를 의미 있게 만드는 질문들

목차

각 장에서 마음에 남았던 글귀들을 적어봅니다.

시간의 작은 조각들이 자연에 순응하며 흘러가면, 마치 잘 익은 올리브 한 알이 땅에 떨어지는 것처럼 우리의 마지막 안식처가 우아하게 다가온다. 이 모든 생명을 기른 대지를 찬미하라. 우리를 키워준 나무들에게도 감사하라.

-마르쿠스 아우렐리우스, 명상록 중.

자연의 순리에 따라 세상을 바라보면 죽음 속에도 아름다움이 깃들어 있다.

죽음 속에 깃든 아름다움 중에서

생의 마지막이 다가올 때, 이처럼 감사함과 아름다움을 느낄 수 있다면 좋겠습니다.

시상대와 감옥은 전혀 다른 곳이야. 하나는 높고 하나는 낮지. 하지만 이 두 장소 모두 우리가 자유롭게 선택한 일의 결과에서 비롯된다네.

-에픽테토스, 대화록 중.

그 어떤 상황에 부닥쳤든 중요한 것은 이것이다. 선택의 자유. 우리가 누구이든 또 어디에 있든 무엇을 선택하느냐가 가장 중요하다.

선택이 운명을 결정한다 중에서.

인생은 매순간 선택의 연속이지요. 어떤 선택을 하는지는 오롯이 자신의 몫.

부디 그 선택이 올바른 방향으로 나아갈 수 있기를 바라요.

당신은 선한 사람에게서 선함을 배울 수 있다. 하지만 악한 사람과 어울리면 당신의 영혼까지 파괴될 것이다.

-무소니우스 루푸스, 메가라의 테오그니스에서 인용.

우리는 삶에 누구를 초대할 것인지 항상 고민해야 한다. 내 삶에 초대하는 사람들은 나 자신의 삶을 풍요롭게 만들 수 있는 사람이어야 한다. 괴테는 이어서 이렇게 말한다. ""당신이 시간을 어떻게 보내는지 알게 되면 당신이 무엇이 될 것인지 말해 줄 수 있다.""

누구를 나의 삶에 초대할 것인가 중에서.

내 곁에 있는 이들을 하나하나 떠올려 봅니다. 나이가 들수록 곁에 두고 싶은 사람과 그렇지 않은 사람, 나도 모르게 정해 놓은 기준으로 호불호가 명확하게 갈리는 것 같아요. 앞으로의 내 삶에 어떤 이들을 초대하게 될까요. 또 어떻게 시간을 보내게 될까요.

나는 다른 무엇보다 인간이 자기 자신을 가장 사랑한다는 것에 놀라고는 한다. 그럼에도 인간은 자신에 대해서만큼은 자신의 판단보다 다른 사람의 판단을 더 신뢰한다. (…) 어떻게 나의 생각이 아니라 다른 사람의 판단을 더 신뢰할 수 있다는 말인가.

-마르쿠스 아우렐리우스, 명상록 중.

어떤 일에 대한 다른 사람의 생각을 알기 위해 너무 많은 시간을 소비하지 말라. 내가 생각하는 것이 무엇인지 알기 위해 노력하라. 결과에 대해 생각하는 대신 가져올 효과에 대해, 그리고 그것이 옳은 일인지 아닌지에 대해 더 생각하라.

신경 끄기의 기술 중에서

남들이 나를 어떻게 볼지, 타인의 시선에 많이 좌지우지 되는 경우가 있지요. 남들의 평가가 스스로의 평가보다 중요하게 느껴질 때도 분명 존재합니다. 하지만 이 글처럼 가장 중요한 것은 내가 무엇을 생각하는지 일 거예요.

더 이상 방황하지 마라. 그렇지 않으면 너 자신의 비망록도, 고대의 역사도, 노년에 읽기 위해 수집해 놓은 문집도 읽을 수 없을 것이다. 삶의 목적에 충실하라. 헛된 희망일랑 던져 버리고 너 자신을 구원하기 위해 움직여라. 너 자신을 돌보고 싶다면 할 수 있는 동안 하라.

-마르쿠스 아우렐리우스, 명상록 중.

남겨진 시간이 얼마나 되는지 우리는 알지 못한다. 내일 무엇이 기다리고 있을지도 모른다. 바라는 것이 있다면, 신께 기도하는 것이 아니라 행동으로 실천에 옮겨야 한다.

지금 바로 시작하라 중에서

신께 기도하는 일, 물론 중요합니다만 행동을 하지 않는다면 과연 이루어질 수 있을까요. 기도하는 마음과 동시에 실천하는 행동력이 있어야겠어요.

명언과 함께 부연해준 글들을 통해 잠시나마 생각에 잠길 수 있는 책이었습니다.

매일 아침, 철학 한 문장 읽고 생각하는 시간을 갖는다면 좋을 것 같아요.

이상으로 리뷰를 마칩니다.

감사합니다.

*출판사로부터 도서를 제공받았습니다."
105775371,데일리 필로소피,10,https://sarak.yes24.com/review/15731459,"하루 루틴에 하나의 항목이 추가되었다. 바로 QT 하듯 '매일 아침 철학 한 문장 읽기'다. 미라클 모닝하면서 아침 시간에 여유를 확보하고 아침을 깨우는 말씀에 이어 실용적인 지혜로 채우고자 시작한다. 『데일리 필로소피』는 스토아 학파 철학자들의 명문장을 하루에 한 문장씩 소개하며 삶에 적용시키기를 권하기에 아침을 여는 철학책으로 안성 맞춤이다.

지난 봄 『스토아 수업』으로 우리의 삶에 철학을 깊숙이 스며들게 한 저자 라이언 홀리데이는 매일 하루에 한 문장씩 소개하며 삶에 적용하기 쉽도록 해설을 더한 신작 『데일리 필로소피』로 돌아왔다. 저자는 기계적인 반복을 타파하기 위해서 철학을 공부해야 한다고 강조한다. 1년의 주기에 맞춰서 1분기를 철학자처럼 아침을 시작하는 법으로 시작해 나를 지키면서도 단단하게 관계 맺기, 지치고 불안한 마음에 용기를 더하는 말들, 매일 저녁 나의 하루를 의미있게 만드는 질문들로 분기별로 나누어 자신을 돌아보고 단단하게 만들어 가도록 구성했다.

""철학은 이때 시작된다.

자신의 지배적 도덕원칙에 관해 분명하게 인식하기 시작할 때.""

-에픽테토스, 대화록, 1.26.15

이처럼 철학은 인간을 인도하는 합리성을 훈련하고자 할 때, 감정과 믿음 그리고 누구나 인정하는 진리에 의문을 품게 되었을 때 비로소 철학이 시작된다고 한다. p.75

여전히 수많은 이가 스토아 철학을 찾는 이유는, 스토아 철학은 추상적이고 관념적인 가치가 아니라 일상을 살아가는 데 쓸모있는 실용적인 답을 찾는 학문으로 오늘날에도 여전히 유효하기 때문이다. 데일리 필로소피는 이미 익숙한 문장들이지만, 주옥같은 문장들이라 여전히 한번에 소화하기는 버겁다. 다시 하나하나 곱씹으면서 소화시키고 싶어 성경책과 함께 침대 맡에 자리해 놓았다.

황제가 되려고 하지 말라. 권력에 물들지도 말라. 이런 일은 당신에게도 일어날 수 있다. 그러므로 단순하고, 선량하고, 순수하고, 품위있고, 가식 없는 사람이 되도록 노력하라. 정의의 친구가 되고, 신을 공경하고, 자애롭고 다정하며, 맡겨진 임무에 최선을 다하는 사람이 되도록 하라. 철학을 공부하면서 희망했던 사람이 되고자 최선을 다하라. 신을 두려워하고 이웃을 돌보라. 인생은 짧다. 우리가 삶에서 거둬들여야 하는 수확물은 건강한 인격과 공공의 선을 위한 행동이다. -마르쿠스 아우렐리우스 명상록,6.30 p.112

마르쿠스 아우렐리우스는 우리가 알다시피 황제이자 당대 최고의 부자였으며 가장 강력한 군대를 이끄는 장군으로 로마 시민에게 신으로 추앙받던 인물이었다. 그의 명상록은 끊임없이 자신을 성찰하였기에 권력과 부의 정점에서 자신의 자리를 지킬 수 있었음을 보여준다.

우리가 정점에 이르고자 하는 이유는 자유를 얻기 위함이지만, 정작 성공과 부의 정점에 이른 이들의 삶을 살펴보면 그들의 성취는 자유의 댓가임을 목도하게 된다. 내가 진정 원하는 것은 무엇이고, 나는 무엇을 위해 달려가고 있는걸까. 나의 삶이 좋은 습관으로 채워져 보다 유익한 삶이 되길 바라며 스토아 학파의 기본 원칙을 되새겨 본다.

★스토아 학파의 기본 원칙★

- 정확하게 인식하라

- 적절하게 행동하라

- 통제할 수 없는 것들은 기꺼이 받아들여라"
