goods_no,review_title,rating_score,origin_url,review_text
109005292,짱깨주의의 탄생,10,https://sarak.yes24.com/review/18262996,"<짱깨주의의 탄생>은 한국 사회에서 짱깨주의라는 중국인을 비하하는 인식이 어떻게 형성되고 퍼지는지를 다루는 책입니다. 이 책은 한국과 중국의 역사적인 관계와 미국의 중국봉쇄 전략 등을 분석하면서 짱깨주의가 어떻게 일상적이고 구조화된 현상으로 나타나는지 설명합니다.

저자는 짱깨주의가 혐오 사회의 일환으로서 중국과 중국인에 대한 인식을 의도적으로 왜곡하고 부정적으로 편향시킨다고 지적합니다. 이러한 인식은 한국 사회의 다양한 영역에서 작용하며, 중국과 관련된 문제를 판단할 때 사실에 기반하지 않고 단순히 중국을 나쁘다고 결론지을 수 있는 프레임을 형성합니다.

또한, 저자는 중국의 부상과 미국의 중국봉쇄 전략 등에 대해 다루면서 미국과 중국 간의 관계 변화와 이에 따른 한국의 입장을 분석합니다. 그리고 짱깨주의가 한국 사회에서 일상화되고 구조화되는 과정과 한국 진보주의의 중국 담론의 변화를 살펴봅니다.

이 책은 중국 혐오에 대한 비판적인 시각을 제시하고, 한국 사회가 짱깨주의 프레임을 넘어 평화체제를 추구해야 한다는 주장을 전합니다. 저자는 평화체제의 관점에서 중국과 중국인을 바라보고, 서로 다른 방식으로 세계를 꿈꾸는 평화주의의 필요성을 강조합니다.

이 책은 중국과 한국 간의 관계, 한국 사회의 인식과 프레임에 대해 다양한 관점을 제시하고, 현실을 바라보며 새로운 방향을 모색하는데 도움을 줍니다. 중국과 중국인에 대한 올바른 이해와 상호 협력을 통해 동북아 평화체제를 구축하는 데에 관심이 있는 독자들에게 유익한 책입니다."
